user_input,retrieved_contexts,response,faithfulness,answer_relevancy,response_time,reranker,summarizer
What are important drug interactions with dolutegravir?,"['# Kenya HIV Prevention and Treatment Guidelines, 2022\n\n## Annex 13 C: Drug-Drug Interactions – INSTIs\n\n| Drugs Affected    | Dolutegravir (DTG)                                                                                                                                                                                                                                                                                                                                    | Raltegravir (RAL)                                                                                                                                                                                                           |\n| ----------------- | ----------------------------------------------------------------------------------------------------------------------------------------------------------------------------------------------------------------------------------------------------------------------------------------------------------------------------------------------------- | --------------------------------------------------------------------------------------------------------------------------------------------------------------------------------------------------------------------------- |\n| Efavirenz         | Co-administration not recommended because EFV decreases levels of DTG. If must be used together then increase DTG to 50 mg BD when co-administered with EFV.                                                                                                                                                                                          | Efavirenz decreases RAL plasma levels but it is unlikely to be clinically significant                                                                                                                                       |\n| Etravirine        | Co-administration not recommended because ETR decreases levels of DTG, unless used in combination with a PI/r (which counteracts the interaction between DTG and ETR)<br/><br/>If must be used together without a PI/r then increase DTG to 50 mg BD when co-administered with ETR. If used together with a PI/r then standard dose DTG is sufficient | Etravirine decreases RAL plasma levels so co-administration when using once-daily RAL is not recommended. Co-administration when using standard BD RAL dosing is acceptable                                                 |\n| Rifampicin        | Increase DTG to 50 mg BD when co-administered with rifampicin (for children, use double the standard weight-based DTG dose by administering twice daily).<br/><br/>There is no known drug interaction between DTG and rifabutin.                                                                                                                      | Increase RAL to 800 mg BD when co-administered with rifampicin (for children, use double the standard weight-based RAL dose).<br/><br/>Rifabutin may alter RAL plasma levels but it is unlikely to be clinical significant. |\n| Rifapentine       | Potential decreased DTG levels when co-administered with once-weekly rifapentine – no dose adjustment required unless viral load becomes detectable, in which case increase DTG to twice daily until two weeks after completion of rifapentine-based TPT                                                                                              | Potential increased RAL levels when co-administered with once-weekly rifapentine – no dose adjustment required but monitor for RAL toxicity                                                                                 |\n| Bedaquiline (BDQ) | No interactions expected                                                                                                                                                                                                                                                                                                                              | No interactions expected                                                                                                                                                                                                    |\n| Delamanid (DLM)   | No interactions expected                                                                                                                                                                                                                                                                                                                              | No interactions expected                                                                                                                                                                                                    |\n| Metformin         | DTG may increase metformin plasma levels so metformin dose may need to be decreased. Limit daily metformin dose to 1,000mg.<br/><br/>DTG does NOT require a dose adjustment is when used with metformin.                                                                                                                                              | No interaction                                                                                                                                                                                                              |\n\n\n\n\n\n\n# Annexes\n\n## Annex 13 C: Cont.\n\n| Drugs Affected                                                                                                                    | Dolutegravir (DTG)                                                                                                                                                                                                                                                                                                               | Raltegravir (RAL)                                                        |\n| --------------------------------------------------------------------------------------------------------------------------------- | -------------------------------------------------------------------------------------------------------------------------------------------------------------------------------------------------------------------------------------------------------------------------------------------------------------------------------- | ------------------------------------------------------------------------ |\n| Anticonvulsants<br/>-Carbamazepine<br/>-Phenobarbital<br/>-Phenytoin                                                              | Avoid use of DTG with carbamazepine, phenobarbital, or phenytoin because they decrease DTG plasma levels.<br/><br/>If the DTG must be used in combination with any of these anticonvulsants than increase DTG dose to 50mg BD and monitor viral load.                                                                            | No interaction                                                           |\n| Mineral supplements and antacids containing cations (e.g., calcium, iron, zinc, magnesium, aluminum), including prenatal vitamins | Administer DTG at least 2 hours before or 6 hours after taking any of these supplements (note: if taking DTG with a meal then it is safe to take at the same time as prenatal vitamins, calcium, or iron)<br/><br/>There are no drug-drug interactions between DTG and proton pump inhibitors or H2 blockers used for gastritis. | Do not use calcium, magnesium and aluminum containing antacids with RAL. |\n| Methadone                                                                                                                         | No interaction                                                                                                                                                                                                                                                                                                                   | No interaction                                                           |', '# Table 6.4 Cont.\n\n# Pregnancy Safety of DTG\n\n- DTG is safe during pregnancy and breastfeeding. Pregnancy intention should be discussed with all women initiating ART regardless of regimen. Women who do not wish to become pregnant should be offered appropriate family planning counseling and methods.\n\n# Important Drug Interactions with DTG\n\n- Rifampicin\n- Rifampicin lowers DTG levels: increase DTG to 50 mg twice daily for patients on rifampicin who are > 20 kg in body weight. Children &#x3C;20 kg taking DTG who require rifampicin should increase their weight-appropriate DTG dose to twice daily.\n- There are no significant drug interactions between DTG and other currently used anti-TB medications (including for MDR-TB).\n- Mineral supplements, including: antacids containing calcium, zinc, magnesium or aluminum; iron supplements; prenatal vitamins (which contain iron and calcium)\n- These supplements decrease the absorption of DTG: administer DTG at least 2 hours before or 6 hours after taking any of these supplements.\n- Dose separation is not required for calcium and iron supplements (including prenatal vitamins) if DTG is taken with a meal.\n- It is critical to educate patients about this important drug interaction because many patients get these supplements and antacids over-the-counter without informing their healthcare provider.\n- Carbamazepine, phenobarbital, phenytoin\n- These anticonvulsants decrease DTG levels: use a different anticonvulsant if available.\n- If DTG must be co-administered with these drugs then increase to DTG to twice daily, although there is little data to guide this.\n- If valproic acid is available this can be used with DTG without dose adjustment.\n- Metformin\n- DTG increases levels of metformin; the levels of DTG are not affected: use a lower dose of metformin (often 50% of usual dose) and monitor glycemic control. Use a maximum daily dose of metformin 1 g.\n- Other drug-drug interactions with DTG\n- See Annex 13C.\n\n\n\n# 6.5 Monitoring and Changing ART\n\nThe objectives of clinical and laboratory monitoring during ART are to identify and treat inter-current illnesses, assess for and manage adverse drug reactions, and evaluate response to treatment. Routine laboratory monitoring recommendations are described in Table 3.5; however, additional investigations should be ordered whenever there is clinical suspicion for which a laboratory test result may alter patient management.\n\nIndications for changing ART include optimizing therapy for patients who have undetectable viral load, managing adverse drug reactions or toxicity, drug-drug interactions, co-morbidities and treatment failure.\n\n# 6.5.1 Optimizing Therapy for Patients who have suppressed viral load on First Line ART\n\nPatients who are virally suppressed on first line ART may benefit from regimen optimization even if they are currently tolerating their regimen well and have no drug-drug interactions requiring a change. Regimen modifications may be done for age/weight transitions among children and adolescents &#x3C;15 years and to simplify a regimen, prevent long-term toxicity and improve cost-effectiveness. Dolutegravir has been shown to have superior tolerability and efficacy compared to efavirenz and lopinavir and is now preferred as part of first line ART for children, adolescents and adults. While most adults in Kenya have switched over to a DTG-containing regimen, proactive switching of children is now also recommended with the availability of a pediatric dispersible dolutegravir tablet.\n\nChildren and adolescents with suppressed viral load on first line ART and not on the recommended first line regimen as per Table 6.2 should be considered for optimization as per Figures 6.1 and 6.2, such as when children grow and enter a new weight band. This also includes PLHIV who recently initiated non-standard therapy (less than 3 months ago, before the first VL is due). Decisions on regimen modification should be made following discussion with the patient/caregiver.\n\nAlways discuss the possibility of new side effects when changing to a new ARV, particularly side effects common to all ARVs (headache, nausea, diarrhea) and any side effects specific to the new ARV. Reassure patients that most side effects resolve with continued use after 1-2 weeks.', '# 6.4 Dosing and Administration of Dolutegravir (DTG)\n\nDTG is preferred in first line ART (in combination with other ARVs) for children, adolescents and adults. DTG is well tolerated, highly efficacious, has a high genetic barrier to resistance and fewer drug-drug interactions.\n\nRecommended Dosing of DTG\n● &#x3C; 20 kg body weight: Use weight-based dosing with dispersible 10mg DTG tablets as per Annex 10\n● ≥ 20 kg body weight: DTG 50 mg film-coated tablet once daily, preferably as a morning dose. It is also available as part of FDC. Those unable to swallow the film coated tablets whole refer to Annex 10\n● For patients taking rifampicin: Increase DTG dosing frequency to twice daily for duration of rifampicin-containing TB treatment and for an additional 2 weeks after TB treatment is completed, then revert to once daily. (The additional 2 weeks of higher-dose DTG is to counter the ongoing liver enzyme induction effect of rifampicin, which continues for a short period after TB treatment is completed)\n● For patients with suspected or confirmed INSTI resistance (e.g., patients with prior history of failing a RAL-based regimen): use DTG twice daily\n● DTG can be taken with or without food\n\n# Common Side Effects of DTG\n\n- The most common side effects of DTG are headache, nausea and diarrhea. These side effects usually resolve after continued use for 1-2 weeks. It is critical to inform patients / caregivers about these potential side effects and their temporary nature, and encourage them to continue their ART and consult a HCW if concerned.\n- Some patients on DTG are more likely to develop insomnia. This may be reduced by taking DTG as a morning dose, or by taking DTG with a low-fat meal or on an empty stomach.\n- DTG may cause a small rise in serum creatinine levels but this does NOT represent a true decline in renal function.\n- Integrase inhibitors, including DTG, are associated with increased weight gain. Counsel patients about healthy eating and physical activity and the benefits of maintaining a healthy weight.\n\n1 For other scenarios that are not covered in this table, discuss as an MDT and consult the Regional or National HIV Clinical TWG (Uliza Hotline 0726 460 000; https://nhcsc.nascop.org/clinicalform)\n\n2 ABC hypersensitivity reaction (AHR) is rare in the Kenyan population. Table 6.9 provides the definition and management of AHR\n\n3 The additional 2 weeks of higher-dose DTG is to counter the ongoing liver enzyme induction effect of rifampicin, which continues for a short period after TB treatment is completed\n\n4 TAF may become the preferred NRTI once fixed-dose combinations are available\n\n5 DTG/3TC dual therapy may be considered for HBV-negative patients once fixed-dose combinations are available']","Important drug interactions with dolutegravir (DTG) include:

- **Efavirenz**: Decreases DTG levels; increase DTG to 50 mg twice daily if used together.
- **Etravirine**: Not recommended without a protease inhibitor/ritonavir; otherwise, increase DTG to 50 mg twice daily.
- **Rifampicin**: Lowers DTG levels; increase DTG to 50 mg twice daily for patients over 20 kg, and adjust for children under 20 kg.
- **Rifapentine**: Potentially decreases DTG levels; increase DTG to twice daily if viral load becomes detectable.
- **Anticonvulsants (Carbamazepine, Phenobarbital, Phenytoin)**: Decrease DTG levels; avoid use or increase DTG to 50 mg twice daily if necessary.
- **Mineral Supplements and Antacids**: Decrease DTG absorption; administer DTG 2 hours before or 6 hours after these supplements, unless taken with a meal for calcium and iron.
- **Metformin**: DTG increases metformin levels; consider reducing metformin dose to a maximum of 1,000 mg daily.

No significant interactions with other anti-TB medications or methadone.",1.0,0.9645169828191099,20.42,llm,gpt-4o
How should PrEP be provided to adolescent girls?,"['# 11. Pre-Exposure Prophylaxis (PrEP)\n\nPre-exposure prophylaxis (PrEP) is the use of antiretroviral medication to prevent the acquisition of HIV infection by an uninfected person at ongoing risk of acquiring HIV infection.\n\nPrEP is recommended for use as follows:\n\n- Daily Oral PrEP for all individuals, irrespective of gender or sexual orientation who are at risk of HIV infection.\n- Event-Driven (ED) PrEP is currently recommended for all people born male who are not taking exogenous estradiol-based gender affirming hormones\n\n## 11.1 Indications for PrEP and Criteria for Eligibility\n\n### 11.1.1 Indications for PrEP\n\nPrEP is indicated for;\n\n- HIV uninfected persons at ongoing risk of HIV acquisition\n- Some risk situations that place one at ongoing risk include individuals or sexual partner/s who is/are:\n  - HIV positive and: not on ART, or on ART < 6 months, on ART with viral non-suppression, or on ART with suspected poor adherence\n  - In sero-discordant relationships trying to conceive\n  - Of unknown HIV status and at high-risk of HIV infection\n  - Engaging in transactional sex or sex work\n  - With history of recent or current sexually transmitted infections\n  - With recurrent use of Post-Exposure Prophylaxis\n  - With a history of sex whilst under the influence of alcohol or recreational drugs\n  - Inconsistent or no condom use or unable to negotiate condom use during intercourse with persons of unknown HIV status\n  - Using injection drugs where needles and/or syringes are shared\n\n### 11.1.2 HIV Risk Assessment\n\nClients accessing health services should be screened for HIV risk and additionally provided with information on HIV prevention options available including the availability of PrEP. This is in addition to the use of HIV testing services (HTS), as clients are assessed for HIV risk before testing.\n\nThe risk assessment questions are enquiry of behavioural practices that may expose an individual to HIV (Table 11.2).\n\nA simple Risk Assessment Tool (RAST) is provided to guide the provider in generating a conversation about HIV risk. Screening for HIV risk should be integrated within other service delivery points. HIV negative individuals who answer ""yes"" to any of the screening questions\n\n\n# Table 11:1 HIV Screening questions\n\nScreening question refer to the past 6 months &#x26; include;\n\n- “Have you had sex with more than one person?”\n- “Have you had sex without a condom?”\n- “Have you had sex with anyone whose HIV status you do not know?”\n- “Are any of your partners at risk of HIV?”\n- “Have you had sex with a person who has HIV?”\n- “Have you received a new diagnosis of a sexually transmitted infection?”\n- “Do you desire pregnancy?”\n- “Have you used or wanted to use PEP or PrEP for sexual exposure to HIV?”\n- “Have you injected drugs that were not prescribed by healthcare provider? If yes, did you use syringes, needles or other drug preparation equipment that had already been used by another person?”\n- “Have you received money, housing, food or gifts in exchange for sex?”\n- “Have you been forced to have sex against your will?”\n- “Have you been physically assaulted, including assault by a sexual partner?”\n\n# 11.1.3 Criteria for PrEP Eligibility\n\nTo be eligible for PrEP, individuals identified to be at risk of HIV infection from Risk Assessment must meet ALL the following criteria prior to initiating PrEP.\n\n- Confirmed HIV negative status through rapid antibody testing following the HTS algorithm.\n- Determine if the client is willing to take PrEP as prescribed. (This is done by adherence education and counselling on the PrEP regimen to be given, and assessing the client’s readiness to follow the regimen.)\n- Does not have a current or recent (within the past one month) illness consistent with acute HIV infection (fever, sore throat, muscle or joint pains, swollen glands, diarrhoea or headache) in combination with a preceding high-risk exposure for HIV.\n- No contraindication to use of any of the ARVs recommended for PrEP e.g., TDF +/- FTC (or 3TC) for those who choose oral PrEP.\n- Renal or liver disease\n- Clients with renal and liver disease should receive further clinical and laboratory tests, to determine the renal/liver function and extent of disease.\n\n# Other important factors for screening\n\n1. Gender based violence (GBV) screening: All clients accessing PrEP must be screened for gender-based violence, especially intimate partner violence (IPV), and appropriate intervention offered or client linked to appropriate.\n2. Mental Status Assessment: Psychological issues that may influence adherence should be assessed and addressed. It is important to carry out basic mental health evaluation and offer appropriate referral as necessary.', '# Table 11.7 Cont: Summary of PrEP Initial and Follow-up Assessment\n\nDuring every visit\n\n- Assess adherence\n- Reassess risk of HIV infection and offer risk reduction counselling\n- HIV testing should be repeated at month 1 and thereafter, every 3 months (this applies for both daily and Event driven PrEP)\n- Assess for adverse effects\n\n# 11.5 Contra-indications to Oral PrEP (daily or ED PrEP)\n\n- HIV infection or suspected acute HIV infection (i.e., flu-like symptoms in the last 4 weeks in combination with a preceding high-risk exposure for HIV)\n- Adolescents &#x3C; 35 kg or age &#x3C; 15 years\n- Impaired renal function (estimated creatinine clearance of &#x3C;50 ml/min)\n- Unable or unwilling to adhere to prescribed PrEP or follow-up schedule.\n\n# 11.6 Criteria for Discontinuing Oral PrEP\n\nPrEP should be discontinued if ANY of the following criteria are met.\n\n- Positive HIV test during follow up.\n- Change in risk status (no ongoing risk)\n- Renal dysfunction with creatinine clearance below 50 ml/min\n- Client request to stop.\n- Sustained non-adherence.\n\nDiscontinuing daily oral PrEP: Users discontinuing PrEP due to no ongoing risk or requesting to stop should continue PrEP for at least 7 days after the last potential exposure to HIV. Reasons for discontinuation should be documented in the client’s record.\n\nDiscontinuing event–driven PrEP: Event-driven PrEP can be stopped after two daily doses following the last sexual exposure.\n\n# 11.7 Restarting PrEP\n\nAny client restarting PrEP regardless of the preferred method should be assessed for HIV status and a rapid HIV test conducted:\n\n- Daily Oral PrEP: Clients who stop PrEP for more than 7 days and wishes to restart should be assessed for resumption of PrEP similar to the assessment done for an initial (first) visit. Importantly, conduct a HIV test before re-starting PrEP. If a high-risk exposure occurred in the previous 7 days (i.e., acute HIV infection is suspected), defer PrEP and obtain repeat HIV test after 4 weeks; if negative, PrEP can be prescribed if the other criteria are fulfilled. The use of condoms should be recommended during the waiting period.\n- Event driven Oral PrEP: Clients who have stopped PrEP for more than a week and who are restarting ED-PrEP should commence with a double dose (two pills) of PrEP as new initiators. Risk assessment should be conducted. If a high-risk exposure occurred in the previous 7 days (i.e., acute HIV infection is suspected), defer PrEP and obtain repeat HIV\n\n# 11.8 Improving adherence to PrEP\n\nApproaches to improve adherence include:\n\n- Encourage ring users to keep ring in place continuously through the 28-day period from initial insertion\n- Disclosure of PrEP use to a partner or trusted person\n- Use of reminder devices like a cell phone alarm.\n- SMS reminders where available and feasible\n- Exploring and mitigation of other barriers to adherence\n- Peer support\n\n# 11.9 Monitoring Sero-conversion among PrEP users\n\nPrEP substantially reduce the risk of HIV acquisition. The efficacy of PrEP is correlated with adherence. Sero-conversion during use of PrEP should be monitored critically as it is increasing the risk of developing drug resistance if clients continue the use of PrEP while HIV infected.\n\nFactors that lead to HIV seroconversion among PrEP sero-converters include:\n\n- Inconsistency in use of PrEP (non-adherence).\n- Social-behavioral factors e.g., poverty, HIV stigma and relationship status that may affect the ability to use PrEP as prescribed.\n- Possible infections with drug resistant strains\n\n# What should be done upon identification of a PrEP sero-converter?\n\nHIV testing among PrEP should be conducted consistently as per the algorithm. Identification of new HIV positive diagnosis among PrEP users should be followed with:\n\n- Immediate discontinuation of PrEP\n- Counselling of client on positive results\n- Linkage to care and ART (immediate ART initiation).\n- Assessment of barriers to adherence that may affect use of ART.\n- Document sero-conversion in client file, PrEP registers, and monthly reporting as required.', '## 11.2.2 Pre-initiation client education\n\nThe following components should be discussed prior to PrEP initiation:\n\n### Table 11.3: Client Education Checklist\n\n| Topic                                                                                                                                                                                                                                                                                                                                                                                                                                                                                                                                                                                                                 | Check |\n| --------------------------------------------------------------------------------------------------------------------------------------------------------------------------------------------------------------------------------------------------------------------------------------------------------------------------------------------------------------------------------------------------------------------------------------------------------------------------------------------------------------------------------------------------------------------------------------------------------------------- | ----- |\n| ✔ Explain how PrEP works as part of combination HIV prevention                                                                                                                                                                                                                                                                                                                                                                                                                                                                                                                                                        | ✔     |\n| ✔ Explain the need for baseline and follow-up tests including regular HIV testing                                                                                                                                                                                                                                                                                                                                                                                                                                                                                                                                     | ✔     |\n| ✔ Explain PrEP use: include the following: (refer to the different types of PrEP available for details)- The medications used (show the client the pills or other PrEP options\n- How the medications are used (frequency of dosing for the various options)\n- Number of doses required to achieve efficacy (7 doses for daily oral PrEP, loading dose for event driven oral PrEP)\n- What to do when doses are missed (continue for daily doses)\n- Discontinuation of PrEP, how and when it can be discontinued.\n- Side effects and what to do in case these are experienced (including when to consult the clinician) | ✔     |\n| ✔ Discuss what to do in case client experiences symptoms of seroconversion (acute HIV infection)                                                                                                                                                                                                                                                                                                                                                                                                                                                                                                                      |       |\n| ✔ Discuss the Limitations of PrEP- PrEP reduces but does not eliminate the risk of acquiring HIV.\n- PrEP does not prevent pregnancies and STIs.                                                                                                                                                                                                                                                                                                                                                                                                                                                                       | ✔     |\n| ✔ Risk reduction counselling and support education- Managing mental health needs\n- Couple counselling\n- Access to, and consistent use of condoms and lubricants\n- Access to and need for frequent HIV testing.\n- Early access to ART\n- VMMC\n- STI screening and treatment\n- Harm reduction for PWID                                                                                                                                                                                                                                                                                                                   | ✔     |\n\n\n## 11.3 Recommended ARVs for PrEP\n\nThe preferred ARV regimen is Tenofovir 300mg/ Emtricitabine 200mg (TDF/FTC) given as one fixed dose combination (FDC) tablet orally daily.\n\n\n\n# Table 11.4: Antiretrovirals for Use in PrEP\n\n| PrEP Dosing Strategies | Preferred                                                                                                                                                                                                                | Alternative                                                                                                                                                                                                              |\n| ---------------------- | ------------------------------------------------------------------------------------------------------------------------------------------------------------------------------------------------------------------------ | ------------------------------------------------------------------------------------------------------------------------------------------------------------------------------------------------------------------------ |\n| Daily Oral PrEP        | TDF/FTC (300 mg/200 mg) as FDC once daily                                                                                                                                                                                | TDF/3TC (300 mg/300 mg) as FDC once daily                                                                                                                                                                                |\n| Event Driven Oral PrEP | TDF/FTC (300 mg/200 mg) as FDC – two pills taken between 2 and 24 hours in advance of anticipated sex; then, a third pill 24 hours after the first two pills and a fourth pill 48 hours after the first two pills; 2-1-1 | TDF/3TC (300 mg/300 mg) as FDC – two pills taken between 2 and 24 hours in advance of anticipated sex; then, a third pill 24 hours after the first two pills and a fourth pill 48 hours after the first two pills; 2-1-1 |\n\n\n*Recommended Long-acting Products: These products are at different stages of approval and availability in Kenya. The Ministry of Health will issue specific implementation guidelines when they become available.\n\n| \\*Long Acting Cabotegravir Injection | Initiation injections: 600 mg Intramuscular (IM) x 2 doses given 1 month apart (the second initiation injection can be given up to 7 days before or after the date scheduled to receive injection)<br/><br/>THEN<br/><br/>Continuation injections: 600 mg IM every 2months |\n| ------------------------------------ | -------------------------------------------------------------------------------------------------------------------------------------------------------------------------------------------------------------------------------------------------------------------------- |\n| \\*Dapivirine vaginal ring            | Dapivirine vaginal ring, 25mg, inserted vaginally every 28 days.                                                                                                                                                                                                           |']","To provide PrEP to adolescent girls, ensure they are at least 15 years old and weigh at least 35 kg. Conduct a thorough HIV risk assessment and screen for gender-based violence and mental health issues. Prescribe the daily oral fixed-dose combination of Tenofovir 300mg/Emtricitabine 200mg (TDF/FTC), as event-driven PrEP is not recommended for adolescent girls. Educate them on PrEP's function, adherence importance, potential side effects, and limitations. Schedule regular follow-up visits for adherence assessment, risk reassessment, and HIV testing at month 1 and every 3 months. Monitor for adverse effects and renal function. Provide adherence support through disclosure encouragement, reminder devices, and peer support. Discontinue PrEP if the client tests positive for HIV, experiences renal dysfunction, or requests to stop, and reassess before restarting.",0.95,0.9640460052738472,29.99,llm,gpt-4o
When is cotrimoxazole prophylaxis indicated?,"['# 8. TB/HIV Co-infection, Prevention and Management\n\nTB is a leading cause of morbidity and mortality among people living with HIV. Reducing this burden of illness requires identifying TB early, providing pre-emptive and preventive treatment for TB, and providing optimal treatment for both HIV and TB. Timely initiation of ART in combination with TB Preventive Therapy are effective ways to reduce the burden of TB in PLHIV.\n\nAll PLHIV should receive counselling about the risk of acquiring TB, strategies for reducing exposure to TB, recognizing clinical manifestations of TB and seeking care promptly, the risk of transmission of TB to others and TB preventive therapy to prevent TB disease.\n\nHealthcare settings present suitable conditions for transmission of TB, particularly among vulnerable individuals like PLHIV. All healthcare settings should develop and implement TB infection control guidelines to reduce the risk of transmission of TB between patients, visitors and staff.\n\n# 8.1 TB Screening for PLHIV: Intensified Case Finding (ICF)\n\nTB screening and prevention services should be offered at every clinical visit. Symptom-based TB screening using the ICF tool MUST be performed at every clinic visit to rule out active TB; patients who screen positive (presumptive TB cases) must complete definitive diagnostic pathways (Figure 8.1 and Table 8.1) and patients who screen negative should be evaluated for TB preventive therapy (TPT).\n\nActive Case Finding (ACF) differs from ICF. ICF refers to TB screening among PLHIV, whereas Active TB case finding (ACF) refers to special efforts made by the NTP or other partners that go beyond passive TB case finding at health facilities, in which communities or population groups that are underserved or at higher risk of TB are actively reached for providing access to care, including screening and testing.\n\n\n\n\n\n# Intensified Case Finding Screening Questions\n\n<div style=""border: 1px solid green; padding: 10px;"">\n\n- If ""Yes"" to any question, take a detailed history, examine the patient and do sputum examination (sputum smear or GeneXpert)\n\n- If ""No"" to questions 1-5 above, consider TPT eligibility and work up for TB Preventive Therapy and repeat screening on subsequent visits\n\n- Questions 5 and 6 do not apply to adults\n\n</div>\n\nThe following are the intensified case finding screening questions:\n\n- Cough of any duration (Y/N)\n- Fever (Y/N)\n- Noticeable weight loss/ Failure to thrive/ Poor weight gain (Y/N)\n- Night sweats (Y/N)\n- Reduced playfulness/ Lethargy/ Irritability (Y/N)\n- Contact with a TB case (Y/N)', 'For further guidance, refer to the national guidelines on LTBI management.\n\n# 8.2.1. Indications for TPT\n\nTPT should be provided to those patients in whom TB is excluded (using the ICF tool) and meet the eligibility criteria to initiate TPT. The following client categories are eligible for TPT who screen negative for active TB:\n\n- All PLHIV above 12 months of age (children, adolescents and adults including pregnant and breastfeeding women)\n- All household contacts of persons with bacteriologically confirmed pulmonary TB\n- Prisoners and staff working in prison setting\n- Health care workers and other staff in health care setting\n- Other clinical risk groups as defined in LTBI guidelines\n\nNeonates born to mothers with TB, or exposed to close contacts with TB should be given TPT once TB disease has been ruled out. BCG should be given 2 weeks after completion of TPT or anti-TB treatment.\n\n# Summary of recommendations for TPT among the PLHIV\n\n- PLHIV are at a much higher risk of getting TB disease compared to the general population.\n- TB preventive therapy should be given to all PLHIV above 12 months of age who do not have active TB disease. This should be done irrespective of immune status, ART status, previous history of TB and pregnancy status.\n- Children aged &#x3C;12 months living with HIV who are household contacts of a person with bacteriologically confirmed pulmonary TB, and whom active TB has been ruled out should receive TB preventive therapy.\n- TPT may be given immediately following successful completion of TB treatment among the PLHIV.\n- Repeat TPT is not recommended among PLHIV except if a PLHIV becomes a household contact of a person with bacteriologically confirmed pulmonary TB.\n- PLHIV aged 15 years and above should be provided with 3 months of weekly Rifapentine and Isoniazid (3HP), while those less than 15 years are given 6 months of daily INH (6H).\n- In PLHIV on PI/r-based ART, pregnant women and those who do not tolerate 3HP should be given six months of daily INH (6H).\n- For eligible patients previously treated for TB, initiate TPT upon completion of their TB treatment.\n\n\n\n## 8.2.2. Contraindications to TPT\n\nPatients with the following should not receive TPT until the underlying issue(s) are addressed:\n\n- Active tuberculosis disease\n- Active hepatitis (acute or chronic)\n- Chronic alcohol abuse\n- Symptoms of peripheral neuropathy\n\n## 8.2.3. Dose and Duration of TPT\n\n### Table 8.3: Recommended TPT Regimens for PLHIV\n\n| Target populations                                                                                                                                                                                                                                                                                                                                                                      | TPT Regimen                                                                       |\n| --------------------------------------------------------------------------------------------------------------------------------------------------------------------------------------------------------------------------------------------------------------------------------------------------------------------------------------------------------------------------------------- | --------------------------------------------------------------------------------- |\n| * Adult PLHIV excluding patients on PI/r-based ARV regimens                                                                                                                                                                                                                                                                                                                             | Rifapentine and Isoniazid (3HP)<br/>Once weekly for three months<br/>*(12 doses)* |\n| - Adult PLHIV on PI/r-based ARV regimens\n- All CALHIV aged below 15 years\n- Any patient with intolerance or contraindication to 3HP\n- Pregnant women                                                                                                                                                                                                                                    | Isoniazid (6H)<br/>Once daily for 6 months                                        |\n| * The 3RH (rifampicin and isoniazid) regimen is not recommended for PLHIV due to drug- drug interactions\n* All TPT regimens should be given with Vitamin B6 (pyridoxine), if available, to reduce the risk of developing peripheral neuropathy\n* Comprehensive health education and adherence counselling should be conducted prior to initiation of TPT\n* Dosing of TPT is in Annex 10 |                                                                                   |\n\n\n- Children should be weighed at each visit and correct weight-based dosing confirmed.\n- Clients on 3HP should receive weekly dose of pyridoxine, Those on Rifapentine and Isoniazid regimen should be given pyridoxine once a week\n- The 3RH (rifampicin and isoniazid) regimen is not recommended for PLHIV due to drug-drug interactions. 3RH is used in HIV negative populations', 'Note that certain patient groups e.g., recent HIV infections, pregnant adolescent girls and young women, women with previous children with HIV infection, patients with high viral load at time of pregnancy confirmation, patients with poor social support systems, patients with history of default from care and those with active co-morbidities etc. may require additional adherence and psychosocial support\n\n# 7.2. Syphilis elimination for Pregnant and Breastfeeding Women and Infant Treatment\n\nThe country has adopted triple elimination of HIV, Syphilis and Hepatitis B among pregnant and breastfeeding women. It is recommended that all pregnant women attending ANC and not aware of their HIV status require a dual HIV syphilis test during their first trimester and a second HIV Syphilis test in the 3ʳᵈ trimester if the initial test was negative.\n\nAll women who test positive for syphilis at any point during pregnancy and breastfeeding should be treated with the appropriate regimen. (Table 7.3). All babies born of mothers who test positive for syphilis are suspected to be exposed to syphilis and should also be treated with the correct regimen (Table 7.3). Ensure to perform contact tracing for all the sexual contacts and ensure they are treated for syphilis.\n\nSymptoms of congenital syphilis may not become apparent for several weeks or months after birth.\n\n# 7.3. Hepatitis B elimination for Pregnant and Breastfeeding Women and Infant Prophylaxis\n\nRequires routine testing of pregnant women to identify women in need of antiviral treatment for their own health and additional interventions to reduce Mother to Child Transmission of viral hepatitis B.\n\nRegular screening should be done by incorporation of viral hepatitis screening as part of the ANC profile. This is recommended for Hepatitis B &#x26; C which pose a big risk to both the mother and fetus.\n\nFor pregnant and breastfeeding women who are found to be positive for HBsAg, offer appropriate treatment options of ARVs containing TDF/3TC or FTC containing regimens. This treatment also acts as prophylaxis for HBV transmission from mother to child. All pregnant and breastfeeding women without evidence of hepatitis B infection (HBsAg negative) should be vaccinated against hepatitis B. (Chapter 9).\n\nHIV positive infants without evidence of infection should be vaccinated against Hepatitis B. Infants born of mothers who test positive for HBsAG should be treated using Hepatitis B Immunoglobulin (Table 7.3).\n\nRefer to Chapter 9 for management of HIV/HBV coinfection.\n\n\n\n# Table 7.3: ARV Prophylaxis for HIV-Exposed Infants\n\n| Infant Scenario    | Infant Prophylaxis                                                                                                                                                                                                                                                                                                                                                                                                                                                                                                                                                                                                                                                                                                  | Maternal Scenarios                                                                                                                                                                                                                                                            |\n| ------------------ | ------------------------------------------------------------------------------------------------------------------------------------------------------------------------------------------------------------------------------------------------------------------------------------------------------------------------------------------------------------------------------------------------------------------------------------------------------------------------------------------------------------------------------------------------------------------------------------------------------------------------------------------------------------------------------------------------------------------- | ----------------------------------------------------------------------------------------------------------------------------------------------------------------------------------------------------------------------------------------------------------------------------- |\n| HIV Exposed Infant | * Infant prophylaxis\n\n  * AZT+NVP for 6 weeks, NVP + cotrimoxazole should be continued until 6 weeks after complete cessation of breastfeeding\n  * Infant prophylaxis can be discontinued after a minimum of 12 weeks on NVP if the child is not breastfeeding (death of mother or separation with mother)\n  * The infant prophylaxis regimen applies to all infants irrespective of age when identifying HIV exposure (e.g., mother diagnosed HIV-positive in the postpartum period)\n\n* DBS or whole blood for PCR at 6 weeks or first contact, following EID algorithm (Figure 2.1)\n\n* Birth testing (Figure 2.2) may be conducted in sites where point of care has been implemented and when medically indicated | - If mother not on ART, initiate ART as soon as possible (preferably same day)\n- If mother is on ART for ≥ 3 months and the VL is ≥ 50 copies/ml, intensify adherence, repeat the VL\n- If VL <50 copies/ml, continue current regimen\n- Follow Viral load algorithm Figure 6.6 |']","Cotrimoxazole prophylaxis is indicated for HIV-exposed infants, who should receive it until 6 weeks after breastfeeding cessation.",1.0,0.9259698154891471,29.25,llm,gpt-4o
What are the guidelines for ART failure?,"['# Section 6: Treatment failure\n\n- What happens if you stop taking ART:\n- When you stop taking ART the virus begins to increase in your body very quickly\n- The virus goes back to the same high level it was at before you started ART\n- What happens if you do not take ART regularly:\n- The virus begins to increase to high levels again\n- What happens if the viral load increases:\n- When the virus is allowed to increase again, it will also affect your immunity and reduce your CD4 count putting you at risk of opportunistic infections\n- When the virus is allowed to increase again, it can change and get stronger, and becomes resistance to the ART\n- When the virus becomes resistant, the ART does not work against the virus anymore\n- The risk of resistance increases by not taking the ART correctly and by starting and stopping the medications several times\n- When resistance occurs, this is called treatment failure\n- What happens in treatment failure:\n- The ART no longer works because the virus has become resistant to it\n- If treatment fails, it is necessary to use stronger, more expensive ART, but it still may not work as well\n- With the stronger ART you may need to take more pills every day, and you may have more side effects\n- If you become resistant to the new ART as well, then there may not be any drugs that can work for you, and the virus will increase quickly and your CD4 count will go way down\n- It is essential that you take your ART every day as prescribed so that you do not develop treatment failure, and can live a long and healthy life\n\n# Section 7: ART side effects\n\n- What are the side-effects of ART:\n- Sometimes people can get side effects from taking ART\n- Side effects vary from person to person\n- Some people have none while other experience mild effects which are unpleasant but often manageable\n- Most side effects occur within the first few weeks of starting ART and then improve after a few weeks or months\n- Some common side effects include:\n- Headache\n- Loss of appetite\n- Skin rash\n- Fatigue\n- Nausea, vomiting, diarrhoea\n- Muscle pains\n- What do you do if you notice any side effects:\n- If you develop any side effects, you should continue taking your ART as prescribed, without missing any doses, until you discuss with the clinician\n- If the side effects are mild then you can continue taking your ART without missing any doses, and then discuss the side effects with the clinician at your next appointment\n- If the side effects are bothering you too much then return to the clinic immediately, even if you do not have a scheduled appointment, to discuss what to do next; you can also call the clinic if you are not able to make it yourself immediately\n- Severe side effects include rash all over your body, or rash in your mouth or eyes, constant vomiting, inability to eat or retain food, or anything else that makes you think you should stop the ART. If this\n\n# Annex 8: Cont.\n\n# Section 8: Adherence\n\n- What is adherence\n- Following a care plan as agreed with the healthcare team\n- Attending clinic appointments as scheduled\n- Picking up medicines and taking them as prescribed\n- Getting lab tests according to the recommended schedule\n- Following nutritional recommendations\n- How should ART be taken\n- You must take the correct dosage. If you take less than the dose prescribed the treatment will not be effective and will result in resistance and treatment failure. Never share your ART with someone else\n- For children, the dosage keeps changing as they grow and gain weight\n- You must take ART at the correct time of day:\n- If your ART is supposed to be taken once per day, then pick a time when it will usually be convenient for you to remember, e.g., with breakfast every day.\n- If your ART is supposed to be taken twice per day, then you should set a convenient time to take your drugs approximately 12 hours apart (e.g., 8.00 am and 8.00 pm every day). It does not have to be exactly 12 hours apart if your schedule does not allow; the most important thing is to take them twice per day every day (e.g., you can take it at 6.00 am and 8.00 pm every day)\n- If you miss a dose of ART then take your dose as soon as you remember, as long as it is not within a couple of hours of your next dose, and then return to your regular schedule. Do not take a double-dose of ART to make up for a missed dose\n- You must take ART according to dietary restrictions. Some ART should be taken with food, for some it does not matter, and a few require that you have an empty stomach.', '# Annex 9 A: Enhanced Adherence Counselling Content Guide\n\n| Enhanced Adherence Counselling for Patients with Suspected or Confirmed Treatment Failure<br/>Note: for children/adolescents, the script below should be modified towards the caregiver                                                                                                                                                                                                                                                                                                                                                                                                                                                                                                                                                                                                                                                                                                                                                                                                                                                                                                                                                                                                                                                                                                                                                                                                                                                                                                                                                                                                                            |   |\n| ------------------------------------------------------------------------------------------------------------------------------------------------------------------------------------------------------------------------------------------------------------------------------------------------------------------------------------------------------------------------------------------------------------------------------------------------------------------------------------------------------------------------------------------------------------------------------------------------------------------------------------------------------------------------------------------------------------------------------------------------------------------------------------------------------------------------------------------------------------------------------------------------------------------------------------------------------------------------------------------------------------------------------------------------------------------------------------------------------------------------------------------------------------------------------------------------------------------------------------------------------------------------------------------------------------------------------------------------------------------------------------------------------------------------------------------------------------------------------------------------------------------------------------------------------------------------------------------------------------------ | - |\n| **Session 1**                                                                                                                                                                                                                                                                                                                                                                                                                                                                                                                                                                                                                                                                                                                                                                                                                                                                                                                                                                                                                                                                                                                                                                                                                                                                                                                                                                                                                                                                                                                                                                                                      |   |\n| * Assess patient\'s understanding of \'viral load\', \'high viral load\' and \'suppressed viral load\'. Ask the patient to explain what each of these terms mean. Provide education if patient requires more explanation\n* Provide VL result and explanation of result:<br/>""You have a detectable viral load. There are several possible reasons for this such as problems with adherence, dosing of your medications, interactions with other drugs or foods, or possible drug resistance. It is very important for us to work with you determine which may apply to you.""\n* How does the patient feel concerning the result?\n* Explain the process of enhanced adherence:<br/>""Patients with a high viral load come for at least 3 adherence counselling sessions to discuss what might cause a high viral and to look for solutions on how adherence can be improved. Another viral load test will be done after 3 months of good adherence to see if the ART can be continued or if we need to change treatment.""\n* Check whether the patient had previous problems with adherence and/or missed appointments\n* Ask:<br/>""Why do you think your viral load is high?""\n* Sometimes the patient already knows why his/her VL is detectable. Start by giving them a chance to provide their own explanation. Often, they will admit that they are struggling with their adherence\n* If they really don\'t know why their VL is high you can say:<br/>""We notice that when people sometimes forget to take their ART everyday it gives the virus a chance to multiply. Do you think that you sometimes forget your pills?"" |   |\n| **Assess for Possible Barriers to Adherence**                                                                                                                                                                                                                                                                                                                                                                                                                                                                                                                                                                                                                                                                                                                                                                                                                                                                                                                                                                                                                                                                                                                                                                                                                                                                                                                                                                                                                                                                                                                                                                      |   |\n| **Cognitive Barriers (HIV and ART knowledge)**                                                                                                                                                                                                                                                                                                                                                                                                                                                                                                                                                                                                                                                                                                                                                                                                                                                                                                                                                                                                                                                                                                                                                                                                                                                                                                                                                                                                                                                                                                                                                                     |   |\n| - Assess patient\'s knowledge about HIV and ART; correct any misconceptions<br/>""What is HIV?""<br/>""What is the immune system and CD4 cells?""<br/>""What is ART and how does it work?""<br/>""Why is it important to be adherent? And how?""<br/>""Why do you have to come for follow-up appointments? What should you bring?""                                                                                                                                                                                                                                                                                                                                                                                                                                                                                                                                                                                                                                                                                                                                                                                                                                                                                                                                                                                                                                                                                                                                                                                                                                                                                           |   |\n\n\n\n\n# Annex 9A: Cont.\n\n# Behavioural Barriers\n\n- Review how the patient takes drugs\n- “Please explain how you take your drugs, and at what time?”\n- “How does treatment fit in your daily routines?”\n- Establish with the patient whether the time they are meant to take their medication is appropriate or whether the time is a problem. For example, if the patient has chosen 9 pm, but is already asleep in bed by 9 pm, then that is not a good dosing time. If the time is a problem, then determine a new, more appropriate time with the patient based on their schedule.\n- Remind the patient/caregiver that a missed dose should be taken as soon as he/she remembers (up to a couple of hours before the next scheduled dose). The next dose should be taken at the usual time.\n- “What reminder tools do you use? (e.g., mobile phone alarm)”\n- “What do you do in case of visits, and travel?”\n- Travelling is always a risk for poor adherence or default from treatment. Encourage the patient to plan, to make sure they have enough medication on hand before and to remember to pack it.\n- Make sure that all relevant information is on the patient’s appointment card and explain that if they are ever away from home and they are about to run out of medication that they must go to the closest ART clinic and show their appointment card.\n- “What do you do in case of side effects?”\n- Ask the patient if s/he has any side effects from the ARVs, and if they sometimes find it difficult to take ARVs.\n- Due to the side effects, ask how s/he manages side effects and if it influences the way s/he takes the drugs.\n- “What are the most difficult situations for you to take drugs?”\n- Check for alcohol or drug use. Ask the patient in a casual way (not in an accusing way) if they sometimes use substances; emphasize treatment planning in case they do.', '# 1.4 Adherence Preparation, Monitoring and Support\n\n- The adherence preparation, monitoring, and support that a patient requires should be tailored to their level of adherence and the stage of ART initiation and follow-up.\n- All patients with durable viral suppression (2 consecutive viral load results with &#x3C;50 copies) should be offered messaging on Undetectable=Untransmittable (U=U).\n- Whenever possible, follow-up should be provided by the same care provider or team of care providers (e.g., same clinician and counsellor) at every visit. This is particularly important during the first 3 months in care.\n- For all children/adolescents, the level of disclosure should be assessed at the first visit. Ongoing care should include a plan for age-appropriate disclosure.\n- All patients are at risk of new or worsening barriers to adherence, so adherence monitoring, counselling and support should continue despite viral suppression.\n- Every service delivery point that is providing ARVs for patients (whether ART, PEP, or PrEP) must have a functional system for identifying patients who miss appointments and for taking action within 24 hours of a missed appointment.\n- In patients failing ART, do not change regimens until the reason/s for treatment failure have been identified and addressed (which should be done urgently using a case-management approach).\n\n# 1.5 Antiretroviral Therapy for Infants, Children, Adolescents, and Adults\n\n- The goal of ART is to suppress viral replication with the aim of reducing the patient’s VL to undetectable levels (Viral Load &#x3C;50 copies/LDL).\n- All individuals with confirmed HIV infection are eligible for ART, irrespective of CD4 count/%, WHO clinical stage, age, pregnancy or breastfeeding status, co-infection status, risk group, or any other criteria, provided that the individual is willing and ready to start ART.\n- ART should be started in all patients as soon as possible, even on the same day as confirming their HIV diagnosis (and preferably within 2 weeks).\n- Preferred first-line ART for infants, children, adolescents and adults:\n- Birth to 4 weeks: AZT + 3TC + NVP\n- > 4 weeks to &#x3C; 15 years old:\n- &#x3C; 30 kg: ABC + 3TC + DTG\n- ≥ 30 kg: TDF + 3TC + DTG\n- ≥ 15 years old: TDF + 3TC + DTG\n- Children and adolescents who are virally suppressed but are NOT on the preferred first-line ART regimen should be assessed for transition and transitioned to the preferred regimen.\n- Treatment failure is suspected when a patient has a VL ≥ 1000 copies/ml after at least 3 months of using ART. Treatment failure is only confirmed when VL is ≥ 1,000 copies/ml after assessing for and addressing poor adherence or other reasons for high VL, and then.']","The guidelines for ART failure include the following key points:

1. **Definition and Causes:**
   - ART failure is indicated by a viral load of ≥ 1,000 copies/ml after at least 3 months of ART use, which must be confirmed by addressing adherence issues and retesting.

2. **Adherence:**
   - Poor adherence is a major cause of treatment failure. Enhanced adherence counseling is recommended to identify and address barriers.

3. **Management:**
   - Do not change ART regimens until the reasons for treatment failure are identified and addressed.
   - Use a case-management approach to urgently address the causes of treatment failure.

4. **Monitoring and Support:**
   - Continuously monitor and support adherence, even in patients with viral suppression.
   - Systems should be in place to promptly identify and address missed appointments.

These guidelines emphasize the importance of adherence, the need for thorough evaluation before changing ART regimens, and the implementation of support systems to manage and prevent ART failure.",0.6666666666666666,0.9999999999999996,17.85,llm,gpt-4o
How do you manage HIV in pregnancy?,"['# 7. Prevention of Mother to Child Transmission of HIV/Syphilis/Hepatitis B\n\nRoutine antenatal care (ANC) offers an important opportunity to provide high quality combined HIV prevention through targeted health education and counselling; HIV testing for the woman, partners and family members; linkage to HIV prevention and treatment; and to discuss and plan for future conception and contraception needs. Prevention of mother-to-child transmission of HIV (PMTCT)/Syphilis/Hepatitis B should be offered as part of a comprehensive package of fully integrated, routine antenatal care interventions (Table 7.1).\n\n## Table 7.1: Essential Package of Antenatal Care\n\n| Intervention                 | Recommendation/Description                                                                                                                                                                                                                                                                                                                                                                                                                                                                                                                                                                                                                                                                                                                                                                                                                                                                                                                                                                                                                                                                                                                                                                                                                                                                                                                                                                                                                                                                                 |\n| ---------------------------- | ---------------------------------------------------------------------------------------------------------------------------------------------------------------------------------------------------------------------------------------------------------------------------------------------------------------------------------------------------------------------------------------------------------------------------------------------------------------------------------------------------------------------------------------------------------------------------------------------------------------------------------------------------------------------------------------------------------------------------------------------------------------------------------------------------------------------------------------------------------------------------------------------------------------------------------------------------------------------------------------------------------------------------------------------------------------------------------------------------------------------------------------------------------------------------------------------------------------------------------------------------------------------------------------------------------------------------------------------------------------------------------------------------------------------------------------------------------------------------------------------------------- |\n| Group & Individual Education | Include information on importance of at least 8 ANC visits, details of ANC services (including health checks and treatment of any illness, medical tests including HIV, syphilis testing and hepatitis B, monitoring of maternal and fetal wellbeing, etc.), nutrition, personal care, recognizing and responding to danger signs during pregnancy, birth preparedness including skilled birth attendance, post-natal care including immunization, family planning and maternal and infant nutrition, HIV prevention and treatment (HTS, preventing new infections during pregnancy including PrEP where appropriate, ART for those who are HIV positive, monitoring of ART and ARV prophylaxis and follow-up for HEIs) and triple elimination (preventing HIV/ syphilis/hepatitis B transmission from mother to child).                                                                                                                                                                                                                                                                                                                                                                                                                                                                                                                                                                                                                                                                                   |\n| Counselling                  | * Pre-conception – Women in reproductive age who are known to be HIV positive should have pregnancy intention assessment visit at every visit. If they desire to become pregnant, pregnancy should be planned i.e., attain viral load suppression, immune reconstitution and have Iron and Folic Acid Supplementation (IFAS) administered prior to conception.\n* Women who are newly diagnosed with HIV and/or newly initiating ART require more intensive adherence counseling and HIV education, which may include a case manager and/or mentor mother\n* Birth preparedness: support the pregnant woman and her partner to develop an individual birth plan that includes place of delivery with skilled attendants, emergency transport, birth companionship and readiness for infant care\n* Pregnancy danger signs: offer information on returning to ANC as soon as possible in case they develop fever, lower abdominal pain, severe headache, swollen feet, convulsions and per vaginal bleeding.\n* Maternal, infant and young child nutrition (MIYCN): All pregnant women should receive information on proper nutrition during pregnancy and breastfeeding, safe infant feeding and optimal nutrition practices. Promote exclusive breastfeeding for the first 6 months irrespective of HIV status, followed by complementary feeding (Table 7.7). During pregnancy, provide iron, folate and multivitamins; monitor for anemia, advise on adequate caloric intake (HIV positive women require an |', ""## 7.1 Antiretroviral Therapy for HIV-positive Pregnant and Breastfeeding Women and Infant Prophylaxis\n\nThe goal of ART for HIV positive pregnant women is two-fold: to restore and maintain the mother's immune function and therefore general health, and secondly, to prevent transmission of HIV in utero, at labour and delivery and during breastfeeding. To achieve this goal, the mother must take effective antiretroviral therapy to achieve viral suppression. Table 7.2 summarizes recommendations for use of ART for HIV positive pregnant women.\n\n### Table 7.2: Summary of Use of ART for HIV Positive Pregnant and Breastfeeding Women\n\n| Overall recommendations             | Overall recommendations                                                                                                                                                                                                                                                                                                                                                                                                                                                                                                                                                                                                                                                                                                                                                                                                                                                                                                                                                                                                                                                                                                                                                                                                                                                                                                                                                                                                                              |\n| ----------------------------------- | ---------------------------------------------------------------------------------------------------------------------------------------------------------------------------------------------------------------------------------------------------------------------------------------------------------------------------------------------------------------------------------------------------------------------------------------------------------------------------------------------------------------------------------------------------------------------------------------------------------------------------------------------------------------------------------------------------------------------------------------------------------------------------------------------------------------------------------------------------------------------------------------------------------------------------------------------------------------------------------------------------------------------------------------------------------------------------------------------------------------------------------------------------------------------------------------------------------------------------------------------------------------------------------------------------------------------------------------------------------------------------------------------------------------------------------------------------- |\n| When to start                       | ART should be initiated in all pregnant and breastfeeding women living with HIV, regardless of gestation, WHO clinical stage and at any CD4 cell count and continued lifelong. ART should be started, ideally, on same day as HIV diagnosis after readiness assessment with ongoing enhanced adherence support including community-based case management and support.                                                                                                                                                                                                                                                                                                                                                                                                                                                                                                                                                                                                                                                                                                                                                                                                                                                                                                                                                                                                                                                                                |\n| What to start with (first-line ART) | TDF/3TC/DTG                                                                                                                                                                                                                                                                                                                                                                                                                                                                                                                                                                                                                                                                                                                                                                                                                                                                                                                                                                                                                                                                                                                                                                                                                                                                                                                                                                                                                                          |\n| Infant prophylaxis                  | * AZT+NVP for 6 weeks, NVP should be continued until 6 weeks after complete cessation of breastfeedingFor more comprehensive information Refer to Table 7.3                                                                                                                                                                                                                                                                                                                                                                                                                                                                                                                                                                                                                                                                                                                                                                                                                                                                                                                                                                                                                                                                                                                                                                                                                                                                                          |\n| Monitoring                          | **Viral load monitoring during pregnancy and breast-feeding (Figure 6.6)*** Whenever possible, use same-day point-of-care methods for viral load testing of pregnant and breastfeeding women to expedite the return of results and clinical decision-making. If this is not available, viral load specimens and results for pregnant and breastfeeding women should be given priority across the laboratory referral process (including specimen collection, testing and return of results).\n\n* For pregnant and breastfeeding women newly initiated on ART, obtain VL 3 months after initiation, and then every 6 months until complete cessation of breastfeeding\n\n* For HIV positive women already on ART at the time of confirming pregnancy or breastfeeding, obtain a VL irrespective of when prior VL was done, and then every 6 months until complete cessation of breastfeeding\n\n* For pregnant or breastfeeding women with a VL ≥ 50 copies/ml: assess for and address potential reasons for viremia, including intensifying adherence support, repeat the VL after 3 months of excellent adherence, including daily witnessed ingestion, where feasible and appropriate\n\n  * If the repeat VL is 200 - 999 copies/ml consult the Regional or National HIV Clinical TWG\n  * If the repeat VL is ≥ 1,000 copies/ml, change to an effective regimen. Refer to Table 6.10\n  * If the repeat VL is < 200 copies/ml (LDL) then continue routine |"", 'Note that certain patient groups e.g., recent HIV infections, pregnant adolescent girls and young women, women with previous children with HIV infection, patients with high viral load at time of pregnancy confirmation, patients with poor social support systems, patients with history of default from care and those with active co-morbidities etc. may require additional adherence and psychosocial support\n\n# 7.2. Syphilis elimination for Pregnant and Breastfeeding Women and Infant Treatment\n\nThe country has adopted triple elimination of HIV, Syphilis and Hepatitis B among pregnant and breastfeeding women. It is recommended that all pregnant women attending ANC and not aware of their HIV status require a dual HIV syphilis test during their first trimester and a second HIV Syphilis test in the 3ʳᵈ trimester if the initial test was negative.\n\nAll women who test positive for syphilis at any point during pregnancy and breastfeeding should be treated with the appropriate regimen. (Table 7.3). All babies born of mothers who test positive for syphilis are suspected to be exposed to syphilis and should also be treated with the correct regimen (Table 7.3). Ensure to perform contact tracing for all the sexual contacts and ensure they are treated for syphilis.\n\nSymptoms of congenital syphilis may not become apparent for several weeks or months after birth.\n\n# 7.3. Hepatitis B elimination for Pregnant and Breastfeeding Women and Infant Prophylaxis\n\nRequires routine testing of pregnant women to identify women in need of antiviral treatment for their own health and additional interventions to reduce Mother to Child Transmission of viral hepatitis B.\n\nRegular screening should be done by incorporation of viral hepatitis screening as part of the ANC profile. This is recommended for Hepatitis B &#x26; C which pose a big risk to both the mother and fetus.\n\nFor pregnant and breastfeeding women who are found to be positive for HBsAg, offer appropriate treatment options of ARVs containing TDF/3TC or FTC containing regimens. This treatment also acts as prophylaxis for HBV transmission from mother to child. All pregnant and breastfeeding women without evidence of hepatitis B infection (HBsAg negative) should be vaccinated against hepatitis B. (Chapter 9).\n\nHIV positive infants without evidence of infection should be vaccinated against Hepatitis B. Infants born of mothers who test positive for HBsAG should be treated using Hepatitis B Immunoglobulin (Table 7.3).\n\nRefer to Chapter 9 for management of HIV/HBV coinfection.\n\n\n\n# Table 7.3: ARV Prophylaxis for HIV-Exposed Infants\n\n| Infant Scenario    | Infant Prophylaxis                                                                                                                                                                                                                                                                                                                                                                                                                                                                                                                                                                                                                                                                                                  | Maternal Scenarios                                                                                                                                                                                                                                                            |\n| ------------------ | ------------------------------------------------------------------------------------------------------------------------------------------------------------------------------------------------------------------------------------------------------------------------------------------------------------------------------------------------------------------------------------------------------------------------------------------------------------------------------------------------------------------------------------------------------------------------------------------------------------------------------------------------------------------------------------------------------------------- | ----------------------------------------------------------------------------------------------------------------------------------------------------------------------------------------------------------------------------------------------------------------------------- |\n| HIV Exposed Infant | * Infant prophylaxis\n\n  * AZT+NVP for 6 weeks, NVP + cotrimoxazole should be continued until 6 weeks after complete cessation of breastfeeding\n  * Infant prophylaxis can be discontinued after a minimum of 12 weeks on NVP if the child is not breastfeeding (death of mother or separation with mother)\n  * The infant prophylaxis regimen applies to all infants irrespective of age when identifying HIV exposure (e.g., mother diagnosed HIV-positive in the postpartum period)\n\n* DBS or whole blood for PCR at 6 weeks or first contact, following EID algorithm (Figure 2.1)\n\n* Birth testing (Figure 2.2) may be conducted in sites where point of care has been implemented and when medically indicated | - If mother not on ART, initiate ART as soon as possible (preferably same day)\n- If mother is on ART for ≥ 3 months and the VL is ≥ 50 copies/ml, intensify adherence, repeat the VL\n- If VL <50 copies/ml, continue current regimen\n- Follow Viral load algorithm Figure 6.6 |']","To manage HIV in pregnancy, initiate antiretroviral therapy (ART) in all pregnant and breastfeeding women living with HIV, using TDF/3TC/DTG as the first-line regimen, and continue it lifelong. Ensure viral load monitoring during pregnancy and breastfeeding. Administer AZT+NVP for 6 weeks to HIV-exposed infants, with NVP continued until 6 weeks after breastfeeding cessation. Conduct early infant diagnosis with PCR testing at 6 weeks or first contact. Integrate HIV prevention and treatment into routine antenatal care, including testing for HIV, syphilis, and hepatitis B, and provide health education and counseling on ART adherence. Implement dual HIV and syphilis testing in the first and third trimesters, and manage co-infections appropriately.",1.0,0.9467711034185822,30.31,llm,gpt-4o
When should infants start ART?,"['# 1.4 Adherence Preparation, Monitoring and Support\n\n- The adherence preparation, monitoring, and support that a patient requires should be tailored to their level of adherence and the stage of ART initiation and follow-up.\n- All patients with durable viral suppression (2 consecutive viral load results with &#x3C;50 copies) should be offered messaging on Undetectable=Untransmittable (U=U).\n- Whenever possible, follow-up should be provided by the same care provider or team of care providers (e.g., same clinician and counsellor) at every visit. This is particularly important during the first 3 months in care.\n- For all children/adolescents, the level of disclosure should be assessed at the first visit. Ongoing care should include a plan for age-appropriate disclosure.\n- All patients are at risk of new or worsening barriers to adherence, so adherence monitoring, counselling and support should continue despite viral suppression.\n- Every service delivery point that is providing ARVs for patients (whether ART, PEP, or PrEP) must have a functional system for identifying patients who miss appointments and for taking action within 24 hours of a missed appointment.\n- In patients failing ART, do not change regimens until the reason/s for treatment failure have been identified and addressed (which should be done urgently using a case-management approach).\n\n# 1.5 Antiretroviral Therapy for Infants, Children, Adolescents, and Adults\n\n- The goal of ART is to suppress viral replication with the aim of reducing the patient’s VL to undetectable levels (Viral Load &#x3C;50 copies/LDL).\n- All individuals with confirmed HIV infection are eligible for ART, irrespective of CD4 count/%, WHO clinical stage, age, pregnancy or breastfeeding status, co-infection status, risk group, or any other criteria, provided that the individual is willing and ready to start ART.\n- ART should be started in all patients as soon as possible, even on the same day as confirming their HIV diagnosis (and preferably within 2 weeks).\n- Preferred first-line ART for infants, children, adolescents and adults:\n- Birth to 4 weeks: AZT + 3TC + NVP\n- > 4 weeks to &#x3C; 15 years old:\n- &#x3C; 30 kg: ABC + 3TC + DTG\n- ≥ 30 kg: TDF + 3TC + DTG\n- ≥ 15 years old: TDF + 3TC + DTG\n- Children and adolescents who are virally suppressed but are NOT on the preferred first-line ART regimen should be assessed for transition and transitioned to the preferred regimen.\n- Treatment failure is suspected when a patient has a VL ≥ 1000 copies/ml after at least 3 months of using ART. Treatment failure is only confirmed when VL is ≥ 1,000 copies/ml after assessing for and addressing poor adherence or other reasons for high VL, and then.', '- All HIV exposed infants (HEI) should be tested with DNA PCR within 6 weeks of age or first contact thereafter; if negative then another DNA PCR at 6 months, and if negative then repeat DNA PCR at 12 months.\n- All HEI should receive infant ARV prophylaxis consisting of 6 weeks of AZT + NVP and thereafter NVP should be continued until 6 weeks after complete cessation of breastfeeding.\n- All infants irrespective of HIV status should be exclusively breastfed for the first 6 months of life, with timely introduction of appropriate complementary foods after 6 months, and continued breastfeeding up to 24 months or beyond.\n\n# 1.7 TB/HIV Co-infection Prevention and Management\n\n- All healthcare settings should implement TB infection control recommendations to reduce the risk of transmission of TB among patients, visitors and staff.\n- Symptom-based TB screening using the ICF tool MUST be performed for all PLHIV at every clinic visit\n- Patients who screen negative should be assessed for and provided with TB preventive therapy (TPT).\n- Patients who screen positive (presumptive TB) must complete definitive diagnostic pathways.\n- The GeneXpert Ultra MTB/Rif test is the preferred test for diagnosis of TB and rifampicin resistance in all presumptive TB cases.\n- TB-LAM can be used as an adjunct rapid point-of-care diagnostic test for PLHIV: with advanced HIV disease (WHO stage 3 or 4 or CD4 count ≤ 200 cells/mm³ (or CD4% ≤ 25% for children ≤ 5 years)) with presumptive TB, or; any danger signs of severe illness, or; currently admitted to hospital.\n- Patients diagnosed with TB/HIV co-infection should start anti-TB treatment immediately and initiate ART as soon as anti-TB medications are tolerated, preferably within 2 weeks (unless they have TB meningitis, in which case ART should be deferred for 4 to 8 weeks).\n- Patients with TB/HIV co-infection who are already on ART should start anti-TB treatment immediately and continue ART, making any required adjustments to the ART regimen based on known drug-drug interactions and monitoring toxicity.\n- Always assess for ART failure in patients who develop TB after being on ART for ≥ 6 months.', ""## 7.1 Antiretroviral Therapy for HIV-positive Pregnant and Breastfeeding Women and Infant Prophylaxis\n\nThe goal of ART for HIV positive pregnant women is two-fold: to restore and maintain the mother's immune function and therefore general health, and secondly, to prevent transmission of HIV in utero, at labour and delivery and during breastfeeding. To achieve this goal, the mother must take effective antiretroviral therapy to achieve viral suppression. Table 7.2 summarizes recommendations for use of ART for HIV positive pregnant women.\n\n### Table 7.2: Summary of Use of ART for HIV Positive Pregnant and Breastfeeding Women\n\n| Overall recommendations             | Overall recommendations                                                                                                                                                                                                                                                                                                                                                                                                                                                                                                                                                                                                                                                                                                                                                                                                                                                                                                                                                                                                                                                                                                                                                                                                                                                                                                                                                                                                                              |\n| ----------------------------------- | ---------------------------------------------------------------------------------------------------------------------------------------------------------------------------------------------------------------------------------------------------------------------------------------------------------------------------------------------------------------------------------------------------------------------------------------------------------------------------------------------------------------------------------------------------------------------------------------------------------------------------------------------------------------------------------------------------------------------------------------------------------------------------------------------------------------------------------------------------------------------------------------------------------------------------------------------------------------------------------------------------------------------------------------------------------------------------------------------------------------------------------------------------------------------------------------------------------------------------------------------------------------------------------------------------------------------------------------------------------------------------------------------------------------------------------------------------- |\n| When to start                       | ART should be initiated in all pregnant and breastfeeding women living with HIV, regardless of gestation, WHO clinical stage and at any CD4 cell count and continued lifelong. ART should be started, ideally, on same day as HIV diagnosis after readiness assessment with ongoing enhanced adherence support including community-based case management and support.                                                                                                                                                                                                                                                                                                                                                                                                                                                                                                                                                                                                                                                                                                                                                                                                                                                                                                                                                                                                                                                                                |\n| What to start with (first-line ART) | TDF/3TC/DTG                                                                                                                                                                                                                                                                                                                                                                                                                                                                                                                                                                                                                                                                                                                                                                                                                                                                                                                                                                                                                                                                                                                                                                                                                                                                                                                                                                                                                                          |\n| Infant prophylaxis                  | * AZT+NVP for 6 weeks, NVP should be continued until 6 weeks after complete cessation of breastfeedingFor more comprehensive information Refer to Table 7.3                                                                                                                                                                                                                                                                                                                                                                                                                                                                                                                                                                                                                                                                                                                                                                                                                                                                                                                                                                                                                                                                                                                                                                                                                                                                                          |\n| Monitoring                          | **Viral load monitoring during pregnancy and breast-feeding (Figure 6.6)*** Whenever possible, use same-day point-of-care methods for viral load testing of pregnant and breastfeeding women to expedite the return of results and clinical decision-making. If this is not available, viral load specimens and results for pregnant and breastfeeding women should be given priority across the laboratory referral process (including specimen collection, testing and return of results).\n\n* For pregnant and breastfeeding women newly initiated on ART, obtain VL 3 months after initiation, and then every 6 months until complete cessation of breastfeeding\n\n* For HIV positive women already on ART at the time of confirming pregnancy or breastfeeding, obtain a VL irrespective of when prior VL was done, and then every 6 months until complete cessation of breastfeeding\n\n* For pregnant or breastfeeding women with a VL ≥ 50 copies/ml: assess for and address potential reasons for viremia, including intensifying adherence support, repeat the VL after 3 months of excellent adherence, including daily witnessed ingestion, where feasible and appropriate\n\n  * If the repeat VL is 200 - 999 copies/ml consult the Regional or National HIV Clinical TWG\n  * If the repeat VL is ≥ 1,000 copies/ml, change to an effective regimen. Refer to Table 6.10\n  * If the repeat VL is < 200 copies/ml (LDL) then continue routine |""]","ART should be initiated in infants with confirmed HIV infection as soon as possible, ideally on the same day as diagnosis or within two weeks.",1.0,0.9507452995714485,23.49,llm,gpt-4o
What is the recommended PrEP regimen for men who have sex with men?,"['# 11. Pre-Exposure Prophylaxis (PrEP)\n\nPre-exposure prophylaxis (PrEP) is the use of antiretroviral medication to prevent the acquisition of HIV infection by an uninfected person at ongoing risk of acquiring HIV infection.\n\nPrEP is recommended for use as follows:\n\n- Daily Oral PrEP for all individuals, irrespective of gender or sexual orientation who are at risk of HIV infection.\n- Event-Driven (ED) PrEP is currently recommended for all people born male who are not taking exogenous estradiol-based gender affirming hormones\n\n## 11.1 Indications for PrEP and Criteria for Eligibility\n\n### 11.1.1 Indications for PrEP\n\nPrEP is indicated for;\n\n- HIV uninfected persons at ongoing risk of HIV acquisition\n- Some risk situations that place one at ongoing risk include individuals or sexual partner/s who is/are:\n  - HIV positive and: not on ART, or on ART < 6 months, on ART with viral non-suppression, or on ART with suspected poor adherence\n  - In sero-discordant relationships trying to conceive\n  - Of unknown HIV status and at high-risk of HIV infection\n  - Engaging in transactional sex or sex work\n  - With history of recent or current sexually transmitted infections\n  - With recurrent use of Post-Exposure Prophylaxis\n  - With a history of sex whilst under the influence of alcohol or recreational drugs\n  - Inconsistent or no condom use or unable to negotiate condom use during intercourse with persons of unknown HIV status\n  - Using injection drugs where needles and/or syringes are shared\n\n### 11.1.2 HIV Risk Assessment\n\nClients accessing health services should be screened for HIV risk and additionally provided with information on HIV prevention options available including the availability of PrEP. This is in addition to the use of HIV testing services (HTS), as clients are assessed for HIV risk before testing.\n\nThe risk assessment questions are enquiry of behavioural practices that may expose an individual to HIV (Table 11.2).\n\nA simple Risk Assessment Tool (RAST) is provided to guide the provider in generating a conversation about HIV risk. Screening for HIV risk should be integrated within other service delivery points. HIV negative individuals who answer ""yes"" to any of the screening questions\n\n\n# Table 11:1 HIV Screening questions\n\nScreening question refer to the past 6 months &#x26; include;\n\n- “Have you had sex with more than one person?”\n- “Have you had sex without a condom?”\n- “Have you had sex with anyone whose HIV status you do not know?”\n- “Are any of your partners at risk of HIV?”\n- “Have you had sex with a person who has HIV?”\n- “Have you received a new diagnosis of a sexually transmitted infection?”\n- “Do you desire pregnancy?”\n- “Have you used or wanted to use PEP or PrEP for sexual exposure to HIV?”\n- “Have you injected drugs that were not prescribed by healthcare provider? If yes, did you use syringes, needles or other drug preparation equipment that had already been used by another person?”\n- “Have you received money, housing, food or gifts in exchange for sex?”\n- “Have you been forced to have sex against your will?”\n- “Have you been physically assaulted, including assault by a sexual partner?”\n\n# 11.1.3 Criteria for PrEP Eligibility\n\nTo be eligible for PrEP, individuals identified to be at risk of HIV infection from Risk Assessment must meet ALL the following criteria prior to initiating PrEP.\n\n- Confirmed HIV negative status through rapid antibody testing following the HTS algorithm.\n- Determine if the client is willing to take PrEP as prescribed. (This is done by adherence education and counselling on the PrEP regimen to be given, and assessing the client’s readiness to follow the regimen.)\n- Does not have a current or recent (within the past one month) illness consistent with acute HIV infection (fever, sore throat, muscle or joint pains, swollen glands, diarrhoea or headache) in combination with a preceding high-risk exposure for HIV.\n- No contraindication to use of any of the ARVs recommended for PrEP e.g., TDF +/- FTC (or 3TC) for those who choose oral PrEP.\n- Renal or liver disease\n- Clients with renal and liver disease should receive further clinical and laboratory tests, to determine the renal/liver function and extent of disease.\n\n# Other important factors for screening\n\n1. Gender based violence (GBV) screening: All clients accessing PrEP must be screened for gender-based violence, especially intimate partner violence (IPV), and appropriate intervention offered or client linked to appropriate.\n2. Mental Status Assessment: Psychological issues that may influence adherence should be assessed and addressed. It is important to carry out basic mental health evaluation and offer appropriate referral as necessary.', '## 11.2.2 Pre-initiation client education\n\nThe following components should be discussed prior to PrEP initiation:\n\n### Table 11.3: Client Education Checklist\n\n| Topic                                                                                                                                                                                                                                                                                                                                                                                                                                                                                                                                                                                                                 | Check |\n| --------------------------------------------------------------------------------------------------------------------------------------------------------------------------------------------------------------------------------------------------------------------------------------------------------------------------------------------------------------------------------------------------------------------------------------------------------------------------------------------------------------------------------------------------------------------------------------------------------------------- | ----- |\n| ✔ Explain how PrEP works as part of combination HIV prevention                                                                                                                                                                                                                                                                                                                                                                                                                                                                                                                                                        | ✔     |\n| ✔ Explain the need for baseline and follow-up tests including regular HIV testing                                                                                                                                                                                                                                                                                                                                                                                                                                                                                                                                     | ✔     |\n| ✔ Explain PrEP use: include the following: (refer to the different types of PrEP available for details)- The medications used (show the client the pills or other PrEP options\n- How the medications are used (frequency of dosing for the various options)\n- Number of doses required to achieve efficacy (7 doses for daily oral PrEP, loading dose for event driven oral PrEP)\n- What to do when doses are missed (continue for daily doses)\n- Discontinuation of PrEP, how and when it can be discontinued.\n- Side effects and what to do in case these are experienced (including when to consult the clinician) | ✔     |\n| ✔ Discuss what to do in case client experiences symptoms of seroconversion (acute HIV infection)                                                                                                                                                                                                                                                                                                                                                                                                                                                                                                                      |       |\n| ✔ Discuss the Limitations of PrEP- PrEP reduces but does not eliminate the risk of acquiring HIV.\n- PrEP does not prevent pregnancies and STIs.                                                                                                                                                                                                                                                                                                                                                                                                                                                                       | ✔     |\n| ✔ Risk reduction counselling and support education- Managing mental health needs\n- Couple counselling\n- Access to, and consistent use of condoms and lubricants\n- Access to and need for frequent HIV testing.\n- Early access to ART\n- VMMC\n- STI screening and treatment\n- Harm reduction for PWID                                                                                                                                                                                                                                                                                                                   | ✔     |\n\n\n## 11.3 Recommended ARVs for PrEP\n\nThe preferred ARV regimen is Tenofovir 300mg/ Emtricitabine 200mg (TDF/FTC) given as one fixed dose combination (FDC) tablet orally daily.\n\n\n\n# Table 11.4: Antiretrovirals for Use in PrEP\n\n| PrEP Dosing Strategies | Preferred                                                                                                                                                                                                                | Alternative                                                                                                                                                                                                              |\n| ---------------------- | ------------------------------------------------------------------------------------------------------------------------------------------------------------------------------------------------------------------------ | ------------------------------------------------------------------------------------------------------------------------------------------------------------------------------------------------------------------------ |\n| Daily Oral PrEP        | TDF/FTC (300 mg/200 mg) as FDC once daily                                                                                                                                                                                | TDF/3TC (300 mg/300 mg) as FDC once daily                                                                                                                                                                                |\n| Event Driven Oral PrEP | TDF/FTC (300 mg/200 mg) as FDC – two pills taken between 2 and 24 hours in advance of anticipated sex; then, a third pill 24 hours after the first two pills and a fourth pill 48 hours after the first two pills; 2-1-1 | TDF/3TC (300 mg/300 mg) as FDC – two pills taken between 2 and 24 hours in advance of anticipated sex; then, a third pill 24 hours after the first two pills and a fourth pill 48 hours after the first two pills; 2-1-1 |\n\n\n*Recommended Long-acting Products: These products are at different stages of approval and availability in Kenya. The Ministry of Health will issue specific implementation guidelines when they become available.\n\n| \\*Long Acting Cabotegravir Injection | Initiation injections: 600 mg Intramuscular (IM) x 2 doses given 1 month apart (the second initiation injection can be given up to 7 days before or after the date scheduled to receive injection)<br/><br/>THEN<br/><br/>Continuation injections: 600 mg IM every 2months |\n| ------------------------------------ | -------------------------------------------------------------------------------------------------------------------------------------------------------------------------------------------------------------------------------------------------------------------------- |\n| \\*Dapivirine vaginal ring            | Dapivirine vaginal ring, 25mg, inserted vaginally every 28 days.                                                                                                                                                                                                           |', ""# Table 11.6: Managing Clinical and Laboratory Results on Initial and Follow-up Assessment\n\n| Screening                              | Action                                                                                                                                                                                                                                                                                                                                                                                                                                                                                                                                                                                                                                                                                                                                                                                                                                                                                                                                                                                                                           |\n| -------------------------------------- | -------------------------------------------------------------------------------------------------------------------------------------------------------------------------------------------------------------------------------------------------------------------------------------------------------------------------------------------------------------------------------------------------------------------------------------------------------------------------------------------------------------------------------------------------------------------------------------------------------------------------------------------------------------------------------------------------------------------------------------------------------------------------------------------------------------------------------------------------------------------------------------------------------------------------------------------------------------------------------------------------------------------------------- |\n| HIV-positive at initial evaluation     | Do not start PrEP, counsel and link to care and treatment                                                                                                                                                                                                                                                                                                                                                                                                                                                                                                                                                                                                                                                                                                                                                                                                                                                                                                                                                                        |\n| HIV-positive after initiation of PrEP  | Discontinue PrEP, counsel and link to care and treatment. Take DBS or plasma sample for drug resistance testing.                                                                                                                                                                                                                                                                                                                                                                                                                                                                                                                                                                                                                                                                                                                                                                                                                                                                                                                 |\n| Positive STI Screen                    | Thorough genitourinary and anorectal examination, urine dipstick for urethritis, serological testing for syphilis, full STI evaluation if resources available (refer to STI algorithm). Refer to guidelines on syndromic management of STIs.                                                                                                                                                                                                                                                                                                                                                                                                                                                                                                                                                                                                                                                                                                                                                                                     |\n| HBsAg-negative                         | Offer HBV vaccination                                                                                                                                                                                                                                                                                                                                                                                                                                                                                                                                                                                                                                                                                                                                                                                                                                                                                                                                                                                                            |\n| HBsAg-positive                         | This is not a contraindication to oral PrEP. However, will require monitoring of liver function and referral for management of liver disease.<br/><br/>NB: TDF-based daily or event-driven oral PrEP can be safely offered to persons with HBV infection.                                                                                                                                                                                                                                                                                                                                                                                                                                                                                                                                                                                                                                                                                                                                                                        |\n| Hepatitis C - Negative                 | Continue PrEP and follow Hepatitis C testing algorithm.                                                                                                                                                                                                                                                                                                                                                                                                                                                                                                                                                                                                                                                                                                                                                                                                                                                                                                                                                                          |\n| Hepatitis C - Positive                 | Continue PrEP, refer for Hepatitis C confirmatory testing and management with directly acting antivirals (DAAs).                                                                                                                                                                                                                                                                                                                                                                                                                                                                                                                                                                                                                                                                                                                                                                                                                                                                                                                 |\n| Flu-like illness after initiating PrEP | Continue PrEP, test for HIV at first contact and after 28 days, and if negative, continue with usual follow-up                                                                                                                                                                                                                                                                                                                                                                                                                                                                                                                                                                                                                                                                                                                                                                                                                                                                                                                   |\n| Side effects of PrEP                   | GIT - nausea, vomiting, weight loss: these are often mild, self-limiting and occur during the first 1-2 months. Provide supportive counselling, offer symptomatic treatment e.g., anti-emetics like metoclopramide 10 mg 8 hourly for 3 to 5 days.<br/><br/>Renal – individuals may experience transient increase in creatinine, and rarely proteinuria and Fanconi's syndrome (presenting as polyuria, bone pain and weakness). Measure creatinine (and calculate estimated creatinine clearance) at initiation of PrEP and annually thereafter (or whenever indicated (symptom directed)).<br/><br/>If creatinine clearance (eGFR) < 50 ml/min do not start PrEP, recheck after 2 weeks. Refer for evaluation of underlying renal disease.<br/><br/>If the renal function returns to normal, reassess for PrEP and initiate/ continue PrEP.<br/><br/>PrEP should not be prescribed for individuals using nephrotoxic drugs like acyclovir, aminoglycosides, retinoids etc. instead, offer alternative HIV prevention services. |\n| Pregnancy or Breastfeeding             | Pregnancy and breastfeeding are not contraindications to provision of PrEP.<br/><br/>Pregnant or breastfeeding women whose sexual partners are HIV positive or are at high risk of HIV infection may benefit from PrEP as part of combination prevention of HIV infection.<br/><br/>PrEP is also indicated for HIV-negative women in sero-different partnerships who wish to conceive. PrEP in these situations can be prescribed during the pre-conception period and throughout pregnancy to reduce risk of sexual HIV                                                                                                                                                                                                                                                                                                                                                                                                                                                                                                         |""]","The recommended PrEP regimen for men who have sex with men is as follows:

- **Daily Oral PrEP:**
  - Preferred regimen: Tenofovir 300mg/Emtricitabine 200mg (TDF/FTC) as a fixed-dose combination (FDC) tablet taken once daily.
  - Alternative regimen: Tenofovir 300mg/Lamivudine 300mg (TDF/3TC) as FDC once daily.

- **Event-Driven (ED) PrEP:**
  - Recommended for men who have sex with men who are not taking exogenous estradiol-based gender-affirming hormones.
  - Regimen: TDF/FTC (300 mg/200 mg) as FDC – two pills taken between 2 and 24 hours before anticipated sex, followed by a third pill 24 hours after the first two pills, and a fourth pill 48 hours after the first two pills (2-1-1 dosing strategy).
  - Alternative regimen: TDF/3TC (300 mg/300 mg) as FDC with the same 2-1-1 dosing strategy.",0.7,0.9999999999999992,28.97,llm,gpt-4o
How often should viral load be monitored?,"['## 3.6 Summary of clinical and laboratory monitoring of PLHIV on ART\n\nTable 3.6 summarizes the recommended minimum routine follow-up schedule for PLHIV. Additional clinical and laboratory follow-up should be performed whenever clinically indicated\n\n### Table 3.6: Summary of Clinical and Laboratory Monitoring for PLHIV¹\n\n|                                          | Initial Visit | ART preparation                                                                                                                                                                                                                                                                                                                                                                                                                                                                                     | Week (After ART) | Months (after ART) | Months (after ART) | Months (after ART) | Months (after ART) | Months (after ART) | Months (after ART) | ≥ 6 months                              |\n| ---------------------------------------- | ------------- | --------------------------------------------------------------------------------------------------------------------------------------------------------------------------------------------------------------------------------------------------------------------------------------------------------------------------------------------------------------------------------------------------------------------------------------------------------------------------------------------------- | ---------------- | ------------------ | ------------------ | ------------------ | ------------------ | ------------------ | ------------------ | --------------------------------------- |\n| Appointment²,³                           |               | Every week⁴                                                                                                                                                                                                                                                                                                                                                                                                                                                                                         | 2                | 4                  | 2                  | 3                  | 4                  | 5                  | 6                  | Every 1-6 months depending on stability |\n| History and physical exam⁵               | ✔             | ✔                                                                                                                                                                                                                                                                                                                                                                                                                                                                                                   | ✔                | ✔                  | ✔                  | ✔                  | ✔                  | ✔                  | ✔                  | At each clinical visit                  |\n| Adherence assessment and support⁶        | ✔             | ✔                                                                                                                                                                                                                                                                                                                                                                                                                                                                                                   | ✔                | ✔                  | ✔                  | ✔                  | ✔                  | ✔                  | ✔                  | At each visit                           |\n| TB Screening                             | ✔             | Every visit, using ICF screening tool                                                                                                                                                                                                                                                                                                                                                                                                                                                               |                  |                    |                    |                    |                    |                    |                    |                                         |\n| CD4 count                                | ✔             | * Baseline, and then only if patient develops treatment failure (to assess for risk of OIs), or if defaults from care (off ART) for at least 6 months\n* For patients on prophylaxis using dapsone (documented CTX allergy), repeat CD4 every 6 months until CD4 >200 cells/mm³ for two consecutive measures 6 months apart and VL undetectable, after which dapsone and CD4 monitoring can be discontinued                                                                                          |                  |                    |                    |                    |                    |                    |                    |                                         |\n| HIV Viral Load                           |               | - For PCR positive HEIs: baseline at the time of ART initiation\n- Age 0-24 years: at month 3, then every 6 months\n- Age ≥ 25 years: at month 3, then month 12, then annually thereafter if suppressed\n- For all: before any drug substitution for patients on ART for at least 6 months with no valid VL, at month 3 after regimen modification, and then as per population group\n- Any patient with a detectable VL during routine monitoring, follow viral load monitoring algorithm (Figure 6.6) |                  |                    |                    |                    |                    |                    |                    |                                         |\n| HIV Viral Load (pregnant/ breastfeeding) |               | * If on ART at time of confirming pregnancy: VL done at confirmation of pregnancy (regardless of when previously done), then every 6 months until complete cessation of breastfeeding\n* If starting ART during pregnancy or breastfeeding, VL at 3 months after initiation, and then every 6 months until complete cessation of breastfeeding                                                                                                                                                       |                  |                    |                    |                    |                    |                    |                    |                                         |', '# Annex 8: HIV Education and Adherence Counselling Content Guide\n\n| HIV Education and Adherence Counselling                                                   |   |\n| ----------------------------------------------------------------------------------------- | - |\n| Note: for children/adolescents, the script below should be modified towards the caregiver |   |\n\n\n| Section 1: Introductions, climate setting, and review of objectives for the session                                                                                                                                                                                                                                                                                                                                                                                                                                                  |\n| ------------------------------------------------------------------------------------------------------------------------------------------------------------------------------------------------------------------------------------------------------------------------------------------------------------------------------------------------------------------------------------------------------------------------------------------------------------------------------------------------------------------------------------ |\n| * Ensure privacy and confidentiality\n* Introductions of all participants\n* Present the key message for each section using simple terms that the patient will understand, using analogies as appropriate\n* Use IEC material when available\n* Ask the patient if they have any questions at the end of each section, and then ask them to explain the main points back to you to confirm understanding\n* If this is a follow-up session, review what they remember from previous sessions and adapt the session to address their needs |\n\n\n| Section 2: HIV                                                                                                                                                                                                                                                                                                                                                                                                                                                                                                                                                                                                                                                                                                                                                                                                                      |\n| ----------------------------------------------------------------------------------------------------------------------------------------------------------------------------------------------------------------------------------------------------------------------------------------------------------------------------------------------------------------------------------------------------------------------------------------------------------------------------------------------------------------------------------------------------------------------------------------------------------------------------------------------------------------------------------------------------------------------------------------------------------------------------------------------------------------------------------- |\n| * What is HIV\n\n  * HIV stands for ""Human Immunodeficiency Virus""\n  * HIV is a virus that attacks the body\'s immune system. The immune system protects the body from infections\n\n* How is HIV transmitted\n\n  * Sexual contact\n  * Needles\n  * Exchange of blood and bodily fluids\n  * Mother-to-child transmission\n\n* Why should family members be tested for HIV\n\n  * Sexual partners are at risk for already having HIV\n  * All children born to HIV positive mothers are at risk for already having HIV\n  * Encouraging partners/children to test for HIV now is the best way to identify HIV early, so they can also get into treatment\n  * Starting treatment early will help them live long and productive lives\n  * Whether they test positive or negative, they can be an important source of support for your own treatment |\n\n\n\n\n# Annex 8: Cont.\n\n# Section 3: Viral load\n\n- What is viral load\n- Viral load is the amount of HIV in your body\n- When your viral load is high it means you have a lot of HIV in your body; this causes damage to your body\n- Viral load is measured by a blood test\n- How often is viral load measured\n- Viral load is measured after being on treatment for 3 months\n- After 3 months of treatment, we expect the amount of virus in your body to be undetectable; if your VL is detectable then we have to discuss the reasons\n- Having an “undetectable” VL means the test cannot measure the virus in your blood because your ART is working, but it does not mean you are no longer infected with HIV\n- Repeat viral load tests are done depending on how you are doing; if you are doing well on treatment then the viral load is measured again every 6 months (for children/adolescents and pregnant/breastfeeding) or annually\n- For HEI with positive PCR, we also measure viral load at the start of treatment\n- What do viral load measurements mean\n- After being on treatment for 3 or more months, your viral load should be undetectable\n- If your viral load is undetectable, it means your treatment is working well and you should continue taking it the same; the virus is not damaging your body any more\n- If your viral load is detectable, it means your treatment is not working properly, usually because you have been missing some of your pills; the virus is damaging your body and you and the clinic team will need to work together to figure out how to fix the problem\n\n# Section 4: CD4 cells\n\n- What are CD4 cells\n- CD4 cells are the immune cells that protect the body from infections\n- CD4 cells are measured through a blood test, called CD4 count. For adults a normal CD4 count is above 500\n- How are CD4 cells affected by HIV\n- HIV attacks and destroys CD4 cells\n- After years of constant attack from HIV, the CD4 count falls\n- What happens when CD4 cells decrease\n- When the CD4 count falls too low (usually below 200), diseases called “opportunistic infections” are able to infect the body because the body cannot defend itself\n- Common opportunistic infections include: tuberculosis, pneumonia, skin problems, white spots in the mouth, and chronic diarrhoea\n- How often is CD4 count measured\n- CD4 count is measured for all patients at the beginning of treatment, to see if you are likely to get any opportunistic infections\n- Once you start treatment for HIV, we do not need to check CD4 count frequently, but we will use\n\n# Annex 8: Cont.', '## 3.5 Follow-up of PLHIV after ART initiation\n\nFollow-up of patients on ART is determined by the duration the patient has been on treatment, how well they understand the treatment and their response to ART. Follow-up includes scheduled clinical appointments, unscheduled clinical assessments for patients with concerns/complaints, routine and as-needed laboratory monitoring.\n\n\n\n## 3.5.1 First 6 months after ART initiation\n\nAfter ART initiation, patients need to be monitored closely for development of adverse drug events, identify and address barriers to adherence, and development of IRIS. A reasonable follow-up schedule for most patients is 2 weeks and 4 weeks after ART initiation (Table 3.5 and 3.6).\n\nWhen possible, follow-up for a particular patient should be provided by the same care provider or team of care providers (e.g., same clinician and same counsellor) at every visit. This is particularly important during the first 6 months in care.\n\n## 3.5.2 Differentiated Service Delivery for Patients beyond the 1st 6 months of ART\n\nFollow up of patients beyond 6 months of ART is described in table 3.5. It also provides the criteria for determining if a patient is established on ART.\n\nIn summary:\n\n- Patients who are not established on ART require closer follow-up.\n- Patients who are established on ART require less frequent facility follow-up, with up to six months between clinical appointments\n\n### Table 3.5: Differentiated Follow-up of Patients Beyond the First 6 Months of ART\n\n| Patients NOT established on ART                                                                                                                                                                                                                                       | Patients NOT established on ART                                                                                                                                                                                                                                                                                                                                                                                                                                                                                                                       |\n| --------------------------------------------------------------------------------------------------------------------------------------------------------------------------------------------------------------------------------------------------------------------- | ----------------------------------------------------------------------------------------------------------------------------------------------------------------------------------------------------------------------------------------------------------------------------------------------------------------------------------------------------------------------------------------------------------------------------------------------------------------------------------------------------------------------------------------------------- |\n| Patients with any of the following:- On treatment for < 6 months\n- Any active OIs (including TB) in the previous 6 months\n- Poor or questionable adherence to scheduled clinic visits in the previous 6 months.\n- Most recent VL ≥ 200 copies/ml\n- Children < 2 years |                                                                                                                                                                                                                                                                                                                                                                                                                                                                                                                                                       |\n| Package of Care                                                                                                                                                                                                                                                       | * Standard Package of Care\n* Case management to address reason/s for not being established on ART                                                                                                                                                                                                                                                                                                                                                                                                                                                     |\n| Focus of Counselling                                                                                                                                                                                                                                                  | - ART is the most important treatment to maintain good health and an active life\n- ART will reduce the risk of transmitting HIV to others                                                                                                                                                                                                                                                                                                                                                                                                             |\n| Frequency of Follow-up                                                                                                                                                                                                                                                | * Every 1-3 months, based on clinical judgment\n* Additional visits as required to address any medical or psychosocial concerns\n* If VL is detectable at 3 months they will need additional assessments for and management of the reason/s for detectable viral load, with close follow-up until viral suppression is achieved (Chapter 5).\n* Patients with confirmed viral suppression can be followed up every 3-6 months based on patient preference and clinician judgment, with additional unscheduled visits any time the patient has a concern. |\n\n\n\n\n\n# Table 3.5 Cont.\n\nPatients Established on ART\n\nPatients established on ART must have achieved ALL the following:\n\n- On their current ART regimen for ≥ 6 months\n- Currently no active Illness or in the previous 6 months (patients with well controlled chronic conditions should not be excluded)\n- Adherent to scheduled clinic visits for the previous 6 months\n- VL ≤200 copies/ml (LDL) within the last 6 months\n\nNote:\n\n- This definition should be applied to all populations, including those receiving second- and third-line regimens, those with controlled comorbidities, children above 2 years*, adolescents, pregnant and breastfeeding women, and key populations.\n- The client’s category can change at any time so there is a need for a reassessment at each visit. Clients should be categorized at every visit and managed based on their status.\n\nPackage of Care:\n\n- Standard Package of Care\n- Re-assessment of criteria at every clinical visit\n\nLocation of Services:\n\n- Clinical review and ART prescription from any ART service delivery point; all facility levels\n- Distribution of ART between clinical appointments, which can be facility-based or community-based\n\nFocus of Counselling:\n\n- Encourage patient to continue with what is working\n- Reminders that any significant life event or change in daily routine could interfere with adherence\n\nFrequency of Follow-up:\n\n- Clinic appointments to be made at 6 months intervals\n- ART should be offered as refills lasting 3 months, (through fast-track pick-up at facility or through community-based distribution). Patients on injectable contraception should be provided FP through a fast-tracked process between clinic follow-up visits; oral contraceptives and condoms should be distributed with ART\n- Additional visits as required to address any medical or psychosocial concerns\n- Closer follow-up may be arranged based on patient preference\n\n* Children below 2 years are excluded as they require frequent dose adjustment']","Viral load should be monitored as follows:

- **Initial Monitoring:** At 3 months after starting ART for all patients.
- **Routine Monitoring:**
  - **Ages 0-24 years:** Every 6 months after the initial 3-month measurement.
  - **Ages ≥ 25 years:** At 12 months after the initial 3-month measurement, then annually if the viral load is suppressed.
  - **Pregnant/Breastfeeding Women:** Every 6 months until breastfeeding cessation, starting at confirmation of pregnancy or 3 months after ART initiation if starting during pregnancy or breastfeeding.
- **Special Circumstances:** Before any drug substitution and at 3 months after regimen modification, then as per the population group guidelines.
- **Follow-up for Patients Not Established on ART:** Every 1-3 months if recent viral load is ≥ 200 copies/ml.
- **Follow-up for Patients Established on ART:** Clinic appointments at 6-month intervals if viral load is ≤ 200 copies/ml.",1.0,0.9447934833556205,22.35,llm,gpt-4o
What is the preferred first-line regimen for adults?,"[""# Antiretroviral Therapy in Infants, Children, Adolescents, and Adults\n\n## 6.3 First-Line ART for Infants, Children, Adolescents and Adults (including Pregnant and Breastfeeding Women)\n\nThe recommendations below apply to patients who are starting ART for the first time. Preferred and alternative first line regimens are shown in Tables 6.2 and 6.3. ARVs for infant prophylaxis are presented in the PMTCT chapter in Tables 7.3 to 7.6.\n\n**All patients must have their weight documented at every visit. Children and adolescents less than 15 years must have correct weight-based dosing of ARVs confirmed at every visit.**\n\nInfants and children depend on their caregivers for adherence to medication. Caregivers should be adequately prepared for their role of administering ARVs to infants and children, including addressing anticipated challenges such as drug palatability. It can be helpful for more than one caregiver to be informed about a child's HIV status and receive instruction on administration of ART.\n\n**Caregivers should always be shown and then asked to demonstrate how to measure and administer ARVs. This should be done both at the time of prescribing the ART (by the clinician) and at the time of dispensing the ART. Clinicians should ensure that the caregiver accompanying a child for clinical review is the same caregiver responsible for day-to-day ART administration.**\n\n### Table 6.2: Preferred First-line ART Regimens and Dosing for Children, Adolescents and Adults<sup>1</sup>\n\n| Age                     | Weight  | Preferred Regimen  | Dosing (correct weight-based dosing must be confirmed at every visit) |\n| ----------------------- | ------- | ------------------ | --------------------------------------------------------------------- |\n| Birth to 4 weeks        | Any     | AZT + 3TC + NVP3   | Refer to Annex 10 for weight-based dosing                             |\n| > 4 weeks to < 15 years | < 30 kg | ABC + 3TC + DTG4   | Refer to Annex 10 for weight-based dosing                             |\n|                         | ≥ 30 kg | TDF + 3TC + DTG5,6 | TDF/3TC/DTG (300/300/50mg): 1 tab once daily                          |\n| ≥ 15 years              | Any     | TDF + 3TC + DTG5,6 | TDF/3TC/DTG (300/300/50mg): 1 tab once daily                          |\n\n\n1. Patients currently on first-line regimens that are not included in the indicated preferred (Table 6.2) or alternative (Table 6.3) regimens should be considered for regimen optimization as per Section 6.5.1\n2. See Annex 10 for weight-based dosing of all single-drug and fixed-dose combination formulations\n3. Infants who initiate ART at less than 4 weeks of age should initiate on AZT+3TC+NVP irrespective of previous ART exposure; metabolism of other ARVs is not well known for this age group. As soon as these infants become 4 weeks old, they should switch to ABC/3TC+DTG (dosing included in Annex 10). Consult the Regional or National HIV Clinical TWG (Uliza Hotline 0726 460 000, ulizanascop@gmail.com) in case of pre-term infants\n4. Once adolescents reach 30 kg, if virally suppressed they should be considered for transition as per Figure 6.2\n5. TAF may become the preferred NRTI once fixed-dose combinations are available\n6. DTG/3TC dual therapy may be considered for HBV-negative patients once fixed-dose combinations are available"", '# 1.4 Adherence Preparation, Monitoring and Support\n\n- The adherence preparation, monitoring, and support that a patient requires should be tailored to their level of adherence and the stage of ART initiation and follow-up.\n- All patients with durable viral suppression (2 consecutive viral load results with &#x3C;50 copies) should be offered messaging on Undetectable=Untransmittable (U=U).\n- Whenever possible, follow-up should be provided by the same care provider or team of care providers (e.g., same clinician and counsellor) at every visit. This is particularly important during the first 3 months in care.\n- For all children/adolescents, the level of disclosure should be assessed at the first visit. Ongoing care should include a plan for age-appropriate disclosure.\n- All patients are at risk of new or worsening barriers to adherence, so adherence monitoring, counselling and support should continue despite viral suppression.\n- Every service delivery point that is providing ARVs for patients (whether ART, PEP, or PrEP) must have a functional system for identifying patients who miss appointments and for taking action within 24 hours of a missed appointment.\n- In patients failing ART, do not change regimens until the reason/s for treatment failure have been identified and addressed (which should be done urgently using a case-management approach).\n\n# 1.5 Antiretroviral Therapy for Infants, Children, Adolescents, and Adults\n\n- The goal of ART is to suppress viral replication with the aim of reducing the patient’s VL to undetectable levels (Viral Load &#x3C;50 copies/LDL).\n- All individuals with confirmed HIV infection are eligible for ART, irrespective of CD4 count/%, WHO clinical stage, age, pregnancy or breastfeeding status, co-infection status, risk group, or any other criteria, provided that the individual is willing and ready to start ART.\n- ART should be started in all patients as soon as possible, even on the same day as confirming their HIV diagnosis (and preferably within 2 weeks).\n- Preferred first-line ART for infants, children, adolescents and adults:\n- Birth to 4 weeks: AZT + 3TC + NVP\n- > 4 weeks to &#x3C; 15 years old:\n- &#x3C; 30 kg: ABC + 3TC + DTG\n- ≥ 30 kg: TDF + 3TC + DTG\n- ≥ 15 years old: TDF + 3TC + DTG\n- Children and adolescents who are virally suppressed but are NOT on the preferred first-line ART regimen should be assessed for transition and transitioned to the preferred regimen.\n- Treatment failure is suspected when a patient has a VL ≥ 1000 copies/ml after at least 3 months of using ART. Treatment failure is only confirmed when VL is ≥ 1,000 copies/ml after assessing for and addressing poor adherence or other reasons for high VL, and then.', '# 1. Summary of Key Recommendations\n\n## 1.1 HIV Testing Services (HTS) and Linkage to Treatment and Prevention\n\n- HIV testing should be voluntary and conducted ethically in an environment where Consent, Confidentiality, Counselling, Correct results, Connection (linkage) and Creating an enabling environment can be assured\n\n- To optimize access to testing services, HIV testing can be conducted in 2 different settings:\n  - Facility-based\n  - Community-based\n\n- Targeted HIV testing is recommended which involves index client listing of contacts, HIV self-testing and use of HTS screening tool to identify people at risk of HIV infection as eligible for testing\n\n- Serial testing, using approved rapid HIV antibody testing kits, is used to diagnose HIV infection in children older than 18 months, adolescents, and adults. An HIV-positive diagnosis will be made using three consecutive reactive assays\n\n## 1.2 Initial Evaluation and Follow-up for PLHIV\n\n- Initial clinical evaluation of PLHIV entails CD4 monitoring, which is recommended for:\n  - Baseline investigation for all PLHIV\n  - Any patient with suspected treatment failure\n  - Any patient returning to care after interrupting treatment for >3 months\n  - Any patient on fluconazole maintenance therapy or on dapsone as prophylaxis, to determine when prophylaxis can be discontinued\n\n- Advanced HIV Disease is defined as:\n  - Adults, adolescents, and children five years and older as having a CD4 cell count of less than 200 cells/mm³ or\n  - WHO clinical stage 3 or 4 disease\n  - All children younger than five years\n\n- All PLHIV presenting with Advanced HIV Disease (AHD) should be offered a package of care that includes timely initiation of ART, screening, diagnosis, prophylaxis, and management of opportunistic infections.\n\n- Frequency of routine VL monitoring:\n  - For PCR positive HEIs: at baseline (at the time of ART initiation)\n  - Age 0-24 years old: 3 months after ART initiation, and then every 6 months\n\n\n▪ Pregnant or breastfeeding: at confirmation of pregnancy (if already on ART) or 3 months after ART initiation (if ART initiated during pregnancy/breastfeeding), and then every 6 months until complete cessation of breastfeeding\n\n▪ Before any drug substitution (if no VL result available from the prior 6 months)\n\n▪ Three months after any regimen modification (including single-drug substitution)\n\n● PLHIV should receive differentiated care based on initial evaluation (advanced vs. well) and follow up (established vs not established on ART)\n\n# 1.3 Standard Package of Care for PLHIV\n\nConsists of 8 components:\n\n1. Antiretroviral Therapy\n- All PLHIV are eligible for ART irrespective of CD4 cell count or percentage, WHO clinical stage, age, pregnancy status, or comorbidities\n- ART should be initiated as soon as the patient is ready to start, preferably within two weeks from time of HIV diagnosis (except for patients with cryptococcal meningitis or TB meningitis)\n2. Positive Health, Dignity, and Prevention, GBV/IPV &#x26; HIV Education and Counselling\n- All patients should be counselled and supported for disclosure of HIV status; partner/ family testing and engagement; condom use; family planning; sexually transmitted infections screening; treatment adherence; and pre-exposure prophylaxis for HIV-negative sexual partners\n- All females aged 15-49 years and emancipated minors accessing HIV care services should be screened for Intimate Partner Violence (IPV) as part of the standard package of care\n- All PLHIV should be provided with HIV education and counselling\n3. Screening for and Prevention of Specific Opportunistic Infections\nCotrimoxazole Preventive Therapy (CPT) is no longer recommended as life-long prophylaxis, and is only recommended in the following sub populations, unless they have an allergy to sulfur drugs or develop toxicity from CPT:\n\n- All HIV Exposed Infants\n- HIV infected children &#x3C; 15 years of age\n- All PLHIV > 15 years of age:\n- Living in malaria-endemic zones (Refer to the National Guidelines for the Diagnosis, Treatment and Prevention of Malaria in Kenya for the current Kenya Malaria endemicity map)\n- Presenting with WHO stage 3 or 4 event, or meeting the AHD criteria\n- Suspected treatment failure\n- All Pregnant and Breast-feeding women']","The preferred first-line antiretroviral therapy (ART) regimen for adults is a combination of Tenofovir Disoproxil Fumarate (TDF), Lamivudine (3TC), and Dolutegravir (DTG), with the dosing being TDF/3TC/DTG (300/300/50mg): 1 tablet once daily.",1.0,0.9553117395552628,18.75,llm,gpt-4o
Can pregnant women use dolutegravir?,[],No relevant information found in the sources.,0.0,0.0,11.91,llm,gpt-4o
When is tenofovir not recommended?,"['## Annexes\n\n### Table 12 A: Cont.\n\n| Drug name                                                                                                | Dose (in adults)                                   | Dietary restrictions | Major side effects                                                                                                                                             | Comments                                                                                                                                                                                                                                                                                                                                                                                                                                                                                                                                                              |\n| -------------------------------------------------------------------------------------------------------- | -------------------------------------------------- | -------------------- | -------------------------------------------------------------------------------------------------------------------------------------------------------------- | --------------------------------------------------------------------------------------------------------------------------------------------------------------------------------------------------------------------------------------------------------------------------------------------------------------------------------------------------------------------------------------------------------------------------------------------------------------------------------------------------------------------------------------------------------------------- |\n| Emtricitabine (FTC)<br/><br/>Available in 200mg capsules and as FDC with TDF and TDF/EFV                 | 200mg/ dose OD                                     | No food restrictions | Well tolerated. Lactic acidosis and severe hepatomegaly with steatosis (fatal cases have been reported); headache; diarrhoea; nausea; rash; skin discoloration | Effective against hepatitis B. Ideally, patients should be screened for chronic hepatitis B virus (HBV) before starting therapy; exacerbation of Hepatitis B has been reported in patients on discontinuation of FTC<br/><br/>Decrease dosage in patients with renal impairment Monitor renal function if combined with TDF.<br/><br/>When used in combination with TDF, should not be given to patients with a creatinine clearance of <30ml/min. Should not be used with or after failure of 3TC                                                                    |\n| Tenofovir disoproxil fumarate (TDF)<br/><br/>Available in 300mg tablets and as FDC with 3TC and 3TC/ EFV | 300mg/ dose OD                                     | No food restrictions | Lactic acidosis and severe hepatomegaly with steatosis (fatal cases have been reported with nucleoside analogues); renal toxicity; Pancreatitis                | Should not be used with ddI. Should never be used in triple nucleoside combinations with 3TC+ddI/ABC. Renal function should be monitored while on TDF<br/><br/>Ideally, patients should be screened for chronic hepatitis B virus (HBV) before starting therapy; Exacerbation of hepatitis B has been reported in patients on discontinuation of TDF<br/><br/>When used in combination with 3TC, should not be given to patients with a creatinine clearance of <30ml/min.<br/><br/>When used with ATV levels of ATV reduced significantly therefore combine with RTV |\n| Tenofovir alafenamide (TAF)<br/><br/>Various co-formulations available or being developed                | As TAF 25 mg alone or as part of co-formulated FDC | No food restrictions | Well tolerated. GIT upsets, raised serum creatinine, proteinuria and renal toxicity (but to a lesser degree than TDF)                                          | RTV and cobicistat increase TAF levels. DRV decreases TAF levels. Boosted PI increase TAF levels but the PI levels are not affected.<br/><br/>Avoid co-administration with rifabutin, rifampicin and phenytoin                                                                                                                                                                                                                                                                                                                                                        |\n\n\n\n\n\n\n# Kenya HIV Prevention and Treatment Guidelines, 2022\n\n## Annex 12 B: Use of Non-Nucleoside Reverse Transcriptase Inhibitors for Adults\n\n| Drug name                                                                                  | Dose (in adults)                               | Dietary restrictions                                                                                                                                      | Major side effects                                                                                                                                                                                                                              | Comments                                                          |\n| ------------------------------------------------------------------------------------------ | ---------------------------------------------- | --------------------------------------------------------------------------------------------------------------------------------------------------------- | ----------------------------------------------------------------------------------------------------------------------------------------------------------------------------------------------------------------------------------------------- | ----------------------------------------------------------------- |\n| Efavirenz (EFV)<br/>Available in 200mg<br/>& 600mg tablets<br/>and as FDC with<br/>TDF/3TC | 600mg<br/>OD Best<br/>taken<br/>at<br/>bedtime | Preferably<br/>taken on an<br/>empty<br/>stomach.<br/>Can be given<br/>with food,<br/>but avoid<br/>high fat<br/>meals which<br/>increase<br/>absorption. | CNS symptoms<br/>(somnolence, insomnia,<br/>abnormal dreams,<br/>confusion,<br/>hallucination, amnesia,<br/>etc. Avoid in patients<br/>with history of<br/>psychiatric disease);<br/>Skin rash; avoid use in<br/>during the first<br/>trimester | Can be used with rifampicin in TB<br/>patients                    |\n| Etravirine (ETR)<br/>Available in tablets<br/>of 200 mg                                    | 200 mg<br/>BD                                  | Take with<br/>food                                                                                                                                        | Severe but rare: SJS and<br/>erythema multiforme<br/>Common & minor:<br/>Rash, nausea, vomiting,<br/>diarrhoea, abdominal<br/>pain, hepatotoxicity,<br/>dyslipidaemia and CNS<br/>disturbances (less than<br/>EFV)                              | Avoid concurrent use with<br/>rifampicin, and boosted tipranavir. |', '# Kenya HIV Prevention and Treatment Guidelines, 2022\n\n## Annex 12 A: Use of Nucleoside & Nucleotide Reverse Transcriptase Inhibitors in Adults\n\n| Drug name                                                                                                             | Dose (in adults)                 | Dietary restrictions                                      | Major side effects                                                                                                                                                                                                                                                                                                                                                                                                                   | Comments                                                                                                                                                                                                                                                                         |\n| --------------------------------------------------------------------------------------------------------------------- | -------------------------------- | --------------------------------------------------------- | ------------------------------------------------------------------------------------------------------------------------------------------------------------------------------------------------------------------------------------------------------------------------------------------------------------------------------------------------------------------------------------------------------------------------------------ | -------------------------------------------------------------------------------------------------------------------------------------------------------------------------------------------------------------------------------------------------------------------------------- |\n| Zidovudine (AZT or ZDV)<br/><br/>Available in 300mg tablets and as FDC with 3TC and 3TC/ NVP                          | 300mg/ dose BD                   | No food restrictions                                      | Bone marrow suppression), including anaemia; granulocytopenia; headache; gastrointestinal intolerance; myopathy; myositis; liver toxicity; discoloured nails; lactic acidosis and severe hepatomegaly with steatosis (fatal cases have been reported)                                                                                                                                                                                | Monitor for anaemia in the first 3 months of treatment                                                                                                                                                                                                                           |\n| Lamivudine (3TC) Available in 150mg tablet and as FDC with AZT and AZT/NVP, D4T and D4T/NVP and with TDF and TDF/ EFV | 150mg/ dose BD OR 300 mg/dose OD | No food restrictions                                      | Headache; fatigue; nausea; diarrhoea; skin rash; pancreatitis; peripheral neuropathy; hepatotoxicity/ hepatitis; lactic acidosis and severe hepatomegaly with steatosis (rare fatal cases have been reported).                                                                                                                                                                                                                       | A well-tolerated drug. Adjust dose in renal impairment.<br/><br/>Also active against hepatitis B. Ideally, patients should be screened for hepatitis B virus (HBV) before starting therapy; exacerbation of hepatitis B has been reported in patients on discontinuation of 3TC. |\n| Abacavir (ABC) Available in 300mg tablets and in combination with 3TC and DTG                                         | 300mg/ dose BD or 600mg OD       | No food restrictions. Alcohol increases ABC levels by 41% | Hypersensitivity reaction (potentially fatal) whose symptoms include fever, fatigue, malaise, nausea, vomiting, diarrhoea and abdominal pain or respiratory symptoms such as shortness of breath, lymphadenopathy, ulceration of mucous membranes and skin rash. Patients suspected of having hypersensitivity reaction should have ABC stopped and never be restarted. Pancreatitis; lactic acidosis with hepatic steatosis is rare | Educate patient on hypersensitivity reaction. Once hypersensitivity has occurred, the patient should never be re-challenged with ABC.<br/><br/>Avoid alcohol while on ABC.                                                                                                       |', '# Annexes\n\n## Annex 11: Overlapping toxicities between ARVs\n\n| Bone marrow suppression                                                                                                                                  | Peripheral neuropathy                    | Pancreatitis                                                                                                   | Nephrotoxicity                                                                                                                    | Hepatotoxicity                                                                                                                      | Rash                                                                                                                                | Diarrhoea                                      | Ocular effects                                                |\n| -------------------------------------------------------------------------------------------------------------------------------------------------------- | ---------------------------------------- | -------------------------------------------------------------------------------------------------------------- | --------------------------------------------------------------------------------------------------------------------------------- | ----------------------------------------------------------------------------------------------------------------------------------- | ----------------------------------------------------------------------------------------------------------------------------------- | ---------------------------------------------- | ------------------------------------------------------------- |\n| Amphotericin B<br/>Cotrimoxazole<br/>Dapsone Flucytosine<br/>Ganciclovir<br/>Hydroxyurea<br/>Interferon-<br/>Primaquine<br/>Pyrimethamine<br/>Zidovudine | Didanosine<br/>Isoniazid<br/>Vincristine | Didanosine<br/>Lamivudine<br/>(esp. in children)<br/>Stavudine<br/>Cotrimoxazole<br/>Ritonavir<br/>Pentamidine | Acyclovir<br/>Adefovir high dose<br/>Aminoglycosides<br/>Amphotericin B<br/>Cidofovir<br/>Foscarnet<br/>Pentamidine<br/>Tenofovir | Abacavir<br/>Atazanavir<br/>Atovaquone<br/>Cotrimoxazole<br/>Dapsone<br/>Efavirenz<br/>Nevirapine<br/>Sulfadiazine<br/>Voriconazole | Abacavir<br/>Atazanavir<br/>Atovaquone<br/>Cotrimoxazole<br/>Dapsone<br/>Efavirenz<br/>Nevirapine<br/>Sulfadiazine<br/>Voriconazole | Atovaquone<br/>Clindamycin<br/>LPV/r Ritonavir | Cidofovir Ethambutol<br/>Linezolid Rifabutin<br/>Voriconazole |']","Tenofovir is not recommended in the following situations:

- **Renal Impairment**: Tenofovir disoproxil fumarate (TDF) should not be used in patients with a creatinine clearance of less than 30 ml/min.
- **Drug Interactions**: TDF should not be used with didanosine (ddI) or in triple nucleoside combinations with lamivudine (3TC) and ddI or abacavir (ABC).
- **Co-administration with Other Drugs**: Tenofovir alafenamide (TAF) should not be co-administered with rifabutin, rifampicin, and phenytoin due to interaction concerns.",0.875,0.9687199426050067,22.34,llm,gpt-4o
How should HIV be managed in tuberculosis coinfection?,"['# 8. TB/HIV Co-infection, Prevention and Management\n\nTB is a leading cause of morbidity and mortality among people living with HIV. Reducing this burden of illness requires identifying TB early, providing pre-emptive and preventive treatment for TB, and providing optimal treatment for both HIV and TB. Timely initiation of ART in combination with TB Preventive Therapy are effective ways to reduce the burden of TB in PLHIV.\n\nAll PLHIV should receive counselling about the risk of acquiring TB, strategies for reducing exposure to TB, recognizing clinical manifestations of TB and seeking care promptly, the risk of transmission of TB to others and TB preventive therapy to prevent TB disease.\n\nHealthcare settings present suitable conditions for transmission of TB, particularly among vulnerable individuals like PLHIV. All healthcare settings should develop and implement TB infection control guidelines to reduce the risk of transmission of TB between patients, visitors and staff.\n\n# 8.1 TB Screening for PLHIV: Intensified Case Finding (ICF)\n\nTB screening and prevention services should be offered at every clinical visit. Symptom-based TB screening using the ICF tool MUST be performed at every clinic visit to rule out active TB; patients who screen positive (presumptive TB cases) must complete definitive diagnostic pathways (Figure 8.1 and Table 8.1) and patients who screen negative should be evaluated for TB preventive therapy (TPT).\n\nActive Case Finding (ACF) differs from ICF. ICF refers to TB screening among PLHIV, whereas Active TB case finding (ACF) refers to special efforts made by the NTP or other partners that go beyond passive TB case finding at health facilities, in which communities or population groups that are underserved or at higher risk of TB are actively reached for providing access to care, including screening and testing.\n\n\n\n\n\n# Intensified Case Finding Screening Questions\n\n<div style=""border: 1px solid green; padding: 10px;"">\n\n- If ""Yes"" to any question, take a detailed history, examine the patient and do sputum examination (sputum smear or GeneXpert)\n\n- If ""No"" to questions 1-5 above, consider TPT eligibility and work up for TB Preventive Therapy and repeat screening on subsequent visits\n\n- Questions 5 and 6 do not apply to adults\n\n</div>\n\nThe following are the intensified case finding screening questions:\n\n- Cough of any duration (Y/N)\n- Fever (Y/N)\n- Noticeable weight loss/ Failure to thrive/ Poor weight gain (Y/N)\n- Night sweats (Y/N)\n- Reduced playfulness/ Lethargy/ Irritability (Y/N)\n- Contact with a TB case (Y/N)', '## 8.4. ART for TB/HIV Co-infection\n\nAs with all PLHIV, those who are diagnosed with TB/HIV co-infection should be on ART and CPT as part of the comprehensive package of care for PLHIV.\n\n### Timing of ART for TB/HIV Co-infection\n\n- Patients who are not yet on ART\n  - Start TB treatment immediately\n  - Initiate ART as soon as anti-TB medications are tolerated, preferably within 2 weeks\n  - For TB meningitis delay ART for 4 to 8 weeks\n  - Monitor closely for IRIS (Annex 16)\n\n\n\n• Patients who are already on ART\n   o Start TB treatment immediately\n   o Continue ART, assessing for treatment failure and making any required\n     adjustments to the ART regimen based on drug-drug interactions (Table 8.7)\n   o Monitor closely for IRIS (Annex 16)\n• Patient being treated concurrently for TB and HIV require close monitoring for\n  toxicity\n• MDR TB and HIV co-infection should be managed in settings where close toxicity\n  monitoring and follow up by experienced clinicians or multi-disciplinary team is\n  possible\n\nPreferred ART regimens for patients with TB/HIV co-infection are summarized in Tables 8.6 - 8.8.\n\nTable 8.6: Preferred ART Regimens for TB/HIV Co-infection for Patients Newly Initiating 1st\nLine ART ¹\n\n| Age                     | Weight  | 1ˢᵗ Line ART if TB/HIV Co-infection                                                                                                                                                                                     |\n| ----------------------- | ------- | ----------------------------------------------------------------------------------------------------------------------------------------------------------------------------------------------------------------------- |\n| Birth to 4 weeks        | Any     | Start anti-TB treatment immediately; start ART after 4 weeks of age, once tolerating anti-TB drugs (follow the regimen recommendations for children ≥ 4 weeks old)                                                      |\n| > 4 weeks to < 15 years | < 30 kg | • ABC + 3TC + DTG<br/>• Increase DTG dosing frequency to twice daily for duration of rifampicin-containing TB treatment and for an additional 2 weeks after TB treatment is completed, then revert to once daily dosing |\n|                         | ≥ 30 kg | • Give TDF/3TC/DTG FDC morning + DTG 50mg evening for duration of rifampicin-containing TB treatment and for an additional 2 weeks after TB treatment is completed, then revert to TDF/3TC/DTG FDC once daily           |\n| ≥ 15 years              | Any     | • Give TDF/3TC/DTG FDC morning + DTG 50mg evening for duration of rifampicin-containing TB treatment and for an additional 2 weeks after TB treatment is completed, then revert to TDF/3TC/DTG FDC once daily           |\n\n\n¹ Refer to Annex 10 for weight-based ARV dosing\n\n\n\n# Table 8.7: Preferred ART Regimens for Patients who Develop TB while Virally Suppressed on 1st Line ART¹,²\n\n| Current Regimen³ |          | Recommended Substitution                                                                                                                                                                                                                                                                                                                                                                                                                                                                                                                                |          |                                                                                                                                                                                                                                              |\n| ---------------- | -------- | ------------------------------------------------------------------------------------------------------------------------------------------------------------------------------------------------------------------------------------------------------------------------------------------------------------------------------------------------------------------------------------------------------------------------------------------------------------------------------------------------------------------------------------------------------- | -------- | -------------------------------------------------------------------------------------------------------------------------------------------------------------------------------------------------------------------------------------------- |\n| PI/r-based⁴      | All ages | * Switch from PI/r to DTG and continue this regimen even after completing TB treatment. Follow DTG dosing as below\n\n* If it is not possible to switch to DTG:\n\n  * Children < 30 kg requiring PI/r-based ART should receive LPV/r with additional ritonavir super-boosting for the duration of rifampicin-based TB therapy, reverting to standard LPV/r dosing 2 weeks after completing TB treatment\n  * Patients ≥ 30 kg who cannot switch to DTG should be switched to EFV-based ART and maintained on EFV-based ART after completion of TB treatment |          |                                                                                                                                                                                                                                              |\n|                  |          | RAL-based                                                                                                                                                                                                                                                                                                                                                                                                                                                                                                                                               | All ages | Switch from RAL to double-dose DTG dosing during TB treatment and maintain on DTG after completion of TB treatment                                                                                                                           |\n|                  |          | DTG-based                                                                                                                                                                                                                                                                                                                                                                                                                                                                                                                                               | All ages | Administer the double-dose of DTG (i.e., the standard weight-based dose of DTG given twice daily) while taking rifampicin containing TB treatment. Two weeks after completion of TB treatment revert to the recommended DTG dose once daily. |', '- All HIV exposed infants (HEI) should be tested with DNA PCR within 6 weeks of age or first contact thereafter; if negative then another DNA PCR at 6 months, and if negative then repeat DNA PCR at 12 months.\n- All HEI should receive infant ARV prophylaxis consisting of 6 weeks of AZT + NVP and thereafter NVP should be continued until 6 weeks after complete cessation of breastfeeding.\n- All infants irrespective of HIV status should be exclusively breastfed for the first 6 months of life, with timely introduction of appropriate complementary foods after 6 months, and continued breastfeeding up to 24 months or beyond.\n\n# 1.7 TB/HIV Co-infection Prevention and Management\n\n- All healthcare settings should implement TB infection control recommendations to reduce the risk of transmission of TB among patients, visitors and staff.\n- Symptom-based TB screening using the ICF tool MUST be performed for all PLHIV at every clinic visit\n- Patients who screen negative should be assessed for and provided with TB preventive therapy (TPT).\n- Patients who screen positive (presumptive TB) must complete definitive diagnostic pathways.\n- The GeneXpert Ultra MTB/Rif test is the preferred test for diagnosis of TB and rifampicin resistance in all presumptive TB cases.\n- TB-LAM can be used as an adjunct rapid point-of-care diagnostic test for PLHIV: with advanced HIV disease (WHO stage 3 or 4 or CD4 count ≤ 200 cells/mm³ (or CD4% ≤ 25% for children ≤ 5 years)) with presumptive TB, or; any danger signs of severe illness, or; currently admitted to hospital.\n- Patients diagnosed with TB/HIV co-infection should start anti-TB treatment immediately and initiate ART as soon as anti-TB medications are tolerated, preferably within 2 weeks (unless they have TB meningitis, in which case ART should be deferred for 4 to 8 weeks).\n- Patients with TB/HIV co-infection who are already on ART should start anti-TB treatment immediately and continue ART, making any required adjustments to the ART regimen based on known drug-drug interactions and monitoring toxicity.\n- Always assess for ART failure in patients who develop TB after being on ART for ≥ 6 months.']","In managing HIV in tuberculosis (TB) coinfection:

- Start TB treatment immediately for patients not on ART and initiate ART as soon as anti-TB medications are tolerated, preferably within 2 weeks. For TB meningitis, delay ART initiation for 4 to 8 weeks.
- Patients already on ART should start TB treatment immediately and continue ART, adjusting regimens for drug-drug interactions.
- Use symptom-based TB screening at every clinic visit and conduct definitive diagnostic testing for those who screen positive.
- Monitor closely for Immune Reconstitution Inflammatory Syndrome (IRIS) and assess for ART failure in patients who develop TB after being on ART for 6 months or more.
- Adjust ART regimens during rifampicin-containing TB treatment, such as increasing the frequency of dolutegravir (DTG) dosing.
- Manage patients with multidrug-resistant TB (MDR TB) and HIV in settings with experienced clinicians for close toxicity monitoring.",1.0,0.9580269723453019,18.11,llm,gpt-4o
What lab tests are used to monitor ART?,"['### Table 3.2 Cont.\n\n| Others | Test                                          | Indication                                                                                                                                                                                                                                                                     |\n| ------ | --------------------------------------------- | ------------------------------------------------------------------------------------------------------------------------------------------------------------------------------------------------------------------------------------------------------------------------------ |\n| Others | Hb (preferably full blood count if available) | • All patients especially if on AZT<br/>•                                                                                                                                                                                                                                      |\n|        | Pregnancy Test                                | • Pregnancy status should be determined for all women of reproductive age (based on history of last menstrual period, and if uncertain, irregular, or delayed then a urine pregnancy test should be performed)                                                                 |\n|        | TB- LAM                                       | • Conduct TB-LAM on a urine sample if CD4 ≤ 200 cells/mm3 in PLHIV >5 years, and if CD4% ≤ 25% in children < 5 years<br/>• Seriously ill patients                                                                                                                              |\n|        | Urinalysis (for protein & glucose)            | • All patients                                                                                                                                                                                                                                                                 |\n|        | Creatinine                                    | ○ All patients, especially those starting TDF. Calculate Creatinine Clearance (CrCl), (Annex 15)                                                                                                                                                                               |\n|        | Syphilis serology (VDRL, TPHA, or RPR)        | • All patients with a history of being sexually active                                                                                                                                                                                                                         |\n|        | Glucose                                       | • All patients                                                                                                                                                                                                                                                                 |\n|        | Plasma lipid profile                          | • All patients                                                                                                                                                                                                                                                                 |\n|        | HBsAg                                         | • All adolescent and adult patients (plus children who did not complete routine childhood immunizations)                                                                                                                                                                       |\n|        | HCV antibody                                  | • PWID or for patients with history of injection drug use                                                                                                                                                                                                                      |\n|        | ALT                                           | • Not recommended as baseline investigation unless there is a specific clinical reason (e.g., patient with history of hepatitis, signs or symptoms of liver disease, or risk of liver disease - alcoholics, HBV or HCV infection, hepatotoxic drugs such as fluconazole, etc.) |\n|        | HPV testing                                   | • For women of reproductive age between 25-49 years conducted at baseline and every two years (refer to cancer screening guidelines)                                                                                                                                           |\n\n\nIt is not possible for ALL facilities providing ART to offer all the laboratory tests recommended for HIV treatment. If a facility does not have on-site capacity to carry out any test, arrangements should be made to transport specimens to a local or regional reference laboratory.\n\n# 3.4 Management of Patients Who Present with Advanced HIV Disease\n\nThe World Health Organization (WHO) defines AHD for adults, adolescents, and children five years and older as having a CD4 cell count of less than 200 cells/mm3 or WHO clinical stage III or IV disease. All children younger than five years living with HIV who are not already receiving ART and not clinically stable are considered to have AHD.\n\nAdvanced HIV Disease can occur in various settings including PLHIV newly presenting to care, those returning to care after treatment interruption and those on ART who have experienced treatment failure.\n\nPLHIV with AHD have immune suppression with reduced ability to fight opportunistic infections (OI), other infectious and non-infectious diseases, and are therefore at increased risk of morbidity and mortality. AHD is also associated with increased health-care costs, use of more health-care services and more frequent monitoring needs. Leading causes of mortality among adults with AHD include immune reconstitution inflammatory syndrome, tuberculosis (TB), severe bacterial infections, cryptococcal disease, histoplasmosis, toxoplasmosis, and Pneumocystis Jirovecii pneumonia amongst others.\n\n# CD4 testing criteria to diagnose AHD and determine eligibility for package for care:\n\n- New clients initiating ART:\n- CD4 testing should be conducted as a baseline test for ALL PLHIV\n- Patients who are treatment experienced:\n- PLHIV ≥5 years of age and who had previously initiated ART and are reinitiating after >3 months.\n- Individuals who have documented persistent unsuppressed viral load (two viral load VL >1,000 within 3-6 months).\n\n# Package of Care for AHD\n\nAll PLHIV presenting with Advanced HIV Disease (AHD) should be offered a package of care that includes timely initiation of ART, screening, diagnosis, prophylaxis, and management of opportunistic infections.\n\nTable 3.3 provides a summary of definitions of well versus advanced disease and package of care for each at enrolment.', '# Table 3.1 Cont.\n\n# Sexual and reproductive history\n\n- History of STIs\n- Current symptoms of STIs\n- Sexual practices\n- Determine HIV status and disclosure to sexual partner(s)\n- ART status of sexual partner/s\n- Pregnancy history and age of all living children\n- Menstrual history, family planning and plans for pregnancy\n- History of cervical cancer screening\n- Vaccination history (including COVID-19 vaccine)\n\nDiscuss:\n\n- Secondary prevention and avoidance of re-infection with STIs\n- Pregnancy intention and contraception needs\n\nEncourage contact tracing and HIV testing for sexual partners and all children &#x3C; 15 years of age of HIV-infected women or whose mothers’ HIV status is unknown\n\n# Vital signs, and anthropometric measurements\n\n- Measure and record weight, height, MUAC (in children and pregnant women), temperature, pulse rate, BP, respiratory rate, and pulse oximetry\n- Calculate BMI as: Weight (kg)/ Height²(m); Use z-scores for children\n- Monitor growth trends for children\n\n# General examination\n\nExamine the following:\n\n- Conjunctiva and palms for pallor or jaundice; swollen lymph nodes (cervical, axillary, inguinal); mouth for Kaposi’s sarcoma (KS) lesions, oral hairy leucoplakia, candidiasis, tooth decay; skin (for drug eruptions, herpes zoster, dermatitis, pruritic papular eruptions (PPE), folliculitis, fungal infections, molluscum, and KS)\n- Assess developmental milestones for children\n\n# Systemic examination\n\n- Central Nervous System\n- Mental State Examination (for mental status)\n- Abdomen\n- Respiratory\n- Cardiovascular\n- Genitourinary/ anorectal system (for ulcers, discharge, condylomata/warts, prostate examination for men ≥ 45 years of age). Speculum examination with cervical cancer screening for females\n\n\n\n\n\nTable 3.1 Cont.\n\n| Summary | List differential diagnosis and management plan for each problem (including investigations, treatment, referrals, and follow-up) • Assign and document the WHO Clinical Stage and manage presenting illnesses • Growth and developmental milestone must be assessed and used for WHO staging in children Differentiate between patients with advanced disease versus those who are clinically well, to guide acuity of follow-up |\n| ------- | -------------------------------------------------------------------------------------------------------------------------------------------------------------------------------------------------------------------------------------------------------------------------------------------------------------------------------------------------------------------------------------------------------------------------------- |\n\n\n## 3.3 Initial Laboratory Evaluation of PLHIV\n\nThe comprehensiveness of laboratory tests will depend on presence and/or type of suspected concurrent illness. Table 3.2 summarizes the recommended baseline laboratory investigations for all PLHIV. Additional investigations should be based on clinical indication. ART should not be delayed if a laboratory test is not available.\n\nTable 3.2: Baseline Laboratory Investigations for PLHIV\n\n| HIV Specific | Test                                            | Comments                                                                                                                                                                                                                                                                               |\n| ------------ | ----------------------------------------------- | -------------------------------------------------------------------------------------------------------------------------------------------------------------------------------------------------------------------------------------------------------------------------------------- |\n|              | • Confirm and document positive HIV test result | • Positive status should be reconfirmed prior to ART initiation for all patients<br/>• Refer to current HIV testing algorithm                                                                                                                                                          |\n|              | CD4 cell count                                  | • For all patients (CD4% for children ≤ 5 years old)<br/>• If CD4 ≤ 200 cells/mm3 in PLHIV >5 years, then laboratories should automatically perform a serum cryptococcal antigen (sCrAg) on the same sample to screen for cryptococcal infection<br/>• TB-LAM should also be conducted |\n|              | Viral load (HIV-1 RNA)                          | • Baseline viral load (VL) is recommended for infants after 1st PCR test is positive. Specimen for baseline VL can be drawn at the time of initiating ART; obtaining a VL should not delay ART initiation                                                                              |\n|              | Serum Cryptococcal Antigen (sCrAg)              | • Obtain serum CrAg If CD4 ≤ 200 cells/mm3 in patients >5 years as reflex testing by the laboratory<br/>• If positive, manage as per the cryptococcal meningitis screening algorithm (Figure 4.1)                                                                                      |', '### Table 3.6 Cont.\n\n| Test                                   | Recommended | Frequency/Indication                                                                                                                                                                                             |\n| -------------------------------------- | ----------- | ---------------------------------------------------------------------------------------------------------------------------------------------------------------------------------------------------------------- |\n| CrAg                                   | ✔           | Baseline for adults and adolescents with CD4 ≤ 200 cells/mm³ (as reflex testing by laboratory), then only if there is clinical suspicion of CM                                                                   |\n| Hb                                     | ✔           | Baseline, then symptom directed; if on AZT, baseline then weeks 2, 4, and 12                                                                                                                                     |\n| Pregnancy Status                       | ✔           | At every visit for women of reproductive age (by history +/- urine pregnancy test)                                                                                                                               |\n| Urinalysis (protein & glucose)         | ✔           | Baseline, then annually if on TDF                                                                                                                                                                                |\n| Creatinine                             | ✔           | Baseline, then annually if on TDF                                                                                                                                                                                |\n| Glucose                                | ✔           | Baseline, then annually                                                                                                                                                                                          |\n| Plasma lipid profile                   | ✔           | Baseline, then annually                                                                                                                                                                                          |\n| HBsAg                                  | ✔           | Baseline, followed by immunization for all patients who screen negative (after viral suppression is confirmed)                                                                                                   |\n| Syphilis serology (VDRL, TPHA, or RPR) | ✔           | Baseline, then annually in those at risk and as part of routine ANC profile                                                                                                                                      |\n| Drug Resistance Testing                |             | DRT recommended once treatment failure confirmed on a DTG- or PI-based 1st line regimen, or confirmed treatment failure on 2nd line or subsequent regimens                                                       |\n| ALT                                    |             | Not recommended for routine baseline or follow-up unless specific clinical indication                                                                                                                            |\n| Cervical Cancer                        |             | All women should be screened for cervical cancer following the national guidelines. Using HPV screening conducted every 2 years for HIV positive women in their reproductive age (or annually if using VIA-VILI) |\n| HCV                                    |             | Baseline for PWIDs or with a history of injection drug use                                                                                                                                                       |\n\n\n\n\n\n# 3.6 Cont.\n\n1. Recommended investigation should not delay ART initiation.\n2. This is the recommended appointment schedule. Clinicians and patients should be encouraged to schedule additional appointments as needed. Patients should be encouraged to return to the HIV clinic for unscheduled appointments whenever an acute issue arises, instead of seeking care at another facility. Early after initiation of ART, and after any regimen modification, every appointment should include:\n- Continued adherence counselling and support (started at the initial visit)\n- Assessment of adherence and correct storage of medication\n- Assessment for and management of early side effects of the drugs, and patient counselling on the same\n3. Patients who are adherent and virally suppressed at month 3, may not need subsequent monthly appointments until month 6.\n4. All PLHIV qualify for ART and should be initiated as soon as possible including same day and within 2 weeks. For patients who do not start ART on the same day as enrolment into HIV care, they should be followed up every week until ART initiation to address whatever issues are delaying ART initiation, for ongoing management of acute medical issues and for treatment preparation and ART readiness assessment.\n5. Refer to table 3.1 for detailed history and physical examinations.\n6. In children and adolescents, weight and height should be measured and recorded at every visit, with weight-based dosing of ARVs confirmed at every visit. In adults, weight and height should be measured at the initial visit to determine nutritional status and calculate the BMI, and thereafter, weight should be measured at every visit.\n7. The first 2-4 visits are critical for assessing and supporting adherence to ART, managing adverse drug reactions, and treating any acute illnesses including IRIS. Adherence should be assessed at every contact with the clinic. See Chapter 5 for specific adherence preparation, monitoring and support procedures for each visit.\n\nRequired laboratory tests are highly recommended for patient monitoring, but are not a pre-requisite for ART initiation. Targeted laboratory tests may be necessary to identify and manage inter-current diseases or adverse drug reactions.\n\n# 3.7 Differentiated Care for Children, Adolescents and Pregnant/breastfeeding Women\n\nChildren, adolescents, pregnant and breastfeeding women, and key populations face unique challenges in retention and viral suppression and hence may benefit more from differentiated service delivery models adapted to their needs.\n\nChildren: Children’s care is dependent on family and caregiver dynamics. Family-centered approaches to care where clinic visits for parents/caregivers and the child are synchronized, should be used. Assessment and categorization to determine establishment on ART should be conducted for pairs and follow-up tailored to their situations. Weight-based dose adjustments should be incorporated in both the facility and community models (e.g., by using portable weighing scales if out of the health facility) to determine optimal doses for ARVs at each review. Aligning']","The lab tests used to monitor ART include:

- **CD4 Cell Count**
- **Viral Load (HIV-1 RNA)**
- **Serum Cryptococcal Antigen (sCrAg)**
- **Hemoglobin (Hb)**
- **Urinalysis (Protein & Glucose)**
- **Creatinine**
- **Glucose**
- **Plasma Lipid Profile**
- **HBsAg (Hepatitis B Surface Antigen)**
- **Syphilis Serology (VDRL, TPHA, or RPR)**
- **HCV Antibody**
- **HPV Testing**
- **Drug Resistance Testing**",0.8461538461538461,0.9999999999999994,45.08,llm,gpt-4o
When is second-line ART initiated?,"['# Table 6.10 Cont.\n\n1. If any drug in the recommended 2nd line regimen is contraindicated or previously not tolerated, consult the Regional or National HIV Clinical TWG (Uliza Hotline 0726 460 000; https://nhcsc.nascop.org/clinicalform). Such patients may require DRT to select agents for the second-line ART. Additional drugs may be recommended on a case-by-case basis, including DRV/r, ATV/r, RAL, or ETR.\n2. Patients failing DTG-based or PI-based first-line regimens should have a Drug Resistance Test (DRT) ordered as soon as treatment failure is confirmed. The patient summary and DRT results should be sent to the Regional or National HIV Clinical TWG (https://nhcsc.nascop.org/clinicalform) or call Uliza Hotline (0726 460 000) to determine the most suitable second-line regimen for the patient. The DRT results will be used to determine if there is true DTG or PI failure or if there is an underlying problem with non-adherence. Daily witnessed ingestion is recommended prior to performing DRT.\n\n# Important Considerations for First-line Treatment Failure in Children\n\n- Second-line ART in infants and children is more complex to manage. These children and their caregivers should undergo thorough clinical and psychosocial assessment to rule out inter-current illness or non-adherence as the reason for a high viral load.\n- All children failing first-line should be discussed in the MDT and preferably with an experienced ART provider prior to change of ART to second-line. However, this should not cause undue delay in switching a failing regimen.\n- The choices for infants and children failing an alternative first-line regimen are limited and may need to be discussed with the Regional or National HIV Clinical TWG. Some of these children will require HIV DRT to determine the most suitable second-line regimen.\n\n# Important considerations for second-line ART Treatment Failure\n\n- Patients failing second-line ART have limited options. ARVs used to construct a third-line regimen are often more expensive, will have increased pill burden and more side effects. These factors will exacerbate pre-existing poor adherence.\n- Second-line treatment failure should be confirmed by viral load testing following the viral load monitoring algorithm (Figure 6.6).\n1. After the first detectable VL (≥ 50 copies/ml), assess for and address all causes of poor adherence, and assess for all other possible causes of viremia.\n2. These patients should be discussed at an MDT session. Repeat the VL after 3 months of excellent adherence (preferably with daily witnessed ingestion of the ARVs by a treatment buddy, relative, CHV, etc.).\n3. If the second VL is still ≥ 50 copies/ml then continue the failing second-line regimen while reassessing adherence and other causes of viremia, implementing adherence support systems as needed, and then repeat the VL after another 3 months.\n4. If viremia continues then consult the Regional or National HIV Clinical TWG (Uliza Hotline 0726 460 000; https://nhcsc.nascop.org/clinicalform) using the national case summary form (Annex 9B). These patients will likely require DRT in order for the TWG to design the most suitable third-line regimen.\n- Patients failing second-line ART require thorough assessment for barriers to adherence and ongoing enhanced adherence support including:\n- Assigning a case manager\n- More frequent adherence counselling by a trained counsellor\n- Assessment and treatment of mental health and substance use disorders', '# Antiretroviral Therapy in Infants, Children, Adolescents, and Adults\n\n> Non-adherence is the most frequent cause of treatment failure. As per the viral load\nmonitoring algorithm, adherence issues must be addressed BEFORE confirming\ntreatment failure.\n\nDaily witnessed ingestion by a treatment buddy or healthcare worker is recommended to confirm\nexcellent adherence before repeating the VL. All adherence issues must be resolved before\nswitching to a new regimen otherwise the patient will quickly fail the new regimen as well, and\nsoon run out of viable ART options. An exception to this may be when the regimen itself is\nthe primary cause of poor adherence (e.g., side effects from one of the ARVs are not\nmanageable such as severe diarrhea with LPV/r that does not improve with symptom\nmanagement), in which case the regimen may need to be modified to allow for perfect adherence.\nThis should be done in consultation with the Regional or National HIV Clinical TWG.\n\nChapter 5 provides detailed guidance on adherence preparation, assessment, and support.\n\n## Table 6.10: Recommended Second-line ART Regimens in Infants, Children, Adolescents and Adults, excluding TB/HIV co-infection ¹\n\n| Weight/scenario                  | First-line ART                                                                                      | Second-line ART                                                                                                          |\n| -------------------------------- | --------------------------------------------------------------------------------------------------- | ------------------------------------------------------------------------------------------------------------------------ |\n| < 30 kg                          | ABC (or AZT) + 3TC + DTG                                                                            | DRT-based second-line²,³                                                                                                 |\n|                                  | ABC + 3TC + LPV/r                                                                                   | Take sample for DRT and change to AZT + 3TC + DTG while awaiting DRT results; modify based on DRT results if indicated   |\n|                                  | AZT + 3TC + LPV/r                                                                                   | Take sample for DRT and change to ABC + 3TC + DTG while awaiting DRT results; modify based on DRT results if indicated   |\n|                                  | ABC + 3TC + EFV                                                                                     | AZT + 3TC + DTG                                                                                                          |\n|                                  | AZT + 3TC + EFV                                                                                     | ABC + 3TC + DTG                                                                                                          |\n| ≥ 30 kg or ≥ 15 years old        | TDF (or ABC) + 3TC + DTG (or PI/r)                                                                  | DRT-based second-line²                                                                                                   |\n|                                  | TDF (or ABC) + 3TC + EFV                                                                            | TDF + 3TC + DTG                                                                                                          |\n|                                  | AZT + 3TC + EFV                                                                                     | TDF + 3TC + DTG                                                                                                          |\n| Pregnant and Breastfeeding women | TDF (or ABC) + 3TC + DTG                                                                            | Take sample for DRT and change to TDF + 3TC + ATV/r while awaiting DRT results; modify based on DRT results if indicated |\n|                                  | TDF (or ABC) + 3TC + PI/r                                                                           | Take sample for DRT and change to TDF + 3TC + DTG while awaiting DRT results; modify based on DRT results if indicated   |\n|                                  | TDF (or ABC) + 3TC + EFV                                                                            | TDF + 3TC + DTG                                                                                                          |\n|                                  | AZT + 3TC + EFV                                                                                     | TDF + 3TC + DTG                                                                                                          |\n| HIV/HBV Co-infection             | Always maintain TDF in order to treat the HBV as well as HIV                                        |                                                                                                                          |\n| TB/HIV Co-infection              | Refer to Table 8.8: Recommended ART Regimens for Patients who Develop TB while Failing 1ˢᵗ Line ART |                                                                                                                          |', '# Section 6: Treatment failure\n\n- What happens if you stop taking ART:\n- When you stop taking ART the virus begins to increase in your body very quickly\n- The virus goes back to the same high level it was at before you started ART\n- What happens if you do not take ART regularly:\n- The virus begins to increase to high levels again\n- What happens if the viral load increases:\n- When the virus is allowed to increase again, it will also affect your immunity and reduce your CD4 count putting you at risk of opportunistic infections\n- When the virus is allowed to increase again, it can change and get stronger, and becomes resistance to the ART\n- When the virus becomes resistant, the ART does not work against the virus anymore\n- The risk of resistance increases by not taking the ART correctly and by starting and stopping the medications several times\n- When resistance occurs, this is called treatment failure\n- What happens in treatment failure:\n- The ART no longer works because the virus has become resistant to it\n- If treatment fails, it is necessary to use stronger, more expensive ART, but it still may not work as well\n- With the stronger ART you may need to take more pills every day, and you may have more side effects\n- If you become resistant to the new ART as well, then there may not be any drugs that can work for you, and the virus will increase quickly and your CD4 count will go way down\n- It is essential that you take your ART every day as prescribed so that you do not develop treatment failure, and can live a long and healthy life\n\n# Section 7: ART side effects\n\n- What are the side-effects of ART:\n- Sometimes people can get side effects from taking ART\n- Side effects vary from person to person\n- Some people have none while other experience mild effects which are unpleasant but often manageable\n- Most side effects occur within the first few weeks of starting ART and then improve after a few weeks or months\n- Some common side effects include:\n- Headache\n- Loss of appetite\n- Skin rash\n- Fatigue\n- Nausea, vomiting, diarrhoea\n- Muscle pains\n- What do you do if you notice any side effects:\n- If you develop any side effects, you should continue taking your ART as prescribed, without missing any doses, until you discuss with the clinician\n- If the side effects are mild then you can continue taking your ART without missing any doses, and then discuss the side effects with the clinician at your next appointment\n- If the side effects are bothering you too much then return to the clinic immediately, even if you do not have a scheduled appointment, to discuss what to do next; you can also call the clinic if you are not able to make it yourself immediately\n- Severe side effects include rash all over your body, or rash in your mouth or eyes, constant vomiting, inability to eat or retain food, or anything else that makes you think you should stop the ART. If this\n\n# Annex 8: Cont.\n\n# Section 8: Adherence\n\n- What is adherence\n- Following a care plan as agreed with the healthcare team\n- Attending clinic appointments as scheduled\n- Picking up medicines and taking them as prescribed\n- Getting lab tests according to the recommended schedule\n- Following nutritional recommendations\n- How should ART be taken\n- You must take the correct dosage. If you take less than the dose prescribed the treatment will not be effective and will result in resistance and treatment failure. Never share your ART with someone else\n- For children, the dosage keeps changing as they grow and gain weight\n- You must take ART at the correct time of day:\n- If your ART is supposed to be taken once per day, then pick a time when it will usually be convenient for you to remember, e.g., with breakfast every day.\n- If your ART is supposed to be taken twice per day, then you should set a convenient time to take your drugs approximately 12 hours apart (e.g., 8.00 am and 8.00 pm every day). It does not have to be exactly 12 hours apart if your schedule does not allow; the most important thing is to take them twice per day every day (e.g., you can take it at 6.00 am and 8.00 pm every day)\n- If you miss a dose of ART then take your dose as soon as you remember, as long as it is not within a couple of hours of your next dose, and then return to your regular schedule. Do not take a double-dose of ART to make up for a missed dose\n- You must take ART according to dietary restrictions. Some ART should be taken with food, for some it does not matter, and a few require that you have an empty stomach.']","Second-line ART is initiated when a patient experiences treatment failure on a first-line regimen, confirmed by a Drug Resistance Test (DRT) to guide the selection of the second-line regimen.",1.0,0.9880966819156303,24.69,llm,gpt-4o
What adherence strategies are recommended?,"['- Religious beliefs: find out if the patient has tried faith healing, or if they have ever stopped taking their medicine because of their religious beliefs.\n\nAnnex 9A: Cont.\n\n# Referrals and Networking\n\n- Review the patient’s file to determine if they have been referred to other services. This includes referrals to social services, support groups, psychology services, nutrition services, medical clinics, substance abuse groups, etc.\n- Ask the patient if they attended the appointments, check in on their experience with the referral services and re-organize referrals as necessary.\n- Determine if the patient could benefit from a home visit.\n\n# Develop Adherence Plan\n\n- Go through each of the adherence challenges identified during the session and assist the patient to develop a plan that addresses each of the issues. It is important to let the patient come up with the solutions so that they can own them.\n- Some examples of addressing adherence challenges:\n- - Behavioural barriers: using a reminder tool; using a pill box; redefining the medication schedule to fit with the patient’s daily schedule; keeping an emergency dose of drugs when away from home.\n- Refer to clinician in case of side effects.\n- Socio-economical barriers: move on to disclosure process; identify a treatment buddy; join a support group; refer to CBO/NGO to learn about income generating activities.\n- Emotional barriers: emotional support or refer to clinician for mental health management.\n\nAgree on a follow-up date for the next session.\n\n# Session 2 (usually 2 weeks after Session 1, preferably with the same provider)\n\n# Review Adherence Plan\n\n- Ask the patient if he/she thinks adherence has improved since the last visit. Enquire in a friendly way if any doses have been missed.\n- Review the patient’s barriers to adherence documented during the first session and if strategies identified have been taken up. If not, discuss why.\n\n# Identify Any New Issues\n\n- Discuss specific reasons why the patient may have missed their pills or a clinic appointment since the last counselling session, and determine if it is a new issue that wasn’t addressed during the first session.\n- Discuss if other issues have come up because of implementing the adherence plan (e.g., perhaps the disclosure process had unintended results).\n\n# Referrals and Networking\n\n- Follow-up on any referrals made during the previous session.\n- Determine if the patient could benefit from a home visit.\n\n# Develop Adherence Plan\n\n- Go through each of the adherence challenges identified during the session and assist the patient to modify their original adherence plan to address each of the issues. It is important to let the patient come up with the solutions so that they own them.\n- Give another short motivational speech on how you believe in the patient! You know they can do this! Together you will make sure that they suppress their viral load!!', '## Table 5.10: Adherence Monitoring Strategies\n\n| Adherence Monitoring Strategy            | Technique                                                                                                                                                                                                                                                                                                                                                     | Frequency                                                                                                                                                                                                                                                                                                         |\n| ---------------------------------------- | ------------------------------------------------------------------------------------------------------------------------------------------------------------------------------------------------------------------------------------------------------------------------------------------------------------------------------------------------------------- | ----------------------------------------------------------------------------------------------------------------------------------------------------------------------------------------------------------------------------------------------------------------------------------------------------------------- |\n| **Subjective (self-reported adherence)** |                                                                                                                                                                                                                                                                                                                                                               |                                                                                                                                                                                                                                                                                                                   |\n| Morisky Medication Adherence Scale-4     | Use Table 5.11 to assess adherence using a standardized questionnaire, and take action as required                                                                                                                                                                                                                                                            | Every patient, every visit                                                                                                                                                                                                                                                                                        |\n| Morisky Medication Adherence Scale-8     | Use Table 5.12 to assess adherence using a standardized questionnaire, and take action as required                                                                                                                                                                                                                                                            | Any time a healthcare worker suspects adherence problems (e.g., patients with suspected or confirmed treatment failure; patient who misses an appointment)                                                                                                                                                        |\n| **Objective**                            |                                                                                                                                                                                                                                                                                                                                                               |                                                                                                                                                                                                                                                                                                                   |\n| Pill counts                              | Ask the patient to bring all their pills with them to follow-up visits. Calculate how many pills should be remaining based on the previous prescription date and amount prescribed, and compare to how many pills are actually remaining. Excess pills are assumed to be missed doses. Use Table 5.13 to calculate adherence rate and take action as required | * At every visit until confirmed viral suppression\n* Any time a healthcare worker suspects adherence problems                                                                                                                                                                                                     |\n| Pharmacy refill records                  | Compare drug pick-up date with expected date of pick-up (based on number of pills dispensed at last visit). If drug pick-up date is later than expected, it is assumed the patient is missing doses equivalent to the number of days late                                                                                                                     | - At every drug pick-up\n- Any time a healthcare worker suspects adherence problems                                                                                                                                                                                                                                |\n| Viral load                               | Follow the viral load monitoring algorithm (Figure 6.6). Undetectable VL is the best confirmation of adequate adherence                                                                                                                                                                                                                                       | * Age 0-24 years: at 3 months after ART initiation and then every 6 months\n* Age ≥ 25 years: at month 3 after ART initiation and month 12 then annually\n* For pregnant and breastfeeding women: at first ANC visit if already on ART, or 3 months after ART initiation if starting ART during pregnancy, and then |\n\n\n\n\n\n\n# Table 5:10 Cont.\n\nObserve where and how a patient stores and takes their medications and assess if they have extra medications because of missed doses. Home visits may also provide a better understanding of a patient’s living situation and specific barriers to adherence. Unscheduled home visits may be more revealing, but should only be conducted if the patient consented to home visits previously (preferably at the time of enrolment or initiation).\n\nAccurately assessing adherence requires clinicians to develop a collaborative and non-judgmental relationship with patients. This is best done when one provider follows an individual patient longitudinally. The key to asking patients about their adherence is not in the specifics of the tool used but in taking the time to ask about adherence regularly and doing so in an open and truly inquisitive manner. Otherwise, many patients will simply state what they believe the clinician wants to hear: perfect adherence.\n\nEvery provider in each ART service delivery point should receive training and gain confidence in assessing adherence and providing adherence support and counselling to the majority of patients who do not have significant barriers to adherence. However, patients with significant adherence challenges and multiple barriers to adherence should be referred to providers with additional training and time to offer dedicated and enhanced adherence support and counselling. Involving experienced colleagues at the same health facility should be done as soon as a concern is identified, and the patient should be discussed by the MDT to generate as many solutions as possible. Consultation with Mental Health Teams or regional or national mentors may be required for complex situations.', '# 5. Adherence Preparation, Monitoring and Support\n\nThe individual and population benefits of ART are dependent on high levels of adherence to the prescribed medication, the accompanying medical advice and the follow-up plans. Adherence-enhancing strategies should be implemented beginning at the point of HIV diagnosis (as part of post-test counselling and linkage), continued during initial evaluation, and thereafter during the entire follow-up period for ART.\n\nTo avoid treatment failure and the need to switch patients to 2nd or 3rd line ART, it is key to have an adherence support strategy in place before ART initiation, anticipating common and individual barriers to good adherence. Prevention of treatment failure starts at the time of HIV diagnosis. This is particularly important with the current recommendation that all PLHIV qualify for ART, and ART should be initiated within 2 weeks of diagnosis. Adherence preparation must begin at time of HIV testing, and close follow-up is required after ART initiation.\n\nThe adherence preparation, monitoring, and support that a patient requires should be tailored to their level of adherence, the stage of ART initiation, and the follow-up stage that they are at (Figure 5.1).\n\nWhenever possible, follow-up should be provided by the same care provider or team of care providers (e.g., same clinician and same counsellor) at each visit. This is particularly important during the first few months of HIV care.\n\n\n\n```mermaid\ngraph TD\n    A[HTS post-test counselling: key treatment preparation messages for all patients who test positive<br>• Treatment is available and recommended for everyone with HIV<br>• Starting treatment early reduces your chance of becoming ill or infecting your sexual partner(s)<br>• With good adherence you can live a long and productive life] --> B[Enrolment Visit<br>• HIV education and adherence preparation for all patients/caregivers (Table 5.1)<br>• ART Readiness Assessment for all patients/caregivers (Table 5.4), along with<br>  individualized adherence support plan]\n    B --> C[Ready to start ART]\n    B --> D[Not ready to start ART]\n    C --> E[• Initiate ART<br>• Baseline investigations if not already completed<br>• Provide standard package of care and differentiated<br>  care based on initial presentation (advanced disease vs<br>  well)<br>• Book follow-up appointment for week 2 and 4 to<br>  review adherence and side-effects<br>• Continue adherence support plan]\n    D --> F[• Weekly appointments to review clinical<br>  status, barriers to ART initiation, and provide<br>  ongoing HIV education and counselling<br>• Provide standard package of care<br>• Re-assessment of ART readiness at every<br>  visit, until ready (target is within 2 weeks)]\n    E --> G[Follow-up with adherence monitoring at every<br>visit (Table 5.10) and counselling based on<br>level of adherence (Table 5.14) until first VL at<br>3 months]\n    F --> C\n    G --> H[VL undetectable (LDL <200copies/ml )<br>• Ongoing adherence assessment and<br>  counselling (Table 5.16)<br>• Continue routine VL monitoring as per<br>  the population group]\n    G --> I[VL ≥ 200 copies/ml<br>• Suspect poor adherence<br>• Assess for barriers to adherence (Table 5.15)<br>• Follow VL algorithm with enhanced<br>  adherence assessment and interventions and<br>  assessment for other causes of viremia<br>  (Figure 6.6)]\n```\n\nFigure 5.1: Adherence Preparation, Monitoring and Support until Viral Load after 3 Months on ART']","The recommended adherence strategies for HIV/AIDS management include:

1. **Religious and Cultural Considerations:** Assess the impact of religious beliefs on medication adherence.

2. **Referrals and Networking:** Review and follow up on referrals to support services and consider home visits to understand patient barriers.

3. **Developing an Adherence Plan:** Collaboratively address adherence challenges with the patient, addressing specific barriers such as:
   - **Behavioral:** Use reminder tools, pill boxes, adjust schedules, keep emergency doses.
   - **Socio-economic:** Encourage disclosure, find a treatment buddy, join support groups, explore income-generating activities.
   - **Emotional:** Provide emotional support or refer for mental health management.

4. **Adherence Monitoring Strategies:** Use subjective tools like the Morisky Medication Adherence Scale, conduct objective assessments through pill counts, pharmacy records, and viral load monitoring, and consider home visits.

5. **Adherence Preparation and Support:** Start adherence support at HIV diagnosis, tailor it to the patient's ART stage, ensure continuity of care, and provide ongoing education and counseling.

6. **Follow-up and Continuous Support:** Regularly review and modify adherence plans, encourage open communication, and involve experienced colleagues and mental health teams for complex cases.",1.0,0.9375146893278644,43.92,llm,gpt-4o
What are the contraindications to efavirenz?,"['## Annexes\n\n### Table 12 A: Cont.\n\n| Drug name                                                                                                | Dose (in adults)                                   | Dietary restrictions | Major side effects                                                                                                                                             | Comments                                                                                                                                                                                                                                                                                                                                                                                                                                                                                                                                                              |\n| -------------------------------------------------------------------------------------------------------- | -------------------------------------------------- | -------------------- | -------------------------------------------------------------------------------------------------------------------------------------------------------------- | --------------------------------------------------------------------------------------------------------------------------------------------------------------------------------------------------------------------------------------------------------------------------------------------------------------------------------------------------------------------------------------------------------------------------------------------------------------------------------------------------------------------------------------------------------------------- |\n| Emtricitabine (FTC)<br/><br/>Available in 200mg capsules and as FDC with TDF and TDF/EFV                 | 200mg/ dose OD                                     | No food restrictions | Well tolerated. Lactic acidosis and severe hepatomegaly with steatosis (fatal cases have been reported); headache; diarrhoea; nausea; rash; skin discoloration | Effective against hepatitis B. Ideally, patients should be screened for chronic hepatitis B virus (HBV) before starting therapy; exacerbation of Hepatitis B has been reported in patients on discontinuation of FTC<br/><br/>Decrease dosage in patients with renal impairment Monitor renal function if combined with TDF.<br/><br/>When used in combination with TDF, should not be given to patients with a creatinine clearance of <30ml/min. Should not be used with or after failure of 3TC                                                                    |\n| Tenofovir disoproxil fumarate (TDF)<br/><br/>Available in 300mg tablets and as FDC with 3TC and 3TC/ EFV | 300mg/ dose OD                                     | No food restrictions | Lactic acidosis and severe hepatomegaly with steatosis (fatal cases have been reported with nucleoside analogues); renal toxicity; Pancreatitis                | Should not be used with ddI. Should never be used in triple nucleoside combinations with 3TC+ddI/ABC. Renal function should be monitored while on TDF<br/><br/>Ideally, patients should be screened for chronic hepatitis B virus (HBV) before starting therapy; Exacerbation of hepatitis B has been reported in patients on discontinuation of TDF<br/><br/>When used in combination with 3TC, should not be given to patients with a creatinine clearance of <30ml/min.<br/><br/>When used with ATV levels of ATV reduced significantly therefore combine with RTV |\n| Tenofovir alafenamide (TAF)<br/><br/>Various co-formulations available or being developed                | As TAF 25 mg alone or as part of co-formulated FDC | No food restrictions | Well tolerated. GIT upsets, raised serum creatinine, proteinuria and renal toxicity (but to a lesser degree than TDF)                                          | RTV and cobicistat increase TAF levels. DRV decreases TAF levels. Boosted PI increase TAF levels but the PI levels are not affected.<br/><br/>Avoid co-administration with rifabutin, rifampicin and phenytoin                                                                                                                                                                                                                                                                                                                                                        |\n\n\n\n\n\n\n# Kenya HIV Prevention and Treatment Guidelines, 2022\n\n## Annex 12 B: Use of Non-Nucleoside Reverse Transcriptase Inhibitors for Adults\n\n| Drug name                                                                                  | Dose (in adults)                               | Dietary restrictions                                                                                                                                      | Major side effects                                                                                                                                                                                                                              | Comments                                                          |\n| ------------------------------------------------------------------------------------------ | ---------------------------------------------- | --------------------------------------------------------------------------------------------------------------------------------------------------------- | ----------------------------------------------------------------------------------------------------------------------------------------------------------------------------------------------------------------------------------------------- | ----------------------------------------------------------------- |\n| Efavirenz (EFV)<br/>Available in 200mg<br/>& 600mg tablets<br/>and as FDC with<br/>TDF/3TC | 600mg<br/>OD Best<br/>taken<br/>at<br/>bedtime | Preferably<br/>taken on an<br/>empty<br/>stomach.<br/>Can be given<br/>with food,<br/>but avoid<br/>high fat<br/>meals which<br/>increase<br/>absorption. | CNS symptoms<br/>(somnolence, insomnia,<br/>abnormal dreams,<br/>confusion,<br/>hallucination, amnesia,<br/>etc. Avoid in patients<br/>with history of<br/>psychiatric disease);<br/>Skin rash; avoid use in<br/>during the first<br/>trimester | Can be used with rifampicin in TB<br/>patients                    |\n| Etravirine (ETR)<br/>Available in tablets<br/>of 200 mg                                    | 200 mg<br/>BD                                  | Take with<br/>food                                                                                                                                        | Severe but rare: SJS and<br/>erythema multiforme<br/>Common & minor:<br/>Rash, nausea, vomiting,<br/>diarrhoea, abdominal<br/>pain, hepatotoxicity,<br/>dyslipidaemia and CNS<br/>disturbances (less than<br/>EFV)                              | Avoid concurrent use with<br/>rifampicin, and boosted tipranavir. |', '# Annexes\n\n## Annex 13 A: Drug-Drug Interactions - NNRTIs\n\n| Drugs Affected       | Nevirapine (NVP)                                                                                                                                                                                                                         | Efavirenz (EFV)                                                                                                                                                                                                                          |\n| -------------------- | ---------------------------------------------------------------------------------------------------------------------------------------------------------------------------------------------------------------------------------------- | ---------------------------------------------------------------------------------------------------------------------------------------------------------------------------------------------------------------------------------------- |\n| ANTIRETROVIRALS      |                                                                                                                                                                                                                                          |                                                                                                                                                                                                                                          |\n| Dolutegravir         | Co-administration not recommended because NVP decreases levels of DTG                                                                                                                                                                    | Co-administration not recommended because EFV decreases levels of DTG. If must be used together then increase DTG to 50 mg BD when co-administered with EFV                                                                              |\n| Raltegravir          | No interaction or not studied                                                                                                                                                                                                            | Efavirenz decreases RAL plasma levels but it is unlikely to be clinically significant                                                                                                                                                    |\n| Atazanavir/ritonavir | Co-administration not recommended because ATV/r may increase the serum concentration of NVP leading to increased risk of toxicity, and NVP decreases the serum concentration of ATV/r which may lead to resistance and treatment failure | Co-administration not recommended because EFV decreases the serum concentration of ATV/r which may lead to resistance and treatment failure                                                                                              |\n| Lopinavir/ritonavir  | Co-administration not recommended because NVP decreases levels of LPV/r                                                                                                                                                                  | AVOID: this combination increased risk of prolonged-QT syndrome and sudden cardiac death                                                                                                                                                 |\n| Darunavir/ ritonavir | No significant interaction when NVP is combined with ritonavir-boosted darunavir                                                                                                                                                         | Co-administration not recommended because DRV/r may increase the serum concentration of EFV leading to increased risk of toxicity, and EFV decreases the serum concentration of DRV/r which may lead to resistance and treatment failure |\n\n\n\n\n\n\nKenya HIV Prevention and Treatment Guidelines, 2022\n\n## Annex 13 A: Cont.\n\n| ANTIFUNGALS  | ANTIFUNGALS                                                                                                                                                                                                | ANTIFUNGALS                                                                      |\n| ------------ | ---------------------------------------------------------------------------------------------------------------------------------------------------------------------------------------------------------- | -------------------------------------------------------------------------------- |\n| Ketoconazole | Levels: ketoconazole ↓ 63%<br/>NVP ↑ 15 – 30%<br/>Dose: Not recommended                                                                                                                                    | No data                                                                          |\n| Voriconazole | Metabolism of Voriconazole may be induced by NVP. Voriconazole may inhibit NNRTI metabolism. Frequently monitor for NNRTI toxicity and antifungal outcome                                                  | Levels: EFV ↑ 44%<br/>Voriconazole ↓ 77%<br/>This combination is not recommended |\n| Fluconazole  | NVP Levels: Cmax, AUC, and Cmin ↑ 100%<br/>Fluconazole Levels: No change<br/>Risk of hepatotoxicity may increase with this combination. If concomitant use is necessary, recommend monitoring NVP toxicity | No clinically significant changes in EFV or Fluconazole concentrations           |\n\n\n| ANTI-MYCOBACTERIALS | ANTI-MYCOBACTERIALS                                                                                                                                                                                                                   | ANTI-MYCOBACTERIALS                                                             |\n| ------------------- | ------------------------------------------------------------------------------------------------------------------------------------------------------------------------------------------------------------------------------------- | ------------------------------------------------------------------------------- |\n| Rifampicin          | Levels: NVP ↓ 20%-58%. Virologic consequences are uncertain; the potential for additive hepatotoxicity exists. Use of this combination is not recommended; however, if used, co administration should be done with careful monitoring | Levels: EFV ↓ 25%.<br/>Dose: Consider ↑ EFV to 800 mg QD                        |\n| Clarithromycin      | Levels: NVP ↑ 26%. Clarithromycin ↓ 30%. Monitor for efficacy or use alternative agent                                                                                                                                                | Levels: Clarithromycin ↓ 39%.<br/>Monitor for efficacy or use alternative agent |\n| Bedaquiline (BDQ)   | No dose adjustment required                                                                                                                                                                                                           | Do not co-administer                                                            |\n| Delamanid (DLM)     | No interaction expected                                                                                                                                                                                                               | No interaction                                                                  |\n\n\n| ORAL CONTRACEPTIVES | ORAL CONTRACEPTIVES                                                           | ORAL CONTRACEPTIVES                                                                               |\n| ------------------- | ----------------------------------------------------------------------------- | ------------------------------------------------------------------------------------------------- |\n|                     | Levels: ethinyl estradiol approx. 20%. Use alternative or additional methods. | Levels: Ethinyl estradiol 37%. No data on other components. Use alternative or additional methods |', '# Kenya HIV Prevention and Treatment Guidelines, 2022\n\n## Annex 13 C: Drug-Drug Interactions – INSTIs\n\n| Drugs Affected    | Dolutegravir (DTG)                                                                                                                                                                                                                                                                                                                                    | Raltegravir (RAL)                                                                                                                                                                                                           |\n| ----------------- | ----------------------------------------------------------------------------------------------------------------------------------------------------------------------------------------------------------------------------------------------------------------------------------------------------------------------------------------------------- | --------------------------------------------------------------------------------------------------------------------------------------------------------------------------------------------------------------------------- |\n| Efavirenz         | Co-administration not recommended because EFV decreases levels of DTG. If must be used together then increase DTG to 50 mg BD when co-administered with EFV.                                                                                                                                                                                          | Efavirenz decreases RAL plasma levels but it is unlikely to be clinically significant                                                                                                                                       |\n| Etravirine        | Co-administration not recommended because ETR decreases levels of DTG, unless used in combination with a PI/r (which counteracts the interaction between DTG and ETR)<br/><br/>If must be used together without a PI/r then increase DTG to 50 mg BD when co-administered with ETR. If used together with a PI/r then standard dose DTG is sufficient | Etravirine decreases RAL plasma levels so co-administration when using once-daily RAL is not recommended. Co-administration when using standard BD RAL dosing is acceptable                                                 |\n| Rifampicin        | Increase DTG to 50 mg BD when co-administered with rifampicin (for children, use double the standard weight-based DTG dose by administering twice daily).<br/><br/>There is no known drug interaction between DTG and rifabutin.                                                                                                                      | Increase RAL to 800 mg BD when co-administered with rifampicin (for children, use double the standard weight-based RAL dose).<br/><br/>Rifabutin may alter RAL plasma levels but it is unlikely to be clinical significant. |\n| Rifapentine       | Potential decreased DTG levels when co-administered with once-weekly rifapentine – no dose adjustment required unless viral load becomes detectable, in which case increase DTG to twice daily until two weeks after completion of rifapentine-based TPT                                                                                              | Potential increased RAL levels when co-administered with once-weekly rifapentine – no dose adjustment required but monitor for RAL toxicity                                                                                 |\n| Bedaquiline (BDQ) | No interactions expected                                                                                                                                                                                                                                                                                                                              | No interactions expected                                                                                                                                                                                                    |\n| Delamanid (DLM)   | No interactions expected                                                                                                                                                                                                                                                                                                                              | No interactions expected                                                                                                                                                                                                    |\n| Metformin         | DTG may increase metformin plasma levels so metformin dose may need to be decreased. Limit daily metformin dose to 1,000mg.<br/><br/>DTG does NOT require a dose adjustment is when used with metformin.                                                                                                                                              | No interaction                                                                                                                                                                                                              |\n\n\n\n\n\n\n# Annexes\n\n## Annex 13 C: Cont.\n\n| Drugs Affected                                                                                                                    | Dolutegravir (DTG)                                                                                                                                                                                                                                                                                                               | Raltegravir (RAL)                                                        |\n| --------------------------------------------------------------------------------------------------------------------------------- | -------------------------------------------------------------------------------------------------------------------------------------------------------------------------------------------------------------------------------------------------------------------------------------------------------------------------------- | ------------------------------------------------------------------------ |\n| Anticonvulsants<br/>-Carbamazepine<br/>-Phenobarbital<br/>-Phenytoin                                                              | Avoid use of DTG with carbamazepine, phenobarbital, or phenytoin because they decrease DTG plasma levels.<br/><br/>If the DTG must be used in combination with any of these anticonvulsants than increase DTG dose to 50mg BD and monitor viral load.                                                                            | No interaction                                                           |\n| Mineral supplements and antacids containing cations (e.g., calcium, iron, zinc, magnesium, aluminum), including prenatal vitamins | Administer DTG at least 2 hours before or 6 hours after taking any of these supplements (note: if taking DTG with a meal then it is safe to take at the same time as prenatal vitamins, calcium, or iron)<br/><br/>There are no drug-drug interactions between DTG and proton pump inhibitors or H2 blockers used for gastritis. | Do not use calcium, magnesium and aluminum containing antacids with RAL. |\n| Methadone                                                                                                                         | No interaction                                                                                                                                                                                                                                                                                                                   | No interaction                                                           |']","The contraindications to efavirenz include:

1. **History of Psychiatric Disease**: Avoid in patients with a history of psychiatric conditions due to potential CNS side effects.
2. **Pregnancy**: Avoid during the first trimester due to potential teratogenic effects.
3. **Drug-Drug Interactions**:
   - Avoid co-administration with dolutegravir, atazanavir/ritonavir, lopinavir/ritonavir, darunavir/ritonavir, and voriconazole due to significant interactions affecting drug levels and potential toxicity or treatment failure.
   - Use caution with rifampicin and oral contraceptives due to decreased efavirenz and ethinyl estradiol levels, respectively.",0.7142857142857143,1.0000000000000009,15.35,llm,gpt-4o
Can HIV be managed with a two-drug regimen?,"[""# 6. Antiretroviral Therapy in Infants, Children, Adolescents, and Adults\n\nART, while very effective in managing HIV disease, does not cure HIV infection. The goal of ART is to suppress viral replication with the aim of reducing the patient's VL to undetectable levels. Uninterrupted ART with ongoing strict adherence will help maintain undetectable VL levels thereby preventing damage to the body's immune system, reducing AIDS-related morbidity and mortality and the risk of sexual and vertical transmission of HIV.\n\n## 6.1 Eligibility for ART\n\n| All individuals with confirmed HIV infection are eligible for ART irrespective of CD4 count, WHO clinical stage, age, pregnancy or breastfeeding status, co-infection status, risk group, or any other criteria. |\n| ---------------------------------------------------------------------------------------------------------------------------------------------------------------------------------------------------------------- |\n\n\n## 6.2 Timing of ART Initiation\n\nART should be started in all patients as soon as possible, preferably within 2 weeks of confirmation of HIV status, and even on the same day as testing positive for HIV if they are ready.\n\nART Readiness Criteria (Table 5.4) can be used to help determine any issues that need to be addressed around the time of ART initiation. Same-day ART initiation (on the same day as testing HIV-positive) has additional benefits for HIV prevention (e.g., for pregnant and breastfeeding women, and the HIV positive partner in a discordant relationship), and is associated with improved retention, viral suppression, and survival. Special considerations for timing of ART initiation are listed in Table 6.1.\n\n\n\n## Table 6.1: Special Considerations for Timing of ART Initiation\n\n| Population                                                   | Timing of ART Initiation                                                                                                                                                                                                                                                                            | Additional Notes                                                                                                        |\n| ------------------------------------------------------------ | --------------------------------------------------------------------------------------------------------------------------------------------------------------------------------------------------------------------------------------------------------------------------------------------------- | ----------------------------------------------------------------------------------------------------------------------- |\n| Pregnant and breastfeeding women                             | Support ART initiation on the same day as testing positive for HIV                                                                                                                                                                                                                                  | Intensive adherence counselling, support and close follow-up required because of limited time for patient preparation   |\n| Infants (< 12 months old)                                    | Support ART initiation on the same day as testing positive for HIV. Treatment should commence following a first positive PCR test. ALWAYS take a sample for a confirmatory PCR test as soon as the first positive PCR result is received, but do not delay ART initiation for the second PCR result | Intensive adherence counselling, support and close follow-up required because of limited time for caregiver preparation |\n| Patients with strong motivation to start ART immediately     | Support ART initiation as soon as the patient feels ready, preferably on the same day as testing positive for HIV                                                                                                                                                                                   | Intensive adherence counselling, support and close follow-up required because of limited time for patient preparation   |\n| Patients with newly diagnosed TB                             | Start anti-TB treatment immediately and initiate ART as soon as anti-TB medications are tolerated, preferably within 2 weeks. For TB meningitis delay ART for 4 to 8 weeks                                                                                                                          | Monitor closely for IRIS (Annex 16)                                                                                     |\n| Patients with cryptococcal meningitis                        | Defer ART until after completing 5 weeks of CM treatment                                                                                                                                                                                                                                            | Monitor closely for IRIS (Annex 16)                                                                                     |\n| Patients for whom adherence will be particularly challenging | Start ART as soon as possible while implementing additional support systems (e.g., optional enrolment of a PWID into a MAT program; psychiatric treatment for a patient with mental illness; enrolment into an OVC program for orphans etc.)                                                        | A case manager should be assigned to all patients with complex adherence challenges                                     |\n| All other patients                                           | Start ART as soon as possible, preferably within 2 weeks, and even on the same day as testing positive for HIV if they are ready                                                                                                                                                                    | Continued adherence monitoring and support is recommended after ART initiation for all patients                         |"", '# Antiretroviral Therapy in Infants, Children, Adolescents, and Adults\n\n## Table 6.11: Possible Third-line ART in Children, Adolescents and Adults\n\n|          | Possible 3ʳᵈ Line Regimen        | Comment                                                                                                                                                                                                              |\n| -------- | -------------------------------- | -------------------------------------------------------------------------------------------------------------------------------------------------------------------------------------------------------------------- |\n| Children | DTG + 3TC + DRV/r                | Third line ART selection is based on DRT results<br/><br/>Note that the Regional or National HIV Clinical TWG may recommend reusing some of the ARVs the patient has already failed, even when resistance is present |\n|          | DTG + AZT + 3TC + DRV/r          |                                                                                                                                                                                                                      |\n|          | DTG + ABC (or TDF) + 3TC + DRV/r |                                                                                                                                                                                                                      |\n|          | ETV + 3TC + DRV/r                |                                                                                                                                                                                                                      |\n| Adults   | DTG + 3TC + DRV/r                |                                                                                                                                                                                                                      |\n|          | DTG + AZT + 3TC + DRV/r          |                                                                                                                                                                                                                      |\n|          | DTG + TDF + 3TC + DRV/r          |                                                                                                                                                                                                                      |\n|          | DTG + TDF (or AZT) + 3TC         |                                                                                                                                                                                                                      |\n|          | ETV + 3TC + DRV/r                |                                                                                                                                                                                                                      |\n\n\n\n\nNO_CONTENT_HERE', '# Table 6.10 Cont.\n\n1. If any drug in the recommended 2nd line regimen is contraindicated or previously not tolerated, consult the Regional or National HIV Clinical TWG (Uliza Hotline 0726 460 000; https://nhcsc.nascop.org/clinicalform). Such patients may require DRT to select agents for the second-line ART. Additional drugs may be recommended on a case-by-case basis, including DRV/r, ATV/r, RAL, or ETR.\n2. Patients failing DTG-based or PI-based first-line regimens should have a Drug Resistance Test (DRT) ordered as soon as treatment failure is confirmed. The patient summary and DRT results should be sent to the Regional or National HIV Clinical TWG (https://nhcsc.nascop.org/clinicalform) or call Uliza Hotline (0726 460 000) to determine the most suitable second-line regimen for the patient. The DRT results will be used to determine if there is true DTG or PI failure or if there is an underlying problem with non-adherence. Daily witnessed ingestion is recommended prior to performing DRT.\n\n# Important Considerations for First-line Treatment Failure in Children\n\n- Second-line ART in infants and children is more complex to manage. These children and their caregivers should undergo thorough clinical and psychosocial assessment to rule out inter-current illness or non-adherence as the reason for a high viral load.\n- All children failing first-line should be discussed in the MDT and preferably with an experienced ART provider prior to change of ART to second-line. However, this should not cause undue delay in switching a failing regimen.\n- The choices for infants and children failing an alternative first-line regimen are limited and may need to be discussed with the Regional or National HIV Clinical TWG. Some of these children will require HIV DRT to determine the most suitable second-line regimen.\n\n# Important considerations for second-line ART Treatment Failure\n\n- Patients failing second-line ART have limited options. ARVs used to construct a third-line regimen are often more expensive, will have increased pill burden and more side effects. These factors will exacerbate pre-existing poor adherence.\n- Second-line treatment failure should be confirmed by viral load testing following the viral load monitoring algorithm (Figure 6.6).\n1. After the first detectable VL (≥ 50 copies/ml), assess for and address all causes of poor adherence, and assess for all other possible causes of viremia.\n2. These patients should be discussed at an MDT session. Repeat the VL after 3 months of excellent adherence (preferably with daily witnessed ingestion of the ARVs by a treatment buddy, relative, CHV, etc.).\n3. If the second VL is still ≥ 50 copies/ml then continue the failing second-line regimen while reassessing adherence and other causes of viremia, implementing adherence support systems as needed, and then repeat the VL after another 3 months.\n4. If viremia continues then consult the Regional or National HIV Clinical TWG (Uliza Hotline 0726 460 000; https://nhcsc.nascop.org/clinicalform) using the national case summary form (Annex 9B). These patients will likely require DRT in order for the TWG to design the most suitable third-line regimen.\n- Patients failing second-line ART require thorough assessment for barriers to adherence and ongoing enhanced adherence support including:\n- Assigning a case manager\n- More frequent adherence counselling by a trained counsellor\n- Assessment and treatment of mental health and substance use disorders']","The guideline excerpts do not explicitly discuss the use of a two-drug regimen for managing HIV. They emphasize the importance of tailoring ART regimens to individual needs, particularly in cases of treatment failure or drug resistance, and highlight the complexity and customization required in ART management.",1.0,0.0,13.25,llm,gpt-4o
How do you handle treatment failure?,"['# Section 6: Treatment failure\n\n- What happens if you stop taking ART:\n- When you stop taking ART the virus begins to increase in your body very quickly\n- The virus goes back to the same high level it was at before you started ART\n- What happens if you do not take ART regularly:\n- The virus begins to increase to high levels again\n- What happens if the viral load increases:\n- When the virus is allowed to increase again, it will also affect your immunity and reduce your CD4 count putting you at risk of opportunistic infections\n- When the virus is allowed to increase again, it can change and get stronger, and becomes resistance to the ART\n- When the virus becomes resistant, the ART does not work against the virus anymore\n- The risk of resistance increases by not taking the ART correctly and by starting and stopping the medications several times\n- When resistance occurs, this is called treatment failure\n- What happens in treatment failure:\n- The ART no longer works because the virus has become resistant to it\n- If treatment fails, it is necessary to use stronger, more expensive ART, but it still may not work as well\n- With the stronger ART you may need to take more pills every day, and you may have more side effects\n- If you become resistant to the new ART as well, then there may not be any drugs that can work for you, and the virus will increase quickly and your CD4 count will go way down\n- It is essential that you take your ART every day as prescribed so that you do not develop treatment failure, and can live a long and healthy life\n\n# Section 7: ART side effects\n\n- What are the side-effects of ART:\n- Sometimes people can get side effects from taking ART\n- Side effects vary from person to person\n- Some people have none while other experience mild effects which are unpleasant but often manageable\n- Most side effects occur within the first few weeks of starting ART and then improve after a few weeks or months\n- Some common side effects include:\n- Headache\n- Loss of appetite\n- Skin rash\n- Fatigue\n- Nausea, vomiting, diarrhoea\n- Muscle pains\n- What do you do if you notice any side effects:\n- If you develop any side effects, you should continue taking your ART as prescribed, without missing any doses, until you discuss with the clinician\n- If the side effects are mild then you can continue taking your ART without missing any doses, and then discuss the side effects with the clinician at your next appointment\n- If the side effects are bothering you too much then return to the clinic immediately, even if you do not have a scheduled appointment, to discuss what to do next; you can also call the clinic if you are not able to make it yourself immediately\n- Severe side effects include rash all over your body, or rash in your mouth or eyes, constant vomiting, inability to eat or retain food, or anything else that makes you think you should stop the ART. If this\n\n# Annex 8: Cont.\n\n# Section 8: Adherence\n\n- What is adherence\n- Following a care plan as agreed with the healthcare team\n- Attending clinic appointments as scheduled\n- Picking up medicines and taking them as prescribed\n- Getting lab tests according to the recommended schedule\n- Following nutritional recommendations\n- How should ART be taken\n- You must take the correct dosage. If you take less than the dose prescribed the treatment will not be effective and will result in resistance and treatment failure. Never share your ART with someone else\n- For children, the dosage keeps changing as they grow and gain weight\n- You must take ART at the correct time of day:\n- If your ART is supposed to be taken once per day, then pick a time when it will usually be convenient for you to remember, e.g., with breakfast every day.\n- If your ART is supposed to be taken twice per day, then you should set a convenient time to take your drugs approximately 12 hours apart (e.g., 8.00 am and 8.00 pm every day). It does not have to be exactly 12 hours apart if your schedule does not allow; the most important thing is to take them twice per day every day (e.g., you can take it at 6.00 am and 8.00 pm every day)\n- If you miss a dose of ART then take your dose as soon as you remember, as long as it is not within a couple of hours of your next dose, and then return to your regular schedule. Do not take a double-dose of ART to make up for a missed dose\n- You must take ART according to dietary restrictions. Some ART should be taken with food, for some it does not matter, and a few require that you have an empty stomach.', '# Antiretroviral Therapy in Infants, Children, Adolescents, and Adults\n\n> Non-adherence is the most frequent cause of treatment failure. As per the viral load\nmonitoring algorithm, adherence issues must be addressed BEFORE confirming\ntreatment failure.\n\nDaily witnessed ingestion by a treatment buddy or healthcare worker is recommended to confirm\nexcellent adherence before repeating the VL. All adherence issues must be resolved before\nswitching to a new regimen otherwise the patient will quickly fail the new regimen as well, and\nsoon run out of viable ART options. An exception to this may be when the regimen itself is\nthe primary cause of poor adherence (e.g., side effects from one of the ARVs are not\nmanageable such as severe diarrhea with LPV/r that does not improve with symptom\nmanagement), in which case the regimen may need to be modified to allow for perfect adherence.\nThis should be done in consultation with the Regional or National HIV Clinical TWG.\n\nChapter 5 provides detailed guidance on adherence preparation, assessment, and support.\n\n## Table 6.10: Recommended Second-line ART Regimens in Infants, Children, Adolescents and Adults, excluding TB/HIV co-infection ¹\n\n| Weight/scenario                  | First-line ART                                                                                      | Second-line ART                                                                                                          |\n| -------------------------------- | --------------------------------------------------------------------------------------------------- | ------------------------------------------------------------------------------------------------------------------------ |\n| < 30 kg                          | ABC (or AZT) + 3TC + DTG                                                                            | DRT-based second-line²,³                                                                                                 |\n|                                  | ABC + 3TC + LPV/r                                                                                   | Take sample for DRT and change to AZT + 3TC + DTG while awaiting DRT results; modify based on DRT results if indicated   |\n|                                  | AZT + 3TC + LPV/r                                                                                   | Take sample for DRT and change to ABC + 3TC + DTG while awaiting DRT results; modify based on DRT results if indicated   |\n|                                  | ABC + 3TC + EFV                                                                                     | AZT + 3TC + DTG                                                                                                          |\n|                                  | AZT + 3TC + EFV                                                                                     | ABC + 3TC + DTG                                                                                                          |\n| ≥ 30 kg or ≥ 15 years old        | TDF (or ABC) + 3TC + DTG (or PI/r)                                                                  | DRT-based second-line²                                                                                                   |\n|                                  | TDF (or ABC) + 3TC + EFV                                                                            | TDF + 3TC + DTG                                                                                                          |\n|                                  | AZT + 3TC + EFV                                                                                     | TDF + 3TC + DTG                                                                                                          |\n| Pregnant and Breastfeeding women | TDF (or ABC) + 3TC + DTG                                                                            | Take sample for DRT and change to TDF + 3TC + ATV/r while awaiting DRT results; modify based on DRT results if indicated |\n|                                  | TDF (or ABC) + 3TC + PI/r                                                                           | Take sample for DRT and change to TDF + 3TC + DTG while awaiting DRT results; modify based on DRT results if indicated   |\n|                                  | TDF (or ABC) + 3TC + EFV                                                                            | TDF + 3TC + DTG                                                                                                          |\n|                                  | AZT + 3TC + EFV                                                                                     | TDF + 3TC + DTG                                                                                                          |\n| HIV/HBV Co-infection             | Always maintain TDF in order to treat the HBV as well as HIV                                        |                                                                                                                          |\n| TB/HIV Co-infection              | Refer to Table 8.8: Recommended ART Regimens for Patients who Develop TB while Failing 1ˢᵗ Line ART |                                                                                                                          |', '# Table 6.10 Cont.\n\n1. If any drug in the recommended 2nd line regimen is contraindicated or previously not tolerated, consult the Regional or National HIV Clinical TWG (Uliza Hotline 0726 460 000; https://nhcsc.nascop.org/clinicalform). Such patients may require DRT to select agents for the second-line ART. Additional drugs may be recommended on a case-by-case basis, including DRV/r, ATV/r, RAL, or ETR.\n2. Patients failing DTG-based or PI-based first-line regimens should have a Drug Resistance Test (DRT) ordered as soon as treatment failure is confirmed. The patient summary and DRT results should be sent to the Regional or National HIV Clinical TWG (https://nhcsc.nascop.org/clinicalform) or call Uliza Hotline (0726 460 000) to determine the most suitable second-line regimen for the patient. The DRT results will be used to determine if there is true DTG or PI failure or if there is an underlying problem with non-adherence. Daily witnessed ingestion is recommended prior to performing DRT.\n\n# Important Considerations for First-line Treatment Failure in Children\n\n- Second-line ART in infants and children is more complex to manage. These children and their caregivers should undergo thorough clinical and psychosocial assessment to rule out inter-current illness or non-adherence as the reason for a high viral load.\n- All children failing first-line should be discussed in the MDT and preferably with an experienced ART provider prior to change of ART to second-line. However, this should not cause undue delay in switching a failing regimen.\n- The choices for infants and children failing an alternative first-line regimen are limited and may need to be discussed with the Regional or National HIV Clinical TWG. Some of these children will require HIV DRT to determine the most suitable second-line regimen.\n\n# Important considerations for second-line ART Treatment Failure\n\n- Patients failing second-line ART have limited options. ARVs used to construct a third-line regimen are often more expensive, will have increased pill burden and more side effects. These factors will exacerbate pre-existing poor adherence.\n- Second-line treatment failure should be confirmed by viral load testing following the viral load monitoring algorithm (Figure 6.6).\n1. After the first detectable VL (≥ 50 copies/ml), assess for and address all causes of poor adherence, and assess for all other possible causes of viremia.\n2. These patients should be discussed at an MDT session. Repeat the VL after 3 months of excellent adherence (preferably with daily witnessed ingestion of the ARVs by a treatment buddy, relative, CHV, etc.).\n3. If the second VL is still ≥ 50 copies/ml then continue the failing second-line regimen while reassessing adherence and other causes of viremia, implementing adherence support systems as needed, and then repeat the VL after another 3 months.\n4. If viremia continues then consult the Regional or National HIV Clinical TWG (Uliza Hotline 0726 460 000; https://nhcsc.nascop.org/clinicalform) using the national case summary form (Annex 9B). These patients will likely require DRT in order for the TWG to design the most suitable third-line regimen.\n- Patients failing second-line ART require thorough assessment for barriers to adherence and ongoing enhanced adherence support including:\n- Assigning a case manager\n- More frequent adherence counselling by a trained counsellor\n- Assessment and treatment of mental health and substance use disorders']","To handle treatment failure in HIV/AIDS management:

1. **Address Non-Adherence:** Resolve adherence issues before confirming treatment failure and switching regimens. Implement daily witnessed ingestion by a treatment buddy or healthcare worker.

2. **Second-Line ART Regimens:** Determine second-line regimens based on the first-line regimen, possibly requiring Drug Resistance Testing (DRT). For infants and children, conduct thorough clinical and psychosocial assessments.

3. **Managing Second-Line Treatment Failure:**
   - Confirm failure with viral load testing.
   - Address all causes of poor adherence and other possible causes of viremia.
   - Repeat viral load testing after 3 months of excellent adherence.
   - If viremia persists, consult with the Regional or National HIV Clinical TWG for guidance on third-line regimens.

4. **Enhanced Adherence Support:** Assign a case manager, provide frequent adherence counseling, and assess and treat any mental health or substance use disorders.

5. **Consultation and Coordination:** Engage with specialized teams for complex cases and regimen adjustments, using the national case summary form and consulting the Uliza Hotline for guidance.",0.9375,0.9138103084052941,21.57,llm,gpt-4o
When is regimen switching appropriate?,"['# Annex 9 E: Management Protocol for Patients Switching to 3rd Line ART\n\n# Management Protocol for patients switching to 3ʳᵈ line ART\n\n# Pre – Initiation MDT Meeting\n\n- Confirm what 3ʳᵈ line ARV regimen is prescribed, its availability and the management plan\n- Assign a case manager to patient\n\n# Initiation of 3ʳᵈ Line ART\n\n- Triage\n- Record vital signs and take actions as needed\n- Adherence support\n- Conduct patient education on the new ART regimen: Treatment goals, dosing, drug interactions and potential side effects and adverse events\n- Conduct adherence assessment and counselling\n- Link patient to adherence support systems\n- Clinical assessment\n- Take history and conduct physical examination\n- Complete clinical encounter form and MOH 257 (Green Card)\n- Manage any co-infection and co-morbidities\n- Review for potential drug interactions and contraindications\n- Conduct adherence assessment and review adherence support systems including daily witnessed ingestion plan\n- Reinforce patient education messages on new regimen\n- Currently limited future treatment options\n- Need for perfect adherence (>95%)\n- Dosing schedule and timing\n- Potential side effects and what the patient should do\n- Prescribe new regimen for 2 weeks\n- Confirm dosing as per the weight (for ≤15)\n- Continue other medication e.g., CPT, OI treatment etc.\n- Dispensing\n- Confirm ARV dosing as per the weight (for ≤15)\n- Conduct medication use counselling\n- Dispense 3ʳᵈ Line ARVs for 2 weeks\n- Check for possible drug interaction\n- Community follow up\n- Link all patients to support group, CHV/CHA\n- Plan for home visits as required\n\nAnnex 9 E: cont.\n\n# Patient Follow Up after Treatment Initiation\n\n# Frequency\n\n- First follow-up should be within 2 weeks of initiation of 3rd line ART\n- Subsequent visits should be monthly (or more frequent) until confirmed viral suppression at 6 months\n- Thereafter, follow-up can be 1-3 monthly\n\n# Triage\n\n- Record vital signs and take action as needed\n\n# Adherence Support\n\n- Adherence should be reinforced during every clinic visit, in addition to enhanced adherence counselling sessions\n- Review and address knowledge deficits on new regimen\n- Confirm understanding of adherence, conduct adherence assessment, and reinforce key adherence messages\n- Document reasons for missed doses and manage obstacles to perfect adherence. Review and reinforce adherence support systems\n\n# Clinical Assessment\n\n- Take history and conduct physical examination\n- Complete Clinical Encounter Form and MOH 257 (blue card)\n- Manage any co-infections and co-morbidities\n- Evaluate for potential drug interactions\n- Evaluate for and manage any drug side effects and adverse events\n- Conduct adherence assessment and review adherence support systems\n- Reinforce patient education messages on new regimen\n- - Review and address knowledge gaps on ART regimen\n- Need for perfect adherence (>95%)\n- Dosing schedule and timing\n- Potential side effects and what the patient should do\n\nPrescribe 3rd line ARVs\n\n# Viral Load\n\n- Viral load should be conducted 3 months after change of regimen\n\n# Dispensing\n\n- Confirm ARV dosing as per the weight\n- Conduct medication use counselling\n- Dispense 3rd line ARVs\n\n# Community Follow Up\n\n- Review linkage to community adherence support systems\n- Conduct home visits as required\n- Continue DOTS\n\n# NOTE\n\n- 3ʳᵈ line annual report with viral load, adherence, and outcomes to be sent to NASCOP', '# Antiretroviral Therapy in Infants, Children, Adolescents, and Adults\n\n> Non-adherence is the most frequent cause of treatment failure. As per the viral load\nmonitoring algorithm, adherence issues must be addressed BEFORE confirming\ntreatment failure.\n\nDaily witnessed ingestion by a treatment buddy or healthcare worker is recommended to confirm\nexcellent adherence before repeating the VL. All adherence issues must be resolved before\nswitching to a new regimen otherwise the patient will quickly fail the new regimen as well, and\nsoon run out of viable ART options. An exception to this may be when the regimen itself is\nthe primary cause of poor adherence (e.g., side effects from one of the ARVs are not\nmanageable such as severe diarrhea with LPV/r that does not improve with symptom\nmanagement), in which case the regimen may need to be modified to allow for perfect adherence.\nThis should be done in consultation with the Regional or National HIV Clinical TWG.\n\nChapter 5 provides detailed guidance on adherence preparation, assessment, and support.\n\n## Table 6.10: Recommended Second-line ART Regimens in Infants, Children, Adolescents and Adults, excluding TB/HIV co-infection ¹\n\n| Weight/scenario                  | First-line ART                                                                                      | Second-line ART                                                                                                          |\n| -------------------------------- | --------------------------------------------------------------------------------------------------- | ------------------------------------------------------------------------------------------------------------------------ |\n| < 30 kg                          | ABC (or AZT) + 3TC + DTG                                                                            | DRT-based second-line²,³                                                                                                 |\n|                                  | ABC + 3TC + LPV/r                                                                                   | Take sample for DRT and change to AZT + 3TC + DTG while awaiting DRT results; modify based on DRT results if indicated   |\n|                                  | AZT + 3TC + LPV/r                                                                                   | Take sample for DRT and change to ABC + 3TC + DTG while awaiting DRT results; modify based on DRT results if indicated   |\n|                                  | ABC + 3TC + EFV                                                                                     | AZT + 3TC + DTG                                                                                                          |\n|                                  | AZT + 3TC + EFV                                                                                     | ABC + 3TC + DTG                                                                                                          |\n| ≥ 30 kg or ≥ 15 years old        | TDF (or ABC) + 3TC + DTG (or PI/r)                                                                  | DRT-based second-line²                                                                                                   |\n|                                  | TDF (or ABC) + 3TC + EFV                                                                            | TDF + 3TC + DTG                                                                                                          |\n|                                  | AZT + 3TC + EFV                                                                                     | TDF + 3TC + DTG                                                                                                          |\n| Pregnant and Breastfeeding women | TDF (or ABC) + 3TC + DTG                                                                            | Take sample for DRT and change to TDF + 3TC + ATV/r while awaiting DRT results; modify based on DRT results if indicated |\n|                                  | TDF (or ABC) + 3TC + PI/r                                                                           | Take sample for DRT and change to TDF + 3TC + DTG while awaiting DRT results; modify based on DRT results if indicated   |\n|                                  | TDF (or ABC) + 3TC + EFV                                                                            | TDF + 3TC + DTG                                                                                                          |\n|                                  | AZT + 3TC + EFV                                                                                     | TDF + 3TC + DTG                                                                                                          |\n| HIV/HBV Co-infection             | Always maintain TDF in order to treat the HBV as well as HIV                                        |                                                                                                                          |\n| TB/HIV Co-infection              | Refer to Table 8.8: Recommended ART Regimens for Patients who Develop TB while Failing 1ˢᵗ Line ART |                                                                                                                          |', '# Antiretroviral Therapy in Infants, Children, Adolescents, and Adults\n\n```mermaid\ngraph TD\n    A[Children and adolescents weighing ≥ 30 kg or ≥ 15 years old on a first line ART regimen OTHER than TDF/3TC/DTG]\n    B[On ART for < 3 months]\n    C[On ART for ≥ 3 months]\n    D[VL within last 6 months < 200 copies/ml LDL]\n    E[No VL result within last 6 months]\n    F[VL within last 6 months ≥ 200 copies/ml]\n    G[Collect sample for VL]\n    H[VL < 200 copies/ml LDL]\n    I[VL ≥ 200 copies/ml]\n    J[Switch to TDF/3TC/DTG 300/300/50mg 1 tab once daily<br>Schedule clinical appointment at 2 weeks<br>after regimen change to review<br>adherence, side effects and any other<br>concerns<br>Repeat VL 3 months after regimen<br>modification followed by routine viral<br>load monitoring]\n    K[Switch regimen while assessing for reasons for viremia<br>and providing enhanced adherence counselling<br>Switch to TDF/3TC/DTG 300/300/50mg 1 tab once<br>daily<br>For all patients on PI/r or DTG containing regimens:<br>summarize case for TWG and take sample for DRT – do<br>not wait for DRT results for making the regimen<br>modification<br>Schedule clinical appointment at 2 weeks after regimen<br>change to review adherence, side effects and any other<br>concerns<br>Repeat VL 3 months after regimen modification<br>• If VL still ≥ 200 copies/ml then consult the<br>regional or national TWG<br>• If VL now < 200 copies/ml then continue routine<br>viral load monitoring]\n    A --> B\n    A --> C\n    C --> D\n    C --> E\n    C --> F\n    E --> G\n    G --> H\n    G --> I\n    B --> J\n    D --> J\n    H --> J\n    F --> K\n    I --> K\n```\n\nFigure 6.2: Optimizing ART Regimens for Children and Adolescents Weighing ≥ 30 kg or ≥ 15 years old on First Line ART\n\n## 6.5.2 Changing ARVs Due to Adverse Drug Reactions\n\nPatients starting ART should be educated on the potential side effects of ART and all other prescribed medication. ADRs can have a significant impact on patient adherence and must be identified early and managed aggressively. All ADRs should be reported to the Pharmacy and Poisons Board using existing pharmacovigilance tools (http://www.pv.pharmacyboardkenya.org/). Pharmacovigilance is particularly important for monitoring ADRs associated with any new ARVs that enter the national supply chain, as rare ADRs may appear in routine care, which were not observed in the highly selected patients participating in clinical trials.\n\nThe most common significant ADRs associated with ARVs that may require a drug substitution']","Regimen switching is appropriate in the following situations:

1. **Adherence Issues**: If non-adherence is identified as a cause of treatment failure, adherence issues must be addressed before switching regimens to prevent failure of the new regimen.

2. **Adverse Drug Reactions (ADRs)**: If significant side effects from the current regimen impact adherence, a switch may be necessary.

3. **Viral Load Monitoring**: If the viral load remains high (≥ 200 copies/ml) 3 months after a regimen change, further consultation is advised.

4. **Children and Adolescents**: For those weighing ≥ 30 kg or ≥ 15 years old, consider regimen changes if the viral load is ≥ 200 copies/ml after 3 months on ART.

5. **Consultation and Coordination**: Any regimen change should be done in consultation with the Regional or National HIV Clinical TWG.",1.0,0.9792266501395646,20.56,llm,gpt-4o
What is the role of resistance testing?,"['# Table 8.8 Cont.\n\n1. For patients on 2n line ART, subsequent regimens, drug intolerance, or nonstandard drugs who require regimen change because of TB treatment, consult the Regional or National HIV Clinical TWG (Uliza Hotline 0726 460 000; https://nhcsc.nascop.org/clinicalform)\n2. Contact the Regional or National HIV Clinical TWG (Uliza Hotline 0726 460 000; https://nhcsc.nascop.org/clinicalform) for guidance on urgent collection of DRT samples\n3. Use “super-boosted” LPV/r by adding additional ritonavir to manage the drug interaction between LPV/r and rifampicin (see Annex 10 for dosing recommendations). Two weeks after TB treatment is completed the child should go back to standard LPV/r dosing.', '# Kenya HIV Prevention and Treatment Guidelines, 2022\n\n```mermaid\ngraph TD\n    A[Gene Xpert Results] --> B[MTB Detected Rifampicin Resistance Detected RR]\n    A --> C[MTB Detected Rifampicin Resistance not Detected TR]\n    A --> D[MTB not Detected N]\n    A --> E[MTB Detected₁ Rifampicin Resistance inditerminate TI]\n    A --> F[MTB Detected Trace⁴]\n    A --> G[Invalid/ Error]\n\n    B --> B1[1. Collect a sample for FL & SL LPA, culture and 1st and 2nd line DST<br>2. Conduct baseline work up on DR TB treatment<br>3. Comprehensive review by a DR TB clinical review team.<br>4. Start DR TB treatment as per the guidelines.]\n    B1 --> B2[Based on DST results, DR TB clinical team to adjust regimen as necessary.]\n    B2 --> B3[• Follow up as per DR TB treatment guidelines<br>• Mandatory clinical review meetings for Patients<br>• Monthly smears and cultures are mandatory during the treatment duration.]\n\n    C --> C1[Patients at high risk of DR TB groups<br>1. Collect a sample of FL & SL LPA, culture and 1st and 2nd Line DST<br>2. Start DS TB treatment while awaiting DST results.]\n    C --> C2[Patients at low risk of DR TB groups<br>1. Start DS TB treatments]\n    C1 --> C3[Revised treatment based on DST results Follow up as per guidelines]\n    C3 --> C4[DR TB]\n    C3 --> C5[DS TB]\n    C4 --> C6[Follow up:<br>1. Clinical improvement assessment<br>2. Smear microscopy at months 2/3,5,6<br>3. If drug resistance is detected, treat for DR TB as per guidelines.]\n    C5 --> C6\n\n    D --> D1[• If already on TB treatment smear positive, TB LAM positive, continue until other diagnostic test results received and reviewed even if MTB Not Detected<br>• NTM is likely if smear microscopy was positive, and MTB not detected on GeneXpert<br>- Send a sample for culture for definitive diagnosis of NTM<br>- Continue with TB treatment until culture results received and reviewed<br>• Evaluate for other respiratory illnesses e.g. asthma, pneumonias, COPD, bronchiectasis and cancer as other possible conditions<br>• Obtain a CXR and review with CXR³ report and treat for TB as applicable<br>• Consider EPTB<br>• Refer for further evaluation when a definitive diagnosis is yet to be found<br>• Consider repeat GeneXpert]\n\n    E --> E1[1. Treat as DS TB<br>2. Immediately collect another sample and repeat GeneXpert Ultra test<br>3. Collect a sample for FL & SL LPA, culture and 1st and 2nd line DST<br>4. Revise regimen based on DST results]\n\n    F --> F1[1. Collect another sample and repeat GeneXpert test.<br>2. Treat as per the repeat results]\n```\n\n\n\n# TB/HIV Co-infection, Prevention and Management\n\n| ### Footnotes ¹ Samples for GeneXpert: sputum, CSF, Pleural aspirate, Peritoneal fluid, synovial fluid, Gastric Aspirate, Nasopharyngeal aspirate, FNA, Lymph node biopsy, Pus, stool ² Indications for use of TB-LAM, as an adjunct test to GeneXpert: - PLHIV with advanced disease (WHO stage 3 or 4 or CD4 count ≤200 cells/mm³ (or ≤25% for children <5years old) with presumed TB - PLHIV that have any danger signs of severe illness: respiratory rate >30breaths per minute, temperature >39°C, heart rate>120beats per minute, unable to walk unaided - Currently admitted to hospital ³ All CHEST X-rays should be reported and the reports reviewed by the clinician for definitive management. Refer to the CXR algorithm for TB diagnosis ⁴ MTB detected Trace – Results from sample with few bacilli (paucibacillary TB). Rifampicin resistance status. HIV Testing, using the HTS algorithm 1, is recommended during TB screening and diagnosis. Screening for diabetes is recommended among all adult patients with TB disease | ### DR TB risk classification among patients \\*\\*High risk for DR TB\\*\\*\\* 1. All previously treated TB patients: treatment failures, relapses, treatment after loss to follow up 2. Contacts of Drug Resistant TB patients 3.', 'Refer to the CXR algorithm for TB diagnosis ⁴ MTB detected Trace – Results from sample with few bacilli (paucibacillary TB). Rifampicin resistance status. HIV Testing, using the HTS algorithm 1, is recommended during TB screening and diagnosis. Screening for diabetes is recommended among all adult patients with TB disease | ### DR TB risk classification among patients \\*\\*High risk for DR TB\\*\\*\\* 1. All previously treated TB patients: treatment failures, relapses, treatment after loss to follow up 2. Contacts of Drug Resistant TB patients 3. TB patients with a positive smear result at month 2 or month 5 of TB treatment 4. Patient who develops TB symptoms while on IPT or has had previous IPT exposure 5. Healthcare workers with TB symptoms 6. Prisoners with TB symptoms 7. Refugees with TB symptoms \\*\\*Low risk for DR TB\\*\\* All presumptive TB cases who are NOT in the high risk group \\*ALL the high risk patients MUST be prioritized to receive DST, GeneXpert, FL and SL LPA, culture and FL and SL DST. | ### DS TB follow up and DR TB surveillancePOSITIVE SMEAR RESULT AT\tAction&#xA;Month 2/3\t• Evaluate for adherence, and other causes of delayed conversion&#xA;• Request for all the following drug susceptibility tests (DST): GeneXpert, FL, LPA and SL, LPA, Culture and FL and SL DST&#xA;• Continue with RHZE for one more month, or longer if DST results not received by then&#xA;• Adjust treatment regimen based on DST results&#xA;• Repeat smear microscopy at end of month 3. If smear positive continue with RHZE and review DST results and inform the SCTLC immediately&#xA;• Do not proceed to the continuation phase (RH) without a DST result confirming susceptibility to RH (rifampicin and isoniazid)&#xA;Month 5 or Month 6\t• Declare treatment failure and stop anti-TB treatment&#xA;• Review by the sub county and county TB clinical review teams&#xA;• Evaluate for adherence, other causes of delayed conversion and treatment failure&#xA;• Request for GeneXpert, FL LPA and SL LPA, culture and FL and SL DST&#xA;• Review DST results and re-initiate treatment based on DST results and other clinical findings&#xA;DS TB follow up and DR TB surveillance&#xA;Smear Positive or culture positive at months 3 or later\t• Evaluate for adherence, and other causes of delay conversion&#xA;• Request for the following drug susceptibility tests (DSTI) (GeneXpert, Culture and First Line (FL) and SL DST, FL LPA and SL LPA) depending on the initial resistance pattern&#xA;o Review by the sub county and county clinical review teams&#xA;▪ Evaluate for adherence, other causes of reversion and treatment failure&#xA;▪ Review the DST results&#xA;o Declare failure if at the end of the extended intensive phase (refer to DR TB guidelines)&#xA;o Send a case summary to the national clinical team after review by the county clinical team&#xA;• Do not proceed to the continuation phase (depending on treatment regimen) without a DST result&#xA;Smear Positive smears and/or cultures during continuation phase\t• Declare treatment failure&#xA;o Review by the sub county and county clinical review teams&#xA;▪ Evaluate for adherence, other causes of reversion and treatment failure&#xA;▪ Review the DST results&#xA;• Send a case summary to the national clinical team after review by the county clinical team |   |\n| ----------------------------------------------------------------------------------------------------------------------------------------------------------------------------------------------------------------------------------------------------------------------------------------------------------------------------------------------------------------------------------------------------------------------------------------------------------------------------------------------------------------------------------------------------------------------------------------------------------------------------------------------------------------------------------------------------------------------------------------------------------------------------------------------------------------------------------------------------------------------------------------------------------------------------------------------------------------------------------------------------------------------------------------------- | -------------------------------------------------------------------------------------------------------------------------------------------------------------------------------------------------------------------------------------------------------------------------------------------------------------------------------------------------------------------------------------------------------------------------------------------------------------------------------------------------------------------------------------------------------------------------------------------------------------------------------------------------------------------------------------------------------------- | --------------------------------------------------------------------------------------------------------------------------------------------------------------------------------------------------------------------------------------------------------------------------------------------------------------------------------------------------------------------------------------------------------------------------------------------------------------------------------------------------------------------------------------------------------------------------------------------------------------------------------------------------------------------------------------------------------------------------------------------------------------------------------------------------------------------------------------------------------------------------------------------------------------------------------------------------------------------------------------------------------------------------------------------------------------------------------------------------------------------------------------------------------------------------------------------------------------------------------------------------------------------------------------------------------------------------------------------------------------------------------------------------------------------------------------------------------------------------------------------------------------------------------------------------------------------------------------------------------------------------------------------------------------------------------------------------------------------------------------------------------------------------------------------------------------------------------------------------------------------------------------------------------------------------------------------------------------------------------------------------------------------------------------------------------------------------------------------------------------------------------------------------------------------------------------------------------------------------------------------------------------------------------------------------------------------------------------------------------------------- | - |\n\n\n</td>\n</tr>\n</table>\n\n### Key\n\n| CBR - Chest X-ray                 | LPA - Line Probe Assay             |\n| --------------------------------- | ---------------------------------- |\n| DR TB - Drug Resistant TB         | MTB - Mycobacteria Tuberculosis    |\n| DS TB- Drug Susceptible TB        |                                    |\n| DST - Drug Susceptibility Testing | NTM - Non-Tuberculous Mycobacteria |\n| EPTB - Extra Pulmonary TB         | TST - Tuberculin Skin test         |\n| FL - First Line                   | SL - Second line                   |\n\n\nMOH/DNTLDP/TBSDXALG/01\nSeptember 2020\n\nFigure 8.1: TB diagnosis- GeneXpert Ultra algorithm']","The role of resistance testing in the context of HIV/AIDS and TB co-infection includes:

1. **Guiding Treatment Adjustments**: Resistance testing, such as Drug Resistance Testing (DRT) and Drug Susceptibility Testing (DST), is crucial for adjusting treatment regimens, particularly in cases of treatment failure or delayed conversion. It ensures that treatment does not proceed to the continuation phase without confirming susceptibility to key drugs like rifampicin and isoniazid.

2. **Initiating Drug-Resistant TB Treatment**: For patients with detected rifampicin resistance, resistance testing results guide the initiation of drug-resistant TB (DR TB) treatment and necessary regimen adjustments.

3. **Prioritizing High-Risk Groups**: High-risk groups for DR TB, such as previously treated TB patients and contacts of DR TB patients, should be prioritized for DST and other diagnostic tests to ensure timely and appropriate treatment.

4. **Ensuring Timely Collection of Samples**: Urgent collection of DRT samples is advised to facilitate timely treatment adjustments, with guidance from the Regional or National HIV Clinical TWG.

5. **Supporting Comprehensive Review and Evaluation**: Resistance testing supports comprehensive reviews by clinical teams to ensure adherence and address any causes of treatment failure or delayed conversion in patients with DR TB.",1.0,0.9116132917412539,26.04,llm,gpt-4o
What are important drug interactions with dolutegravir?,"['# Kenya HIV Prevention and Treatment Guidelines, 2022\n\n## Annex 13 C: Drug-Drug Interactions – INSTIs\n\n| Drugs Affected    | Dolutegravir (DTG)                                                                                                                                                                                                                                                                                                                                    | Raltegravir (RAL)                                                                                                                                                                                                           |\n| ----------------- | ----------------------------------------------------------------------------------------------------------------------------------------------------------------------------------------------------------------------------------------------------------------------------------------------------------------------------------------------------- | --------------------------------------------------------------------------------------------------------------------------------------------------------------------------------------------------------------------------- |\n| Efavirenz         | Co-administration not recommended because EFV decreases levels of DTG. If must be used together then increase DTG to 50 mg BD when co-administered with EFV.                                                                                                                                                                                          | Efavirenz decreases RAL plasma levels but it is unlikely to be clinically significant                                                                                                                                       |\n| Etravirine        | Co-administration not recommended because ETR decreases levels of DTG, unless used in combination with a PI/r (which counteracts the interaction between DTG and ETR)<br/><br/>If must be used together without a PI/r then increase DTG to 50 mg BD when co-administered with ETR. If used together with a PI/r then standard dose DTG is sufficient | Etravirine decreases RAL plasma levels so co-administration when using once-daily RAL is not recommended. Co-administration when using standard BD RAL dosing is acceptable                                                 |\n| Rifampicin        | Increase DTG to 50 mg BD when co-administered with rifampicin (for children, use double the standard weight-based DTG dose by administering twice daily).<br/><br/>There is no known drug interaction between DTG and rifabutin.                                                                                                                      | Increase RAL to 800 mg BD when co-administered with rifampicin (for children, use double the standard weight-based RAL dose).<br/><br/>Rifabutin may alter RAL plasma levels but it is unlikely to be clinical significant. |\n| Rifapentine       | Potential decreased DTG levels when co-administered with once-weekly rifapentine – no dose adjustment required unless viral load becomes detectable, in which case increase DTG to twice daily until two weeks after completion of rifapentine-based TPT                                                                                              | Potential increased RAL levels when co-administered with once-weekly rifapentine – no dose adjustment required but monitor for RAL toxicity                                                                                 |\n| Bedaquiline (BDQ) | No interactions expected                                                                                                                                                                                                                                                                                                                              | No interactions expected                                                                                                                                                                                                    |\n| Delamanid (DLM)   | No interactions expected                                                                                                                                                                                                                                                                                                                              | No interactions expected                                                                                                                                                                                                    |\n| Metformin         | DTG may increase metformin plasma levels so metformin dose may need to be decreased. Limit daily metformin dose to 1,000mg.<br/><br/>DTG does NOT require a dose adjustment is when used with metformin.                                                                                                                                              | No interaction                                                                                                                                                                                                              |\n\n\n\n\n\n\n# Annexes\n\n## Annex 13 C: Cont.\n\n| Drugs Affected                                                                                                                    | Dolutegravir (DTG)                                                                                                                                                                                                                                                                                                               | Raltegravir (RAL)                                                        |\n| --------------------------------------------------------------------------------------------------------------------------------- | -------------------------------------------------------------------------------------------------------------------------------------------------------------------------------------------------------------------------------------------------------------------------------------------------------------------------------- | ------------------------------------------------------------------------ |\n| Anticonvulsants<br/>-Carbamazepine<br/>-Phenobarbital<br/>-Phenytoin                                                              | Avoid use of DTG with carbamazepine, phenobarbital, or phenytoin because they decrease DTG plasma levels.<br/><br/>If the DTG must be used in combination with any of these anticonvulsants than increase DTG dose to 50mg BD and monitor viral load.                                                                            | No interaction                                                           |\n| Mineral supplements and antacids containing cations (e.g., calcium, iron, zinc, magnesium, aluminum), including prenatal vitamins | Administer DTG at least 2 hours before or 6 hours after taking any of these supplements (note: if taking DTG with a meal then it is safe to take at the same time as prenatal vitamins, calcium, or iron)<br/><br/>There are no drug-drug interactions between DTG and proton pump inhibitors or H2 blockers used for gastritis. | Do not use calcium, magnesium and aluminum containing antacids with RAL. |\n| Methadone                                                                                                                         | No interaction                                                                                                                                                                                                                                                                                                                   | No interaction                                                           |', '# Table 6.4 Cont.\n\n# Pregnancy Safety of DTG\n\n- DTG is safe during pregnancy and breastfeeding. Pregnancy intention should be discussed with all women initiating ART regardless of regimen. Women who do not wish to become pregnant should be offered appropriate family planning counseling and methods.\n\n# Important Drug Interactions with DTG\n\n- Rifampicin\n- Rifampicin lowers DTG levels: increase DTG to 50 mg twice daily for patients on rifampicin who are > 20 kg in body weight. Children &#x3C;20 kg taking DTG who require rifampicin should increase their weight-appropriate DTG dose to twice daily.\n- There are no significant drug interactions between DTG and other currently used anti-TB medications (including for MDR-TB).\n- Mineral supplements, including: antacids containing calcium, zinc, magnesium or aluminum; iron supplements; prenatal vitamins (which contain iron and calcium)\n- These supplements decrease the absorption of DTG: administer DTG at least 2 hours before or 6 hours after taking any of these supplements.\n- Dose separation is not required for calcium and iron supplements (including prenatal vitamins) if DTG is taken with a meal.\n- It is critical to educate patients about this important drug interaction because many patients get these supplements and antacids over-the-counter without informing their healthcare provider.\n- Carbamazepine, phenobarbital, phenytoin\n- These anticonvulsants decrease DTG levels: use a different anticonvulsant if available.\n- If DTG must be co-administered with these drugs then increase to DTG to twice daily, although there is little data to guide this.\n- If valproic acid is available this can be used with DTG without dose adjustment.\n- Metformin\n- DTG increases levels of metformin; the levels of DTG are not affected: use a lower dose of metformin (often 50% of usual dose) and monitor glycemic control. Use a maximum daily dose of metformin 1 g.\n- Other drug-drug interactions with DTG\n- See Annex 13C.\n\n\n\n# 6.5 Monitoring and Changing ART\n\nThe objectives of clinical and laboratory monitoring during ART are to identify and treat inter-current illnesses, assess for and manage adverse drug reactions, and evaluate response to treatment. Routine laboratory monitoring recommendations are described in Table 3.5; however, additional investigations should be ordered whenever there is clinical suspicion for which a laboratory test result may alter patient management.\n\nIndications for changing ART include optimizing therapy for patients who have undetectable viral load, managing adverse drug reactions or toxicity, drug-drug interactions, co-morbidities and treatment failure.\n\n# 6.5.1 Optimizing Therapy for Patients who have suppressed viral load on First Line ART\n\nPatients who are virally suppressed on first line ART may benefit from regimen optimization even if they are currently tolerating their regimen well and have no drug-drug interactions requiring a change. Regimen modifications may be done for age/weight transitions among children and adolescents &#x3C;15 years and to simplify a regimen, prevent long-term toxicity and improve cost-effectiveness. Dolutegravir has been shown to have superior tolerability and efficacy compared to efavirenz and lopinavir and is now preferred as part of first line ART for children, adolescents and adults. While most adults in Kenya have switched over to a DTG-containing regimen, proactive switching of children is now also recommended with the availability of a pediatric dispersible dolutegravir tablet.\n\nChildren and adolescents with suppressed viral load on first line ART and not on the recommended first line regimen as per Table 6.2 should be considered for optimization as per Figures 6.1 and 6.2, such as when children grow and enter a new weight band. This also includes PLHIV who recently initiated non-standard therapy (less than 3 months ago, before the first VL is due). Decisions on regimen modification should be made following discussion with the patient/caregiver.\n\nAlways discuss the possibility of new side effects when changing to a new ARV, particularly side effects common to all ARVs (headache, nausea, diarrhea) and any side effects specific to the new ARV. Reassure patients that most side effects resolve with continued use after 1-2 weeks.', '# 6.4 Dosing and Administration of Dolutegravir (DTG)\n\nDTG is preferred in first line ART (in combination with other ARVs) for children, adolescents and adults. DTG is well tolerated, highly efficacious, has a high genetic barrier to resistance and fewer drug-drug interactions.\n\nRecommended Dosing of DTG\n● &#x3C; 20 kg body weight: Use weight-based dosing with dispersible 10mg DTG tablets as per Annex 10\n● ≥ 20 kg body weight: DTG 50 mg film-coated tablet once daily, preferably as a morning dose. It is also available as part of FDC. Those unable to swallow the film coated tablets whole refer to Annex 10\n● For patients taking rifampicin: Increase DTG dosing frequency to twice daily for duration of rifampicin-containing TB treatment and for an additional 2 weeks after TB treatment is completed, then revert to once daily. (The additional 2 weeks of higher-dose DTG is to counter the ongoing liver enzyme induction effect of rifampicin, which continues for a short period after TB treatment is completed)\n● For patients with suspected or confirmed INSTI resistance (e.g., patients with prior history of failing a RAL-based regimen): use DTG twice daily\n● DTG can be taken with or without food\n\n# Common Side Effects of DTG\n\n- The most common side effects of DTG are headache, nausea and diarrhea. These side effects usually resolve after continued use for 1-2 weeks. It is critical to inform patients / caregivers about these potential side effects and their temporary nature, and encourage them to continue their ART and consult a HCW if concerned.\n- Some patients on DTG are more likely to develop insomnia. This may be reduced by taking DTG as a morning dose, or by taking DTG with a low-fat meal or on an empty stomach.\n- DTG may cause a small rise in serum creatinine levels but this does NOT represent a true decline in renal function.\n- Integrase inhibitors, including DTG, are associated with increased weight gain. Counsel patients about healthy eating and physical activity and the benefits of maintaining a healthy weight.\n\n1 For other scenarios that are not covered in this table, discuss as an MDT and consult the Regional or National HIV Clinical TWG (Uliza Hotline 0726 460 000; https://nhcsc.nascop.org/clinicalform)\n\n2 ABC hypersensitivity reaction (AHR) is rare in the Kenyan population. Table 6.9 provides the definition and management of AHR\n\n3 The additional 2 weeks of higher-dose DTG is to counter the ongoing liver enzyme induction effect of rifampicin, which continues for a short period after TB treatment is completed\n\n4 TAF may become the preferred NRTI once fixed-dose combinations are available\n\n5 DTG/3TC dual therapy may be considered for HBV-negative patients once fixed-dose combinations are available']","Important drug interactions with dolutegravir (DTG) include:

- **Efavirenz**: Co-administration not recommended as it decreases DTG levels. If used together, increase DTG to 50 mg twice daily.
- **Etravirine**: Co-administration not recommended unless used with a PI/r. Without a PI/r, increase DTG to 50 mg twice daily. With a PI/r, standard DTG dose is sufficient.
- **Rifampicin**: Increase DTG to 50 mg twice daily when co-administered.
- **Rifapentine**: Potential decreased DTG levels; no dose adjustment required unless viral load becomes detectable.
- **Metformin**: DTG may increase metformin levels; limit daily metformin dose to 1,000 mg.
- **Anticonvulsants (Carbamazepine, Phenobarbital, Phenytoin)**: Avoid co-administration as they decrease DTG levels. If necessary, increase DTG to 50 mg twice daily.
- **Mineral supplements and antacids**: Administer DTG at least 2 hours before or 6 hours after these to avoid decreased absorption.",1.0,0.9645169828191099,9.74,llm,gpt-3.5-turbo-0125
How should PrEP be provided to adolescent girls?,"['# 11. Pre-Exposure Prophylaxis (PrEP)\n\nPre-exposure prophylaxis (PrEP) is the use of antiretroviral medication to prevent the acquisition of HIV infection by an uninfected person at ongoing risk of acquiring HIV infection.\n\nPrEP is recommended for use as follows:\n\n- Daily Oral PrEP for all individuals, irrespective of gender or sexual orientation who are at risk of HIV infection.\n- Event-Driven (ED) PrEP is currently recommended for all people born male who are not taking exogenous estradiol-based gender affirming hormones\n\n## 11.1 Indications for PrEP and Criteria for Eligibility\n\n### 11.1.1 Indications for PrEP\n\nPrEP is indicated for;\n\n- HIV uninfected persons at ongoing risk of HIV acquisition\n- Some risk situations that place one at ongoing risk include individuals or sexual partner/s who is/are:\n  - HIV positive and: not on ART, or on ART < 6 months, on ART with viral non-suppression, or on ART with suspected poor adherence\n  - In sero-discordant relationships trying to conceive\n  - Of unknown HIV status and at high-risk of HIV infection\n  - Engaging in transactional sex or sex work\n  - With history of recent or current sexually transmitted infections\n  - With recurrent use of Post-Exposure Prophylaxis\n  - With a history of sex whilst under the influence of alcohol or recreational drugs\n  - Inconsistent or no condom use or unable to negotiate condom use during intercourse with persons of unknown HIV status\n  - Using injection drugs where needles and/or syringes are shared\n\n### 11.1.2 HIV Risk Assessment\n\nClients accessing health services should be screened for HIV risk and additionally provided with information on HIV prevention options available including the availability of PrEP. This is in addition to the use of HIV testing services (HTS), as clients are assessed for HIV risk before testing.\n\nThe risk assessment questions are enquiry of behavioural practices that may expose an individual to HIV (Table 11.2).\n\nA simple Risk Assessment Tool (RAST) is provided to guide the provider in generating a conversation about HIV risk. Screening for HIV risk should be integrated within other service delivery points. HIV negative individuals who answer ""yes"" to any of the screening questions\n\n\n# Table 11:1 HIV Screening questions\n\nScreening question refer to the past 6 months &#x26; include;\n\n- “Have you had sex with more than one person?”\n- “Have you had sex without a condom?”\n- “Have you had sex with anyone whose HIV status you do not know?”\n- “Are any of your partners at risk of HIV?”\n- “Have you had sex with a person who has HIV?”\n- “Have you received a new diagnosis of a sexually transmitted infection?”\n- “Do you desire pregnancy?”\n- “Have you used or wanted to use PEP or PrEP for sexual exposure to HIV?”\n- “Have you injected drugs that were not prescribed by healthcare provider? If yes, did you use syringes, needles or other drug preparation equipment that had already been used by another person?”\n- “Have you received money, housing, food or gifts in exchange for sex?”\n- “Have you been forced to have sex against your will?”\n- “Have you been physically assaulted, including assault by a sexual partner?”\n\n# 11.1.3 Criteria for PrEP Eligibility\n\nTo be eligible for PrEP, individuals identified to be at risk of HIV infection from Risk Assessment must meet ALL the following criteria prior to initiating PrEP.\n\n- Confirmed HIV negative status through rapid antibody testing following the HTS algorithm.\n- Determine if the client is willing to take PrEP as prescribed. (This is done by adherence education and counselling on the PrEP regimen to be given, and assessing the client’s readiness to follow the regimen.)\n- Does not have a current or recent (within the past one month) illness consistent with acute HIV infection (fever, sore throat, muscle or joint pains, swollen glands, diarrhoea or headache) in combination with a preceding high-risk exposure for HIV.\n- No contraindication to use of any of the ARVs recommended for PrEP e.g., TDF +/- FTC (or 3TC) for those who choose oral PrEP.\n- Renal or liver disease\n- Clients with renal and liver disease should receive further clinical and laboratory tests, to determine the renal/liver function and extent of disease.\n\n# Other important factors for screening\n\n1. Gender based violence (GBV) screening: All clients accessing PrEP must be screened for gender-based violence, especially intimate partner violence (IPV), and appropriate intervention offered or client linked to appropriate.\n2. Mental Status Assessment: Psychological issues that may influence adherence should be assessed and addressed. It is important to carry out basic mental health evaluation and offer appropriate referral as necessary.', '# Table 11.7 Cont: Summary of PrEP Initial and Follow-up Assessment\n\nDuring every visit\n\n- Assess adherence\n- Reassess risk of HIV infection and offer risk reduction counselling\n- HIV testing should be repeated at month 1 and thereafter, every 3 months (this applies for both daily and Event driven PrEP)\n- Assess for adverse effects\n\n# 11.5 Contra-indications to Oral PrEP (daily or ED PrEP)\n\n- HIV infection or suspected acute HIV infection (i.e., flu-like symptoms in the last 4 weeks in combination with a preceding high-risk exposure for HIV)\n- Adolescents &#x3C; 35 kg or age &#x3C; 15 years\n- Impaired renal function (estimated creatinine clearance of &#x3C;50 ml/min)\n- Unable or unwilling to adhere to prescribed PrEP or follow-up schedule.\n\n# 11.6 Criteria for Discontinuing Oral PrEP\n\nPrEP should be discontinued if ANY of the following criteria are met.\n\n- Positive HIV test during follow up.\n- Change in risk status (no ongoing risk)\n- Renal dysfunction with creatinine clearance below 50 ml/min\n- Client request to stop.\n- Sustained non-adherence.\n\nDiscontinuing daily oral PrEP: Users discontinuing PrEP due to no ongoing risk or requesting to stop should continue PrEP for at least 7 days after the last potential exposure to HIV. Reasons for discontinuation should be documented in the client’s record.\n\nDiscontinuing event–driven PrEP: Event-driven PrEP can be stopped after two daily doses following the last sexual exposure.\n\n# 11.7 Restarting PrEP\n\nAny client restarting PrEP regardless of the preferred method should be assessed for HIV status and a rapid HIV test conducted:\n\n- Daily Oral PrEP: Clients who stop PrEP for more than 7 days and wishes to restart should be assessed for resumption of PrEP similar to the assessment done for an initial (first) visit. Importantly, conduct a HIV test before re-starting PrEP. If a high-risk exposure occurred in the previous 7 days (i.e., acute HIV infection is suspected), defer PrEP and obtain repeat HIV test after 4 weeks; if negative, PrEP can be prescribed if the other criteria are fulfilled. The use of condoms should be recommended during the waiting period.\n- Event driven Oral PrEP: Clients who have stopped PrEP for more than a week and who are restarting ED-PrEP should commence with a double dose (two pills) of PrEP as new initiators. Risk assessment should be conducted. If a high-risk exposure occurred in the previous 7 days (i.e., acute HIV infection is suspected), defer PrEP and obtain repeat HIV\n\n# 11.8 Improving adherence to PrEP\n\nApproaches to improve adherence include:\n\n- Encourage ring users to keep ring in place continuously through the 28-day period from initial insertion\n- Disclosure of PrEP use to a partner or trusted person\n- Use of reminder devices like a cell phone alarm.\n- SMS reminders where available and feasible\n- Exploring and mitigation of other barriers to adherence\n- Peer support\n\n# 11.9 Monitoring Sero-conversion among PrEP users\n\nPrEP substantially reduce the risk of HIV acquisition. The efficacy of PrEP is correlated with adherence. Sero-conversion during use of PrEP should be monitored critically as it is increasing the risk of developing drug resistance if clients continue the use of PrEP while HIV infected.\n\nFactors that lead to HIV seroconversion among PrEP sero-converters include:\n\n- Inconsistency in use of PrEP (non-adherence).\n- Social-behavioral factors e.g., poverty, HIV stigma and relationship status that may affect the ability to use PrEP as prescribed.\n- Possible infections with drug resistant strains\n\n# What should be done upon identification of a PrEP sero-converter?\n\nHIV testing among PrEP should be conducted consistently as per the algorithm. Identification of new HIV positive diagnosis among PrEP users should be followed with:\n\n- Immediate discontinuation of PrEP\n- Counselling of client on positive results\n- Linkage to care and ART (immediate ART initiation).\n- Assessment of barriers to adherence that may affect use of ART.\n- Document sero-conversion in client file, PrEP registers, and monthly reporting as required.', '# Table 11.7: Summary of PrEP Initial and Follow-up Assessment\n\n| Visit                                                                          | Action                                                                                                                                                                                                                                                                                                                                                                                                                                                                                                                                                                                                                                                                                                                                                                                                                                                                                                                                                                                                                                                                                                          |\n| ------------------------------------------------------------------------------ | --------------------------------------------------------------------------------------------------------------------------------------------------------------------------------------------------------------------------------------------------------------------------------------------------------------------------------------------------------------------------------------------------------------------------------------------------------------------------------------------------------------------------------------------------------------------------------------------------------------------------------------------------------------------------------------------------------------------------------------------------------------------------------------------------------------------------------------------------------------------------------------------------------------------------------------------------------------------------------------------------------------------------------------------------------------------------------------------------------------- |\n| First (Screening Visit) Clinician Visit                                        | * HIV testing and counselling.\n* Evaluate for eligibility, willingness and readiness to take PrEP.\n* Educate about the risks, benefits, and limitations of different PrEP options\n* Educate client about recognizing symptoms of Acute HIV Infection (AHI) and what to do if such symptoms occur (i.e., urgently return for HIV testing)\n* Conduct behavior risk assessment\n* STI screening and treatment\n* Pregnancy, contraceptive use and counselling (for women); if pregnancy suspected, obtain a pregnancy test. However, pregnancy is not a contraindication to PrEP.\n* Adherence counselling\n* Discuss combination prevention.\n* Laboratory test; serum creatinine test and calculate Creatinine Clearance (CrCl), HBsAg, pregnancy test, Hepatitis C (baseline investigations should not delay initiation of PrEP)If no contraindication to TDF and the client is eligible and ready, prescribe TDF/FTC one tablet once daily for 30 days (alternative TDF/3TC one tablet once daily for 30 days, or TDF 300 mg once daily for 30 days); agree on a follow-up date before the prescription is finished |\n| Visit 2 (Month 1) Counsellor/Clinician Visit                                   | - Counsellor/ Clinician visit\n- Assess for side effects and adverse effects\n- Safety monitoring clinical assessment/ Review lab results\n- Conduct a HIV test as per the national algorithm\n- Behavioral risk assessment.\n- Review for PrEP continuation or discontinuation\n- Adherence and risk reduction counselling\n- Give a prescription for PrEP for 2 months.\n- Offer HBV vaccination if available and HBsAg negative (follow HBV vaccination schedule complete series                                                                                                                                                                                                                                                                                                                                                                                                                                                                                                                                                                                                                                     |\n| Follow up visits - Months 3, 6, 9, 12, 15..... Clinician/Counsellor-led visits | * HIV testing and counselling\n* HIV risk assessment\n* Review for PrEP continuation or discontinuation\n* Assess for side effects and adverse effects\n* Safety monitoring clinical assessment/ Review lab results\n* Adherence and risk reduction counselling\n* Give a prescription for PrEP for 3 months\n* Refill PrEP prescription                                                                                                                                                                                                                                                                                                                                                                                                                                                                                                                                                                                                                                                                                                                                                                               |']","PrEP should be provided to adolescent girls who are at risk of HIV infection by ensuring they meet the eligibility criteria, which include being HIV negative, willing to adhere to the regimen, and having no contraindications to ARVs or acute HIV infection. PrEP should be taken daily, and adolescents under 35 kg or under 15 years old should not be provided with oral PrEP. Adherence should be assessed at every visit, with HIV testing repeated every 3 months. Approaches to improve adherence include disclosure to a partner, reminder devices, SMS reminders, peer support, and addressing barriers to adherence. PrEP should be discontinued if there is a positive HIV test, change in risk status, renal dysfunction, sustained non-adherence, or if the client requests to stop. Follow-up visits should include HIV testing, risk assessment, side effect assessment, adherence counselling, and prescription refills.",0.9583333333333334,0.9499535491134852,15.73,llm,gpt-3.5-turbo-0125
When is cotrimoxazole prophylaxis indicated?,"['# 8. TB/HIV Co-infection, Prevention and Management\n\nTB is a leading cause of morbidity and mortality among people living with HIV. Reducing this burden of illness requires identifying TB early, providing pre-emptive and preventive treatment for TB, and providing optimal treatment for both HIV and TB. Timely initiation of ART in combination with TB Preventive Therapy are effective ways to reduce the burden of TB in PLHIV.\n\nAll PLHIV should receive counselling about the risk of acquiring TB, strategies for reducing exposure to TB, recognizing clinical manifestations of TB and seeking care promptly, the risk of transmission of TB to others and TB preventive therapy to prevent TB disease.\n\nHealthcare settings present suitable conditions for transmission of TB, particularly among vulnerable individuals like PLHIV. All healthcare settings should develop and implement TB infection control guidelines to reduce the risk of transmission of TB between patients, visitors and staff.\n\n# 8.1 TB Screening for PLHIV: Intensified Case Finding (ICF)\n\nTB screening and prevention services should be offered at every clinical visit. Symptom-based TB screening using the ICF tool MUST be performed at every clinic visit to rule out active TB; patients who screen positive (presumptive TB cases) must complete definitive diagnostic pathways (Figure 8.1 and Table 8.1) and patients who screen negative should be evaluated for TB preventive therapy (TPT).\n\nActive Case Finding (ACF) differs from ICF. ICF refers to TB screening among PLHIV, whereas Active TB case finding (ACF) refers to special efforts made by the NTP or other partners that go beyond passive TB case finding at health facilities, in which communities or population groups that are underserved or at higher risk of TB are actively reached for providing access to care, including screening and testing.\n\n\n\n\n\n# Intensified Case Finding Screening Questions\n\n<div style=""border: 1px solid green; padding: 10px;"">\n\n- If ""Yes"" to any question, take a detailed history, examine the patient and do sputum examination (sputum smear or GeneXpert)\n\n- If ""No"" to questions 1-5 above, consider TPT eligibility and work up for TB Preventive Therapy and repeat screening on subsequent visits\n\n- Questions 5 and 6 do not apply to adults\n\n</div>\n\nThe following are the intensified case finding screening questions:\n\n- Cough of any duration (Y/N)\n- Fever (Y/N)\n- Noticeable weight loss/ Failure to thrive/ Poor weight gain (Y/N)\n- Night sweats (Y/N)\n- Reduced playfulness/ Lethargy/ Irritability (Y/N)\n- Contact with a TB case (Y/N)', 'For further guidance, refer to the national guidelines on LTBI management.\n\n# 8.2.1. Indications for TPT\n\nTPT should be provided to those patients in whom TB is excluded (using the ICF tool) and meet the eligibility criteria to initiate TPT. The following client categories are eligible for TPT who screen negative for active TB:\n\n- All PLHIV above 12 months of age (children, adolescents and adults including pregnant and breastfeeding women)\n- All household contacts of persons with bacteriologically confirmed pulmonary TB\n- Prisoners and staff working in prison setting\n- Health care workers and other staff in health care setting\n- Other clinical risk groups as defined in LTBI guidelines\n\nNeonates born to mothers with TB, or exposed to close contacts with TB should be given TPT once TB disease has been ruled out. BCG should be given 2 weeks after completion of TPT or anti-TB treatment.\n\n# Summary of recommendations for TPT among the PLHIV\n\n- PLHIV are at a much higher risk of getting TB disease compared to the general population.\n- TB preventive therapy should be given to all PLHIV above 12 months of age who do not have active TB disease. This should be done irrespective of immune status, ART status, previous history of TB and pregnancy status.\n- Children aged &#x3C;12 months living with HIV who are household contacts of a person with bacteriologically confirmed pulmonary TB, and whom active TB has been ruled out should receive TB preventive therapy.\n- TPT may be given immediately following successful completion of TB treatment among the PLHIV.\n- Repeat TPT is not recommended among PLHIV except if a PLHIV becomes a household contact of a person with bacteriologically confirmed pulmonary TB.\n- PLHIV aged 15 years and above should be provided with 3 months of weekly Rifapentine and Isoniazid (3HP), while those less than 15 years are given 6 months of daily INH (6H).\n- In PLHIV on PI/r-based ART, pregnant women and those who do not tolerate 3HP should be given six months of daily INH (6H).\n- For eligible patients previously treated for TB, initiate TPT upon completion of their TB treatment.\n\n\n\n## 8.2.2. Contraindications to TPT\n\nPatients with the following should not receive TPT until the underlying issue(s) are addressed:\n\n- Active tuberculosis disease\n- Active hepatitis (acute or chronic)\n- Chronic alcohol abuse\n- Symptoms of peripheral neuropathy\n\n## 8.2.3. Dose and Duration of TPT\n\n### Table 8.3: Recommended TPT Regimens for PLHIV\n\n| Target populations                                                                                                                                                                                                                                                                                                                                                                      | TPT Regimen                                                                       |\n| --------------------------------------------------------------------------------------------------------------------------------------------------------------------------------------------------------------------------------------------------------------------------------------------------------------------------------------------------------------------------------------- | --------------------------------------------------------------------------------- |\n| * Adult PLHIV excluding patients on PI/r-based ARV regimens                                                                                                                                                                                                                                                                                                                             | Rifapentine and Isoniazid (3HP)<br/>Once weekly for three months<br/>*(12 doses)* |\n| - Adult PLHIV on PI/r-based ARV regimens\n- All CALHIV aged below 15 years\n- Any patient with intolerance or contraindication to 3HP\n- Pregnant women                                                                                                                                                                                                                                    | Isoniazid (6H)<br/>Once daily for 6 months                                        |\n| * The 3RH (rifampicin and isoniazid) regimen is not recommended for PLHIV due to drug- drug interactions\n* All TPT regimens should be given with Vitamin B6 (pyridoxine), if available, to reduce the risk of developing peripheral neuropathy\n* Comprehensive health education and adherence counselling should be conducted prior to initiation of TPT\n* Dosing of TPT is in Annex 10 |                                                                                   |\n\n\n- Children should be weighed at each visit and correct weight-based dosing confirmed.\n- Clients on 3HP should receive weekly dose of pyridoxine, Those on Rifapentine and Isoniazid regimen should be given pyridoxine once a week\n- The 3RH (rifampicin and isoniazid) regimen is not recommended for PLHIV due to drug-drug interactions. 3RH is used in HIV negative populations', 'Note that certain patient groups e.g., recent HIV infections, pregnant adolescent girls and young women, women with previous children with HIV infection, patients with high viral load at time of pregnancy confirmation, patients with poor social support systems, patients with history of default from care and those with active co-morbidities etc. may require additional adherence and psychosocial support\n\n# 7.2. Syphilis elimination for Pregnant and Breastfeeding Women and Infant Treatment\n\nThe country has adopted triple elimination of HIV, Syphilis and Hepatitis B among pregnant and breastfeeding women. It is recommended that all pregnant women attending ANC and not aware of their HIV status require a dual HIV syphilis test during their first trimester and a second HIV Syphilis test in the 3ʳᵈ trimester if the initial test was negative.\n\nAll women who test positive for syphilis at any point during pregnancy and breastfeeding should be treated with the appropriate regimen. (Table 7.3). All babies born of mothers who test positive for syphilis are suspected to be exposed to syphilis and should also be treated with the correct regimen (Table 7.3). Ensure to perform contact tracing for all the sexual contacts and ensure they are treated for syphilis.\n\nSymptoms of congenital syphilis may not become apparent for several weeks or months after birth.\n\n# 7.3. Hepatitis B elimination for Pregnant and Breastfeeding Women and Infant Prophylaxis\n\nRequires routine testing of pregnant women to identify women in need of antiviral treatment for their own health and additional interventions to reduce Mother to Child Transmission of viral hepatitis B.\n\nRegular screening should be done by incorporation of viral hepatitis screening as part of the ANC profile. This is recommended for Hepatitis B &#x26; C which pose a big risk to both the mother and fetus.\n\nFor pregnant and breastfeeding women who are found to be positive for HBsAg, offer appropriate treatment options of ARVs containing TDF/3TC or FTC containing regimens. This treatment also acts as prophylaxis for HBV transmission from mother to child. All pregnant and breastfeeding women without evidence of hepatitis B infection (HBsAg negative) should be vaccinated against hepatitis B. (Chapter 9).\n\nHIV positive infants without evidence of infection should be vaccinated against Hepatitis B. Infants born of mothers who test positive for HBsAG should be treated using Hepatitis B Immunoglobulin (Table 7.3).\n\nRefer to Chapter 9 for management of HIV/HBV coinfection.\n\n\n\n# Table 7.3: ARV Prophylaxis for HIV-Exposed Infants\n\n| Infant Scenario    | Infant Prophylaxis                                                                                                                                                                                                                                                                                                                                                                                                                                                                                                                                                                                                                                                                                                  | Maternal Scenarios                                                                                                                                                                                                                                                            |\n| ------------------ | ------------------------------------------------------------------------------------------------------------------------------------------------------------------------------------------------------------------------------------------------------------------------------------------------------------------------------------------------------------------------------------------------------------------------------------------------------------------------------------------------------------------------------------------------------------------------------------------------------------------------------------------------------------------------------------------------------------------- | ----------------------------------------------------------------------------------------------------------------------------------------------------------------------------------------------------------------------------------------------------------------------------- |\n| HIV Exposed Infant | * Infant prophylaxis\n\n  * AZT+NVP for 6 weeks, NVP + cotrimoxazole should be continued until 6 weeks after complete cessation of breastfeeding\n  * Infant prophylaxis can be discontinued after a minimum of 12 weeks on NVP if the child is not breastfeeding (death of mother or separation with mother)\n  * The infant prophylaxis regimen applies to all infants irrespective of age when identifying HIV exposure (e.g., mother diagnosed HIV-positive in the postpartum period)\n\n* DBS or whole blood for PCR at 6 weeks or first contact, following EID algorithm (Figure 2.1)\n\n* Birth testing (Figure 2.2) may be conducted in sites where point of care has been implemented and when medically indicated | - If mother not on ART, initiate ART as soon as possible (preferably same day)\n- If mother is on ART for ≥ 3 months and the VL is ≥ 50 copies/ml, intensify adherence, repeat the VL\n- If VL <50 copies/ml, continue current regimen\n- Follow Viral load algorithm Figure 6.6 |']",The guideline excerpts provided do not include specific information regarding the indication for cotrimoxazole prophylaxis.,0.0,0.0,10.87,llm,gpt-3.5-turbo-0125
What are the guidelines for ART failure?,"['# Section 6: Treatment failure\n\n- What happens if you stop taking ART:\n- When you stop taking ART the virus begins to increase in your body very quickly\n- The virus goes back to the same high level it was at before you started ART\n- What happens if you do not take ART regularly:\n- The virus begins to increase to high levels again\n- What happens if the viral load increases:\n- When the virus is allowed to increase again, it will also affect your immunity and reduce your CD4 count putting you at risk of opportunistic infections\n- When the virus is allowed to increase again, it can change and get stronger, and becomes resistance to the ART\n- When the virus becomes resistant, the ART does not work against the virus anymore\n- The risk of resistance increases by not taking the ART correctly and by starting and stopping the medications several times\n- When resistance occurs, this is called treatment failure\n- What happens in treatment failure:\n- The ART no longer works because the virus has become resistant to it\n- If treatment fails, it is necessary to use stronger, more expensive ART, but it still may not work as well\n- With the stronger ART you may need to take more pills every day, and you may have more side effects\n- If you become resistant to the new ART as well, then there may not be any drugs that can work for you, and the virus will increase quickly and your CD4 count will go way down\n- It is essential that you take your ART every day as prescribed so that you do not develop treatment failure, and can live a long and healthy life\n\n# Section 7: ART side effects\n\n- What are the side-effects of ART:\n- Sometimes people can get side effects from taking ART\n- Side effects vary from person to person\n- Some people have none while other experience mild effects which are unpleasant but often manageable\n- Most side effects occur within the first few weeks of starting ART and then improve after a few weeks or months\n- Some common side effects include:\n- Headache\n- Loss of appetite\n- Skin rash\n- Fatigue\n- Nausea, vomiting, diarrhoea\n- Muscle pains\n- What do you do if you notice any side effects:\n- If you develop any side effects, you should continue taking your ART as prescribed, without missing any doses, until you discuss with the clinician\n- If the side effects are mild then you can continue taking your ART without missing any doses, and then discuss the side effects with the clinician at your next appointment\n- If the side effects are bothering you too much then return to the clinic immediately, even if you do not have a scheduled appointment, to discuss what to do next; you can also call the clinic if you are not able to make it yourself immediately\n- Severe side effects include rash all over your body, or rash in your mouth or eyes, constant vomiting, inability to eat or retain food, or anything else that makes you think you should stop the ART. If this\n\n# Annex 8: Cont.\n\n# Section 8: Adherence\n\n- What is adherence\n- Following a care plan as agreed with the healthcare team\n- Attending clinic appointments as scheduled\n- Picking up medicines and taking them as prescribed\n- Getting lab tests according to the recommended schedule\n- Following nutritional recommendations\n- How should ART be taken\n- You must take the correct dosage. If you take less than the dose prescribed the treatment will not be effective and will result in resistance and treatment failure. Never share your ART with someone else\n- For children, the dosage keeps changing as they grow and gain weight\n- You must take ART at the correct time of day:\n- If your ART is supposed to be taken once per day, then pick a time when it will usually be convenient for you to remember, e.g., with breakfast every day.\n- If your ART is supposed to be taken twice per day, then you should set a convenient time to take your drugs approximately 12 hours apart (e.g., 8.00 am and 8.00 pm every day). It does not have to be exactly 12 hours apart if your schedule does not allow; the most important thing is to take them twice per day every day (e.g., you can take it at 6.00 am and 8.00 pm every day)\n- If you miss a dose of ART then take your dose as soon as you remember, as long as it is not within a couple of hours of your next dose, and then return to your regular schedule. Do not take a double-dose of ART to make up for a missed dose\n- You must take ART according to dietary restrictions. Some ART should be taken with food, for some it does not matter, and a few require that you have an empty stomach.', '# 1.4 Adherence Preparation, Monitoring and Support\n\n- The adherence preparation, monitoring, and support that a patient requires should be tailored to their level of adherence and the stage of ART initiation and follow-up.\n- All patients with durable viral suppression (2 consecutive viral load results with &#x3C;50 copies) should be offered messaging on Undetectable=Untransmittable (U=U).\n- Whenever possible, follow-up should be provided by the same care provider or team of care providers (e.g., same clinician and counsellor) at every visit. This is particularly important during the first 3 months in care.\n- For all children/adolescents, the level of disclosure should be assessed at the first visit. Ongoing care should include a plan for age-appropriate disclosure.\n- All patients are at risk of new or worsening barriers to adherence, so adherence monitoring, counselling and support should continue despite viral suppression.\n- Every service delivery point that is providing ARVs for patients (whether ART, PEP, or PrEP) must have a functional system for identifying patients who miss appointments and for taking action within 24 hours of a missed appointment.\n- In patients failing ART, do not change regimens until the reason/s for treatment failure have been identified and addressed (which should be done urgently using a case-management approach).\n\n# 1.5 Antiretroviral Therapy for Infants, Children, Adolescents, and Adults\n\n- The goal of ART is to suppress viral replication with the aim of reducing the patient’s VL to undetectable levels (Viral Load &#x3C;50 copies/LDL).\n- All individuals with confirmed HIV infection are eligible for ART, irrespective of CD4 count/%, WHO clinical stage, age, pregnancy or breastfeeding status, co-infection status, risk group, or any other criteria, provided that the individual is willing and ready to start ART.\n- ART should be started in all patients as soon as possible, even on the same day as confirming their HIV diagnosis (and preferably within 2 weeks).\n- Preferred first-line ART for infants, children, adolescents and adults:\n- Birth to 4 weeks: AZT + 3TC + NVP\n- > 4 weeks to &#x3C; 15 years old:\n- &#x3C; 30 kg: ABC + 3TC + DTG\n- ≥ 30 kg: TDF + 3TC + DTG\n- ≥ 15 years old: TDF + 3TC + DTG\n- Children and adolescents who are virally suppressed but are NOT on the preferred first-line ART regimen should be assessed for transition and transitioned to the preferred regimen.\n- Treatment failure is suspected when a patient has a VL ≥ 1000 copies/ml after at least 3 months of using ART. Treatment failure is only confirmed when VL is ≥ 1,000 copies/ml after assessing for and addressing poor adherence or other reasons for high VL, and then.', '# Annex 9 E: Management Protocol for Patients Switching to 3rd Line ART\n\n# Management Protocol for patients switching to 3ʳᵈ line ART\n\n# Pre – Initiation MDT Meeting\n\n- Confirm what 3ʳᵈ line ARV regimen is prescribed, its availability and the management plan\n- Assign a case manager to patient\n\n# Initiation of 3ʳᵈ Line ART\n\n- Triage\n- Record vital signs and take actions as needed\n- Adherence support\n- Conduct patient education on the new ART regimen: Treatment goals, dosing, drug interactions and potential side effects and adverse events\n- Conduct adherence assessment and counselling\n- Link patient to adherence support systems\n- Clinical assessment\n- Take history and conduct physical examination\n- Complete clinical encounter form and MOH 257 (Green Card)\n- Manage any co-infection and co-morbidities\n- Review for potential drug interactions and contraindications\n- Conduct adherence assessment and review adherence support systems including daily witnessed ingestion plan\n- Reinforce patient education messages on new regimen\n- Currently limited future treatment options\n- Need for perfect adherence (>95%)\n- Dosing schedule and timing\n- Potential side effects and what the patient should do\n- Prescribe new regimen for 2 weeks\n- Confirm dosing as per the weight (for ≤15)\n- Continue other medication e.g., CPT, OI treatment etc.\n- Dispensing\n- Confirm ARV dosing as per the weight (for ≤15)\n- Conduct medication use counselling\n- Dispense 3ʳᵈ Line ARVs for 2 weeks\n- Check for possible drug interaction\n- Community follow up\n- Link all patients to support group, CHV/CHA\n- Plan for home visits as required\n\nAnnex 9 E: cont.\n\n# Patient Follow Up after Treatment Initiation\n\n# Frequency\n\n- First follow-up should be within 2 weeks of initiation of 3rd line ART\n- Subsequent visits should be monthly (or more frequent) until confirmed viral suppression at 6 months\n- Thereafter, follow-up can be 1-3 monthly\n\n# Triage\n\n- Record vital signs and take action as needed\n\n# Adherence Support\n\n- Adherence should be reinforced during every clinic visit, in addition to enhanced adherence counselling sessions\n- Review and address knowledge deficits on new regimen\n- Confirm understanding of adherence, conduct adherence assessment, and reinforce key adherence messages\n- Document reasons for missed doses and manage obstacles to perfect adherence. Review and reinforce adherence support systems\n\n# Clinical Assessment\n\n- Take history and conduct physical examination\n- Complete Clinical Encounter Form and MOH 257 (blue card)\n- Manage any co-infections and co-morbidities\n- Evaluate for potential drug interactions\n- Evaluate for and manage any drug side effects and adverse events\n- Conduct adherence assessment and review adherence support systems\n- Reinforce patient education messages on new regimen\n- - Review and address knowledge gaps on ART regimen\n- Need for perfect adherence (>95%)\n- Dosing schedule and timing\n- Potential side effects and what the patient should do\n\nPrescribe 3rd line ARVs\n\n# Viral Load\n\n- Viral load should be conducted 3 months after change of regimen\n\n# Dispensing\n\n- Confirm ARV dosing as per the weight\n- Conduct medication use counselling\n- Dispense 3rd line ARVs\n\n# Community Follow Up\n\n- Review linkage to community adherence support systems\n- Conduct home visits as required\n- Continue DOTS\n\n# NOTE\n\n- 3ʳᵈ line annual report with viral load, adherence, and outcomes to be sent to NASCOP']","Patients experiencing ART failure should not change regimens until the reasons for failure are identified and addressed. Transitioning to 3rd line ART requires a thorough assessment, education on the new regimen, adherence support, and follow-up monitoring. Follow-up after initiation of 3rd line ART should include regular visits, adherence support, clinical assessment, and viral load monitoring.",1.0,0.9155622469529116,9.16,llm,gpt-3.5-turbo-0125
How do you manage HIV in pregnancy?,"[""## 7.1 Antiretroviral Therapy for HIV-positive Pregnant and Breastfeeding Women and Infant Prophylaxis\n\nThe goal of ART for HIV positive pregnant women is two-fold: to restore and maintain the mother's immune function and therefore general health, and secondly, to prevent transmission of HIV in utero, at labour and delivery and during breastfeeding. To achieve this goal, the mother must take effective antiretroviral therapy to achieve viral suppression. Table 7.2 summarizes recommendations for use of ART for HIV positive pregnant women.\n\n### Table 7.2: Summary of Use of ART for HIV Positive Pregnant and Breastfeeding Women\n\n| Overall recommendations             | Overall recommendations                                                                                                                                                                                                                                                                                                                                                                                                                                                                                                                                                                                                                                                                                                                                                                                                                                                                                                                                                                                                                                                                                                                                                                                                                                                                                                                                                                                                                              |\n| ----------------------------------- | ---------------------------------------------------------------------------------------------------------------------------------------------------------------------------------------------------------------------------------------------------------------------------------------------------------------------------------------------------------------------------------------------------------------------------------------------------------------------------------------------------------------------------------------------------------------------------------------------------------------------------------------------------------------------------------------------------------------------------------------------------------------------------------------------------------------------------------------------------------------------------------------------------------------------------------------------------------------------------------------------------------------------------------------------------------------------------------------------------------------------------------------------------------------------------------------------------------------------------------------------------------------------------------------------------------------------------------------------------------------------------------------------------------------------------------------------------- |\n| When to start                       | ART should be initiated in all pregnant and breastfeeding women living with HIV, regardless of gestation, WHO clinical stage and at any CD4 cell count and continued lifelong. ART should be started, ideally, on same day as HIV diagnosis after readiness assessment with ongoing enhanced adherence support including community-based case management and support.                                                                                                                                                                                                                                                                                                                                                                                                                                                                                                                                                                                                                                                                                                                                                                                                                                                                                                                                                                                                                                                                                |\n| What to start with (first-line ART) | TDF/3TC/DTG                                                                                                                                                                                                                                                                                                                                                                                                                                                                                                                                                                                                                                                                                                                                                                                                                                                                                                                                                                                                                                                                                                                                                                                                                                                                                                                                                                                                                                          |\n| Infant prophylaxis                  | * AZT+NVP for 6 weeks, NVP should be continued until 6 weeks after complete cessation of breastfeedingFor more comprehensive information Refer to Table 7.3                                                                                                                                                                                                                                                                                                                                                                                                                                                                                                                                                                                                                                                                                                                                                                                                                                                                                                                                                                                                                                                                                                                                                                                                                                                                                          |\n| Monitoring                          | **Viral load monitoring during pregnancy and breast-feeding (Figure 6.6)*** Whenever possible, use same-day point-of-care methods for viral load testing of pregnant and breastfeeding women to expedite the return of results and clinical decision-making. If this is not available, viral load specimens and results for pregnant and breastfeeding women should be given priority across the laboratory referral process (including specimen collection, testing and return of results).\n\n* For pregnant and breastfeeding women newly initiated on ART, obtain VL 3 months after initiation, and then every 6 months until complete cessation of breastfeeding\n\n* For HIV positive women already on ART at the time of confirming pregnancy or breastfeeding, obtain a VL irrespective of when prior VL was done, and then every 6 months until complete cessation of breastfeeding\n\n* For pregnant or breastfeeding women with a VL ≥ 50 copies/ml: assess for and address potential reasons for viremia, including intensifying adherence support, repeat the VL after 3 months of excellent adherence, including daily witnessed ingestion, where feasible and appropriate\n\n  * If the repeat VL is 200 - 999 copies/ml consult the Regional or National HIV Clinical TWG\n  * If the repeat VL is ≥ 1,000 copies/ml, change to an effective regimen. Refer to Table 6.10\n  * If the repeat VL is < 200 copies/ml (LDL) then continue routine |"", '# 7. Prevention of Mother to Child Transmission of HIV/Syphilis/Hepatitis B\n\nRoutine antenatal care (ANC) offers an important opportunity to provide high quality combined HIV prevention through targeted health education and counselling; HIV testing for the woman, partners and family members; linkage to HIV prevention and treatment; and to discuss and plan for future conception and contraception needs. Prevention of mother-to-child transmission of HIV (PMTCT)/Syphilis/Hepatitis B should be offered as part of a comprehensive package of fully integrated, routine antenatal care interventions (Table 7.1).\n\n## Table 7.1: Essential Package of Antenatal Care\n\n| Intervention                 | Recommendation/Description                                                                                                                                                                                                                                                                                                                                                                                                                                                                                                                                                                                                                                                                                                                                                                                                                                                                                                                                                                                                                                                                                                                                                                                                                                                                                                                                                                                                                                                                                 |\n| ---------------------------- | ---------------------------------------------------------------------------------------------------------------------------------------------------------------------------------------------------------------------------------------------------------------------------------------------------------------------------------------------------------------------------------------------------------------------------------------------------------------------------------------------------------------------------------------------------------------------------------------------------------------------------------------------------------------------------------------------------------------------------------------------------------------------------------------------------------------------------------------------------------------------------------------------------------------------------------------------------------------------------------------------------------------------------------------------------------------------------------------------------------------------------------------------------------------------------------------------------------------------------------------------------------------------------------------------------------------------------------------------------------------------------------------------------------------------------------------------------------------------------------------------------------- |\n| Group & Individual Education | Include information on importance of at least 8 ANC visits, details of ANC services (including health checks and treatment of any illness, medical tests including HIV, syphilis testing and hepatitis B, monitoring of maternal and fetal wellbeing, etc.), nutrition, personal care, recognizing and responding to danger signs during pregnancy, birth preparedness including skilled birth attendance, post-natal care including immunization, family planning and maternal and infant nutrition, HIV prevention and treatment (HTS, preventing new infections during pregnancy including PrEP where appropriate, ART for those who are HIV positive, monitoring of ART and ARV prophylaxis and follow-up for HEIs) and triple elimination (preventing HIV/ syphilis/hepatitis B transmission from mother to child).                                                                                                                                                                                                                                                                                                                                                                                                                                                                                                                                                                                                                                                                                   |\n| Counselling                  | * Pre-conception – Women in reproductive age who are known to be HIV positive should have pregnancy intention assessment visit at every visit. If they desire to become pregnant, pregnancy should be planned i.e., attain viral load suppression, immune reconstitution and have Iron and Folic Acid Supplementation (IFAS) administered prior to conception.\n* Women who are newly diagnosed with HIV and/or newly initiating ART require more intensive adherence counseling and HIV education, which may include a case manager and/or mentor mother\n* Birth preparedness: support the pregnant woman and her partner to develop an individual birth plan that includes place of delivery with skilled attendants, emergency transport, birth companionship and readiness for infant care\n* Pregnancy danger signs: offer information on returning to ANC as soon as possible in case they develop fever, lower abdominal pain, severe headache, swollen feet, convulsions and per vaginal bleeding.\n* Maternal, infant and young child nutrition (MIYCN): All pregnant women should receive information on proper nutrition during pregnancy and breastfeeding, safe infant feeding and optimal nutrition practices. Promote exclusive breastfeeding for the first 6 months irrespective of HIV status, followed by complementary feeding (Table 7.7). During pregnancy, provide iron, folate and multivitamins; monitor for anemia, advise on adequate caloric intake (HIV positive women require an |', 'Note that certain patient groups e.g., recent HIV infections, pregnant adolescent girls and young women, women with previous children with HIV infection, patients with high viral load at time of pregnancy confirmation, patients with poor social support systems, patients with history of default from care and those with active co-morbidities etc. may require additional adherence and psychosocial support\n\n# 7.2. Syphilis elimination for Pregnant and Breastfeeding Women and Infant Treatment\n\nThe country has adopted triple elimination of HIV, Syphilis and Hepatitis B among pregnant and breastfeeding women. It is recommended that all pregnant women attending ANC and not aware of their HIV status require a dual HIV syphilis test during their first trimester and a second HIV Syphilis test in the 3ʳᵈ trimester if the initial test was negative.\n\nAll women who test positive for syphilis at any point during pregnancy and breastfeeding should be treated with the appropriate regimen. (Table 7.3). All babies born of mothers who test positive for syphilis are suspected to be exposed to syphilis and should also be treated with the correct regimen (Table 7.3). Ensure to perform contact tracing for all the sexual contacts and ensure they are treated for syphilis.\n\nSymptoms of congenital syphilis may not become apparent for several weeks or months after birth.\n\n# 7.3. Hepatitis B elimination for Pregnant and Breastfeeding Women and Infant Prophylaxis\n\nRequires routine testing of pregnant women to identify women in need of antiviral treatment for their own health and additional interventions to reduce Mother to Child Transmission of viral hepatitis B.\n\nRegular screening should be done by incorporation of viral hepatitis screening as part of the ANC profile. This is recommended for Hepatitis B &#x26; C which pose a big risk to both the mother and fetus.\n\nFor pregnant and breastfeeding women who are found to be positive for HBsAg, offer appropriate treatment options of ARVs containing TDF/3TC or FTC containing regimens. This treatment also acts as prophylaxis for HBV transmission from mother to child. All pregnant and breastfeeding women without evidence of hepatitis B infection (HBsAg negative) should be vaccinated against hepatitis B. (Chapter 9).\n\nHIV positive infants without evidence of infection should be vaccinated against Hepatitis B. Infants born of mothers who test positive for HBsAG should be treated using Hepatitis B Immunoglobulin (Table 7.3).\n\nRefer to Chapter 9 for management of HIV/HBV coinfection.\n\n\n\n# Table 7.3: ARV Prophylaxis for HIV-Exposed Infants\n\n| Infant Scenario    | Infant Prophylaxis                                                                                                                                                                                                                                                                                                                                                                                                                                                                                                                                                                                                                                                                                                  | Maternal Scenarios                                                                                                                                                                                                                                                            |\n| ------------------ | ------------------------------------------------------------------------------------------------------------------------------------------------------------------------------------------------------------------------------------------------------------------------------------------------------------------------------------------------------------------------------------------------------------------------------------------------------------------------------------------------------------------------------------------------------------------------------------------------------------------------------------------------------------------------------------------------------------------- | ----------------------------------------------------------------------------------------------------------------------------------------------------------------------------------------------------------------------------------------------------------------------------- |\n| HIV Exposed Infant | * Infant prophylaxis\n\n  * AZT+NVP for 6 weeks, NVP + cotrimoxazole should be continued until 6 weeks after complete cessation of breastfeeding\n  * Infant prophylaxis can be discontinued after a minimum of 12 weeks on NVP if the child is not breastfeeding (death of mother or separation with mother)\n  * The infant prophylaxis regimen applies to all infants irrespective of age when identifying HIV exposure (e.g., mother diagnosed HIV-positive in the postpartum period)\n\n* DBS or whole blood for PCR at 6 weeks or first contact, following EID algorithm (Figure 2.1)\n\n* Birth testing (Figure 2.2) may be conducted in sites where point of care has been implemented and when medically indicated | - If mother not on ART, initiate ART as soon as possible (preferably same day)\n- If mother is on ART for ≥ 3 months and the VL is ≥ 50 copies/ml, intensify adherence, repeat the VL\n- If VL <50 copies/ml, continue current regimen\n- Follow Viral load algorithm Figure 6.6 |']","To manage HIV in pregnancy:

1. Initiate antiretroviral therapy (ART) in all pregnant and breastfeeding women living with HIV, regardless of gestation, WHO clinical stage, and CD4 cell count, and continue it lifelong. The recommended first-line ART regimen is TDF/3TC/DTG.

2. Conduct viral load monitoring during pregnancy and breastfeeding, using same-day point-of-care methods for expedited results.

3. Provide additional adherence and psychosocial support for specific groups, such as pregnant adolescent girls, women with previous children with HIV infection, and those with poor social support systems.

4. For infant prophylaxis, administer AZT+NVP for 6 weeks, with NVP continued until 6 weeks after complete cessation of breastfeeding. Test HIV-exposed infants for HIV at 6 weeks or at first contact.",1.0,0.9467711034185822,9.56,llm,gpt-3.5-turbo-0125
When should infants start ART?,"['- All HIV exposed infants (HEI) should be tested with DNA PCR within 6 weeks of age or first contact thereafter; if negative then another DNA PCR at 6 months, and if negative then repeat DNA PCR at 12 months.\n- All HEI should receive infant ARV prophylaxis consisting of 6 weeks of AZT + NVP and thereafter NVP should be continued until 6 weeks after complete cessation of breastfeeding.\n- All infants irrespective of HIV status should be exclusively breastfed for the first 6 months of life, with timely introduction of appropriate complementary foods after 6 months, and continued breastfeeding up to 24 months or beyond.\n\n# 1.7 TB/HIV Co-infection Prevention and Management\n\n- All healthcare settings should implement TB infection control recommendations to reduce the risk of transmission of TB among patients, visitors and staff.\n- Symptom-based TB screening using the ICF tool MUST be performed for all PLHIV at every clinic visit\n- Patients who screen negative should be assessed for and provided with TB preventive therapy (TPT).\n- Patients who screen positive (presumptive TB) must complete definitive diagnostic pathways.\n- The GeneXpert Ultra MTB/Rif test is the preferred test for diagnosis of TB and rifampicin resistance in all presumptive TB cases.\n- TB-LAM can be used as an adjunct rapid point-of-care diagnostic test for PLHIV: with advanced HIV disease (WHO stage 3 or 4 or CD4 count ≤ 200 cells/mm³ (or CD4% ≤ 25% for children ≤ 5 years)) with presumptive TB, or; any danger signs of severe illness, or; currently admitted to hospital.\n- Patients diagnosed with TB/HIV co-infection should start anti-TB treatment immediately and initiate ART as soon as anti-TB medications are tolerated, preferably within 2 weeks (unless they have TB meningitis, in which case ART should be deferred for 4 to 8 weeks).\n- Patients with TB/HIV co-infection who are already on ART should start anti-TB treatment immediately and continue ART, making any required adjustments to the ART regimen based on known drug-drug interactions and monitoring toxicity.\n- Always assess for ART failure in patients who develop TB after being on ART for ≥ 6 months.', '# 1.4 Adherence Preparation, Monitoring and Support\n\n- The adherence preparation, monitoring, and support that a patient requires should be tailored to their level of adherence and the stage of ART initiation and follow-up.\n- All patients with durable viral suppression (2 consecutive viral load results with &#x3C;50 copies) should be offered messaging on Undetectable=Untransmittable (U=U).\n- Whenever possible, follow-up should be provided by the same care provider or team of care providers (e.g., same clinician and counsellor) at every visit. This is particularly important during the first 3 months in care.\n- For all children/adolescents, the level of disclosure should be assessed at the first visit. Ongoing care should include a plan for age-appropriate disclosure.\n- All patients are at risk of new or worsening barriers to adherence, so adherence monitoring, counselling and support should continue despite viral suppression.\n- Every service delivery point that is providing ARVs for patients (whether ART, PEP, or PrEP) must have a functional system for identifying patients who miss appointments and for taking action within 24 hours of a missed appointment.\n- In patients failing ART, do not change regimens until the reason/s for treatment failure have been identified and addressed (which should be done urgently using a case-management approach).\n\n# 1.5 Antiretroviral Therapy for Infants, Children, Adolescents, and Adults\n\n- The goal of ART is to suppress viral replication with the aim of reducing the patient’s VL to undetectable levels (Viral Load &#x3C;50 copies/LDL).\n- All individuals with confirmed HIV infection are eligible for ART, irrespective of CD4 count/%, WHO clinical stage, age, pregnancy or breastfeeding status, co-infection status, risk group, or any other criteria, provided that the individual is willing and ready to start ART.\n- ART should be started in all patients as soon as possible, even on the same day as confirming their HIV diagnosis (and preferably within 2 weeks).\n- Preferred first-line ART for infants, children, adolescents and adults:\n- Birth to 4 weeks: AZT + 3TC + NVP\n- > 4 weeks to &#x3C; 15 years old:\n- &#x3C; 30 kg: ABC + 3TC + DTG\n- ≥ 30 kg: TDF + 3TC + DTG\n- ≥ 15 years old: TDF + 3TC + DTG\n- Children and adolescents who are virally suppressed but are NOT on the preferred first-line ART regimen should be assessed for transition and transitioned to the preferred regimen.\n- Treatment failure is suspected when a patient has a VL ≥ 1000 copies/ml after at least 3 months of using ART. Treatment failure is only confirmed when VL is ≥ 1,000 copies/ml after assessing for and addressing poor adherence or other reasons for high VL, and then.', '# 1. Summary of Key Recommendations\n\n## 1.1 HIV Testing Services (HTS) and Linkage to Treatment and Prevention\n\n- HIV testing should be voluntary and conducted ethically in an environment where Consent, Confidentiality, Counselling, Correct results, Connection (linkage) and Creating an enabling environment can be assured\n\n- To optimize access to testing services, HIV testing can be conducted in 2 different settings:\n  - Facility-based\n  - Community-based\n\n- Targeted HIV testing is recommended which involves index client listing of contacts, HIV self-testing and use of HTS screening tool to identify people at risk of HIV infection as eligible for testing\n\n- Serial testing, using approved rapid HIV antibody testing kits, is used to diagnose HIV infection in children older than 18 months, adolescents, and adults. An HIV-positive diagnosis will be made using three consecutive reactive assays\n\n## 1.2 Initial Evaluation and Follow-up for PLHIV\n\n- Initial clinical evaluation of PLHIV entails CD4 monitoring, which is recommended for:\n  - Baseline investigation for all PLHIV\n  - Any patient with suspected treatment failure\n  - Any patient returning to care after interrupting treatment for >3 months\n  - Any patient on fluconazole maintenance therapy or on dapsone as prophylaxis, to determine when prophylaxis can be discontinued\n\n- Advanced HIV Disease is defined as:\n  - Adults, adolescents, and children five years and older as having a CD4 cell count of less than 200 cells/mm³ or\n  - WHO clinical stage 3 or 4 disease\n  - All children younger than five years\n\n- All PLHIV presenting with Advanced HIV Disease (AHD) should be offered a package of care that includes timely initiation of ART, screening, diagnosis, prophylaxis, and management of opportunistic infections.\n\n- Frequency of routine VL monitoring:\n  - For PCR positive HEIs: at baseline (at the time of ART initiation)\n  - Age 0-24 years old: 3 months after ART initiation, and then every 6 months\n\n\n▪ Pregnant or breastfeeding: at confirmation of pregnancy (if already on ART) or 3 months after ART initiation (if ART initiated during pregnancy/breastfeeding), and then every 6 months until complete cessation of breastfeeding\n\n▪ Before any drug substitution (if no VL result available from the prior 6 months)\n\n▪ Three months after any regimen modification (including single-drug substitution)\n\n● PLHIV should receive differentiated care based on initial evaluation (advanced vs. well) and follow up (established vs not established on ART)\n\n# 1.3 Standard Package of Care for PLHIV\n\nConsists of 8 components:\n\n1. Antiretroviral Therapy\n- All PLHIV are eligible for ART irrespective of CD4 cell count or percentage, WHO clinical stage, age, pregnancy status, or comorbidities\n- ART should be initiated as soon as the patient is ready to start, preferably within two weeks from time of HIV diagnosis (except for patients with cryptococcal meningitis or TB meningitis)\n2. Positive Health, Dignity, and Prevention, GBV/IPV &#x26; HIV Education and Counselling\n- All patients should be counselled and supported for disclosure of HIV status; partner/ family testing and engagement; condom use; family planning; sexually transmitted infections screening; treatment adherence; and pre-exposure prophylaxis for HIV-negative sexual partners\n- All females aged 15-49 years and emancipated minors accessing HIV care services should be screened for Intimate Partner Violence (IPV) as part of the standard package of care\n- All PLHIV should be provided with HIV education and counselling\n3. Screening for and Prevention of Specific Opportunistic Infections\nCotrimoxazole Preventive Therapy (CPT) is no longer recommended as life-long prophylaxis, and is only recommended in the following sub populations, unless they have an allergy to sulfur drugs or develop toxicity from CPT:\n\n- All HIV Exposed Infants\n- HIV infected children &#x3C; 15 years of age\n- All PLHIV > 15 years of age:\n- Living in malaria-endemic zones (Refer to the National Guidelines for the Diagnosis, Treatment and Prevention of Malaria in Kenya for the current Kenya Malaria endemicity map)\n- Presenting with WHO stage 3 or 4 event, or meeting the AHD criteria\n- Suspected treatment failure\n- All Pregnant and Breast-feeding women']","ART should be started in all patients, including infants, as soon as possible, even on the same day as confirming their HIV diagnosis.",0.75,0.9203096306842391,6.39,llm,gpt-3.5-turbo-0125
What is the recommended PrEP regimen for men who have sex with men?,"['# 11. Pre-Exposure Prophylaxis (PrEP)\n\nPre-exposure prophylaxis (PrEP) is the use of antiretroviral medication to prevent the acquisition of HIV infection by an uninfected person at ongoing risk of acquiring HIV infection.\n\nPrEP is recommended for use as follows:\n\n- Daily Oral PrEP for all individuals, irrespective of gender or sexual orientation who are at risk of HIV infection.\n- Event-Driven (ED) PrEP is currently recommended for all people born male who are not taking exogenous estradiol-based gender affirming hormones\n\n## 11.1 Indications for PrEP and Criteria for Eligibility\n\n### 11.1.1 Indications for PrEP\n\nPrEP is indicated for;\n\n- HIV uninfected persons at ongoing risk of HIV acquisition\n- Some risk situations that place one at ongoing risk include individuals or sexual partner/s who is/are:\n  - HIV positive and: not on ART, or on ART < 6 months, on ART with viral non-suppression, or on ART with suspected poor adherence\n  - In sero-discordant relationships trying to conceive\n  - Of unknown HIV status and at high-risk of HIV infection\n  - Engaging in transactional sex or sex work\n  - With history of recent or current sexually transmitted infections\n  - With recurrent use of Post-Exposure Prophylaxis\n  - With a history of sex whilst under the influence of alcohol or recreational drugs\n  - Inconsistent or no condom use or unable to negotiate condom use during intercourse with persons of unknown HIV status\n  - Using injection drugs where needles and/or syringes are shared\n\n### 11.1.2 HIV Risk Assessment\n\nClients accessing health services should be screened for HIV risk and additionally provided with information on HIV prevention options available including the availability of PrEP. This is in addition to the use of HIV testing services (HTS), as clients are assessed for HIV risk before testing.\n\nThe risk assessment questions are enquiry of behavioural practices that may expose an individual to HIV (Table 11.2).\n\nA simple Risk Assessment Tool (RAST) is provided to guide the provider in generating a conversation about HIV risk. Screening for HIV risk should be integrated within other service delivery points. HIV negative individuals who answer ""yes"" to any of the screening questions\n\n\n# Table 11:1 HIV Screening questions\n\nScreening question refer to the past 6 months &#x26; include;\n\n- “Have you had sex with more than one person?”\n- “Have you had sex without a condom?”\n- “Have you had sex with anyone whose HIV status you do not know?”\n- “Are any of your partners at risk of HIV?”\n- “Have you had sex with a person who has HIV?”\n- “Have you received a new diagnosis of a sexually transmitted infection?”\n- “Do you desire pregnancy?”\n- “Have you used or wanted to use PEP or PrEP for sexual exposure to HIV?”\n- “Have you injected drugs that were not prescribed by healthcare provider? If yes, did you use syringes, needles or other drug preparation equipment that had already been used by another person?”\n- “Have you received money, housing, food or gifts in exchange for sex?”\n- “Have you been forced to have sex against your will?”\n- “Have you been physically assaulted, including assault by a sexual partner?”\n\n# 11.1.3 Criteria for PrEP Eligibility\n\nTo be eligible for PrEP, individuals identified to be at risk of HIV infection from Risk Assessment must meet ALL the following criteria prior to initiating PrEP.\n\n- Confirmed HIV negative status through rapid antibody testing following the HTS algorithm.\n- Determine if the client is willing to take PrEP as prescribed. (This is done by adherence education and counselling on the PrEP regimen to be given, and assessing the client’s readiness to follow the regimen.)\n- Does not have a current or recent (within the past one month) illness consistent with acute HIV infection (fever, sore throat, muscle or joint pains, swollen glands, diarrhoea or headache) in combination with a preceding high-risk exposure for HIV.\n- No contraindication to use of any of the ARVs recommended for PrEP e.g., TDF +/- FTC (or 3TC) for those who choose oral PrEP.\n- Renal or liver disease\n- Clients with renal and liver disease should receive further clinical and laboratory tests, to determine the renal/liver function and extent of disease.\n\n# Other important factors for screening\n\n1. Gender based violence (GBV) screening: All clients accessing PrEP must be screened for gender-based violence, especially intimate partner violence (IPV), and appropriate intervention offered or client linked to appropriate.\n2. Mental Status Assessment: Psychological issues that may influence adherence should be assessed and addressed. It is important to carry out basic mental health evaluation and offer appropriate referral as necessary.', '## 11.2.2 Pre-initiation client education\n\nThe following components should be discussed prior to PrEP initiation:\n\n### Table 11.3: Client Education Checklist\n\n| Topic                                                                                                                                                                                                                                                                                                                                                                                                                                                                                                                                                                                                                 | Check |\n| --------------------------------------------------------------------------------------------------------------------------------------------------------------------------------------------------------------------------------------------------------------------------------------------------------------------------------------------------------------------------------------------------------------------------------------------------------------------------------------------------------------------------------------------------------------------------------------------------------------------- | ----- |\n| ✔ Explain how PrEP works as part of combination HIV prevention                                                                                                                                                                                                                                                                                                                                                                                                                                                                                                                                                        | ✔     |\n| ✔ Explain the need for baseline and follow-up tests including regular HIV testing                                                                                                                                                                                                                                                                                                                                                                                                                                                                                                                                     | ✔     |\n| ✔ Explain PrEP use: include the following: (refer to the different types of PrEP available for details)- The medications used (show the client the pills or other PrEP options\n- How the medications are used (frequency of dosing for the various options)\n- Number of doses required to achieve efficacy (7 doses for daily oral PrEP, loading dose for event driven oral PrEP)\n- What to do when doses are missed (continue for daily doses)\n- Discontinuation of PrEP, how and when it can be discontinued.\n- Side effects and what to do in case these are experienced (including when to consult the clinician) | ✔     |\n| ✔ Discuss what to do in case client experiences symptoms of seroconversion (acute HIV infection)                                                                                                                                                                                                                                                                                                                                                                                                                                                                                                                      |       |\n| ✔ Discuss the Limitations of PrEP- PrEP reduces but does not eliminate the risk of acquiring HIV.\n- PrEP does not prevent pregnancies and STIs.                                                                                                                                                                                                                                                                                                                                                                                                                                                                       | ✔     |\n| ✔ Risk reduction counselling and support education- Managing mental health needs\n- Couple counselling\n- Access to, and consistent use of condoms and lubricants\n- Access to and need for frequent HIV testing.\n- Early access to ART\n- VMMC\n- STI screening and treatment\n- Harm reduction for PWID                                                                                                                                                                                                                                                                                                                   | ✔     |\n\n\n## 11.3 Recommended ARVs for PrEP\n\nThe preferred ARV regimen is Tenofovir 300mg/ Emtricitabine 200mg (TDF/FTC) given as one fixed dose combination (FDC) tablet orally daily.\n\n\n\n# Table 11.4: Antiretrovirals for Use in PrEP\n\n| PrEP Dosing Strategies | Preferred                                                                                                                                                                                                                | Alternative                                                                                                                                                                                                              |\n| ---------------------- | ------------------------------------------------------------------------------------------------------------------------------------------------------------------------------------------------------------------------ | ------------------------------------------------------------------------------------------------------------------------------------------------------------------------------------------------------------------------ |\n| Daily Oral PrEP        | TDF/FTC (300 mg/200 mg) as FDC once daily                                                                                                                                                                                | TDF/3TC (300 mg/300 mg) as FDC once daily                                                                                                                                                                                |\n| Event Driven Oral PrEP | TDF/FTC (300 mg/200 mg) as FDC – two pills taken between 2 and 24 hours in advance of anticipated sex; then, a third pill 24 hours after the first two pills and a fourth pill 48 hours after the first two pills; 2-1-1 | TDF/3TC (300 mg/300 mg) as FDC – two pills taken between 2 and 24 hours in advance of anticipated sex; then, a third pill 24 hours after the first two pills and a fourth pill 48 hours after the first two pills; 2-1-1 |\n\n\n*Recommended Long-acting Products: These products are at different stages of approval and availability in Kenya. The Ministry of Health will issue specific implementation guidelines when they become available.\n\n| \\*Long Acting Cabotegravir Injection | Initiation injections: 600 mg Intramuscular (IM) x 2 doses given 1 month apart (the second initiation injection can be given up to 7 days before or after the date scheduled to receive injection)<br/><br/>THEN<br/><br/>Continuation injections: 600 mg IM every 2months |\n| ------------------------------------ | -------------------------------------------------------------------------------------------------------------------------------------------------------------------------------------------------------------------------------------------------------------------------- |\n| \\*Dapivirine vaginal ring            | Dapivirine vaginal ring, 25mg, inserted vaginally every 28 days.                                                                                                                                                                                                           |', ""# Table 11.6: Managing Clinical and Laboratory Results on Initial and Follow-up Assessment\n\n| Screening                              | Action                                                                                                                                                                                                                                                                                                                                                                                                                                                                                                                                                                                                                                                                                                                                                                                                                                                                                                                                                                                                                           |\n| -------------------------------------- | -------------------------------------------------------------------------------------------------------------------------------------------------------------------------------------------------------------------------------------------------------------------------------------------------------------------------------------------------------------------------------------------------------------------------------------------------------------------------------------------------------------------------------------------------------------------------------------------------------------------------------------------------------------------------------------------------------------------------------------------------------------------------------------------------------------------------------------------------------------------------------------------------------------------------------------------------------------------------------------------------------------------------------- |\n| HIV-positive at initial evaluation     | Do not start PrEP, counsel and link to care and treatment                                                                                                                                                                                                                                                                                                                                                                                                                                                                                                                                                                                                                                                                                                                                                                                                                                                                                                                                                                        |\n| HIV-positive after initiation of PrEP  | Discontinue PrEP, counsel and link to care and treatment. Take DBS or plasma sample for drug resistance testing.                                                                                                                                                                                                                                                                                                                                                                                                                                                                                                                                                                                                                                                                                                                                                                                                                                                                                                                 |\n| Positive STI Screen                    | Thorough genitourinary and anorectal examination, urine dipstick for urethritis, serological testing for syphilis, full STI evaluation if resources available (refer to STI algorithm). Refer to guidelines on syndromic management of STIs.                                                                                                                                                                                                                                                                                                                                                                                                                                                                                                                                                                                                                                                                                                                                                                                     |\n| HBsAg-negative                         | Offer HBV vaccination                                                                                                                                                                                                                                                                                                                                                                                                                                                                                                                                                                                                                                                                                                                                                                                                                                                                                                                                                                                                            |\n| HBsAg-positive                         | This is not a contraindication to oral PrEP. However, will require monitoring of liver function and referral for management of liver disease.<br/><br/>NB: TDF-based daily or event-driven oral PrEP can be safely offered to persons with HBV infection.                                                                                                                                                                                                                                                                                                                                                                                                                                                                                                                                                                                                                                                                                                                                                                        |\n| Hepatitis C - Negative                 | Continue PrEP and follow Hepatitis C testing algorithm.                                                                                                                                                                                                                                                                                                                                                                                                                                                                                                                                                                                                                                                                                                                                                                                                                                                                                                                                                                          |\n| Hepatitis C - Positive                 | Continue PrEP, refer for Hepatitis C confirmatory testing and management with directly acting antivirals (DAAs).                                                                                                                                                                                                                                                                                                                                                                                                                                                                                                                                                                                                                                                                                                                                                                                                                                                                                                                 |\n| Flu-like illness after initiating PrEP | Continue PrEP, test for HIV at first contact and after 28 days, and if negative, continue with usual follow-up                                                                                                                                                                                                                                                                                                                                                                                                                                                                                                                                                                                                                                                                                                                                                                                                                                                                                                                   |\n| Side effects of PrEP                   | GIT - nausea, vomiting, weight loss: these are often mild, self-limiting and occur during the first 1-2 months. Provide supportive counselling, offer symptomatic treatment e.g., anti-emetics like metoclopramide 10 mg 8 hourly for 3 to 5 days.<br/><br/>Renal – individuals may experience transient increase in creatinine, and rarely proteinuria and Fanconi's syndrome (presenting as polyuria, bone pain and weakness). Measure creatinine (and calculate estimated creatinine clearance) at initiation of PrEP and annually thereafter (or whenever indicated (symptom directed)).<br/><br/>If creatinine clearance (eGFR) < 50 ml/min do not start PrEP, recheck after 2 weeks. Refer for evaluation of underlying renal disease.<br/><br/>If the renal function returns to normal, reassess for PrEP and initiate/ continue PrEP.<br/><br/>PrEP should not be prescribed for individuals using nephrotoxic drugs like acyclovir, aminoglycosides, retinoids etc. instead, offer alternative HIV prevention services. |\n| Pregnancy or Breastfeeding             | Pregnancy and breastfeeding are not contraindications to provision of PrEP.<br/><br/>Pregnant or breastfeeding women whose sexual partners are HIV positive or are at high risk of HIV infection may benefit from PrEP as part of combination prevention of HIV infection.<br/><br/>PrEP is also indicated for HIV-negative women in sero-different partnerships who wish to conceive. PrEP in these situations can be prescribed during the pre-conception period and throughout pregnancy to reduce risk of sexual HIV                                                                                                                                                                                                                                                                                                                                                                                                                                                                                                         |""]","The recommended PrEP regimen for men who have sex with men is Daily Oral PrEP, with the preferred antiretroviral regimen being Tenofovir 300mg/Emtricitabine 200mg (TDF/FTC) given as one fixed dose combination tablet orally daily. Additionally, Event-Driven (ED) PrEP is an option for those not taking exogenous estradiol-based gender affirming hormones.",0.75,0.9999999999999992,11.0,llm,gpt-3.5-turbo-0125
How often should viral load be monitored?,"['## 3.6 Summary of clinical and laboratory monitoring of PLHIV on ART\n\nTable 3.6 summarizes the recommended minimum routine follow-up schedule for PLHIV. Additional clinical and laboratory follow-up should be performed whenever clinically indicated\n\n### Table 3.6: Summary of Clinical and Laboratory Monitoring for PLHIV¹\n\n|                                          | Initial Visit | ART preparation                                                                                                                                                                                                                                                                                                                                                                                                                                                                                     | Week (After ART) | Months (after ART) | Months (after ART) | Months (after ART) | Months (after ART) | Months (after ART) | Months (after ART) | ≥ 6 months                              |\n| ---------------------------------------- | ------------- | --------------------------------------------------------------------------------------------------------------------------------------------------------------------------------------------------------------------------------------------------------------------------------------------------------------------------------------------------------------------------------------------------------------------------------------------------------------------------------------------------- | ---------------- | ------------------ | ------------------ | ------------------ | ------------------ | ------------------ | ------------------ | --------------------------------------- |\n| Appointment²,³                           |               | Every week⁴                                                                                                                                                                                                                                                                                                                                                                                                                                                                                         | 2                | 4                  | 2                  | 3                  | 4                  | 5                  | 6                  | Every 1-6 months depending on stability |\n| History and physical exam⁵               | ✔             | ✔                                                                                                                                                                                                                                                                                                                                                                                                                                                                                                   | ✔                | ✔                  | ✔                  | ✔                  | ✔                  | ✔                  | ✔                  | At each clinical visit                  |\n| Adherence assessment and support⁶        | ✔             | ✔                                                                                                                                                                                                                                                                                                                                                                                                                                                                                                   | ✔                | ✔                  | ✔                  | ✔                  | ✔                  | ✔                  | ✔                  | At each visit                           |\n| TB Screening                             | ✔             | Every visit, using ICF screening tool                                                                                                                                                                                                                                                                                                                                                                                                                                                               |                  |                    |                    |                    |                    |                    |                    |                                         |\n| CD4 count                                | ✔             | * Baseline, and then only if patient develops treatment failure (to assess for risk of OIs), or if defaults from care (off ART) for at least 6 months\n* For patients on prophylaxis using dapsone (documented CTX allergy), repeat CD4 every 6 months until CD4 >200 cells/mm³ for two consecutive measures 6 months apart and VL undetectable, after which dapsone and CD4 monitoring can be discontinued                                                                                          |                  |                    |                    |                    |                    |                    |                    |                                         |\n| HIV Viral Load                           |               | - For PCR positive HEIs: baseline at the time of ART initiation\n- Age 0-24 years: at month 3, then every 6 months\n- Age ≥ 25 years: at month 3, then month 12, then annually thereafter if suppressed\n- For all: before any drug substitution for patients on ART for at least 6 months with no valid VL, at month 3 after regimen modification, and then as per population group\n- Any patient with a detectable VL during routine monitoring, follow viral load monitoring algorithm (Figure 6.6) |                  |                    |                    |                    |                    |                    |                    |                                         |\n| HIV Viral Load (pregnant/ breastfeeding) |               | * If on ART at time of confirming pregnancy: VL done at confirmation of pregnancy (regardless of when previously done), then every 6 months until complete cessation of breastfeeding\n* If starting ART during pregnancy or breastfeeding, VL at 3 months after initiation, and then every 6 months until complete cessation of breastfeeding                                                                                                                                                       |                  |                    |                    |                    |                    |                    |                    |                                         |', '# Annex 8: HIV Education and Adherence Counselling Content Guide\n\n| HIV Education and Adherence Counselling                                                   |   |\n| ----------------------------------------------------------------------------------------- | - |\n| Note: for children/adolescents, the script below should be modified towards the caregiver |   |\n\n\n| Section 1: Introductions, climate setting, and review of objectives for the session                                                                                                                                                                                                                                                                                                                                                                                                                                                  |\n| ------------------------------------------------------------------------------------------------------------------------------------------------------------------------------------------------------------------------------------------------------------------------------------------------------------------------------------------------------------------------------------------------------------------------------------------------------------------------------------------------------------------------------------ |\n| * Ensure privacy and confidentiality\n* Introductions of all participants\n* Present the key message for each section using simple terms that the patient will understand, using analogies as appropriate\n* Use IEC material when available\n* Ask the patient if they have any questions at the end of each section, and then ask them to explain the main points back to you to confirm understanding\n* If this is a follow-up session, review what they remember from previous sessions and adapt the session to address their needs |\n\n\n| Section 2: HIV                                                                                                                                                                                                                                                                                                                                                                                                                                                                                                                                                                                                                                                                                                                                                                                                                      |\n| ----------------------------------------------------------------------------------------------------------------------------------------------------------------------------------------------------------------------------------------------------------------------------------------------------------------------------------------------------------------------------------------------------------------------------------------------------------------------------------------------------------------------------------------------------------------------------------------------------------------------------------------------------------------------------------------------------------------------------------------------------------------------------------------------------------------------------------- |\n| * What is HIV\n\n  * HIV stands for ""Human Immunodeficiency Virus""\n  * HIV is a virus that attacks the body\'s immune system. The immune system protects the body from infections\n\n* How is HIV transmitted\n\n  * Sexual contact\n  * Needles\n  * Exchange of blood and bodily fluids\n  * Mother-to-child transmission\n\n* Why should family members be tested for HIV\n\n  * Sexual partners are at risk for already having HIV\n  * All children born to HIV positive mothers are at risk for already having HIV\n  * Encouraging partners/children to test for HIV now is the best way to identify HIV early, so they can also get into treatment\n  * Starting treatment early will help them live long and productive lives\n  * Whether they test positive or negative, they can be an important source of support for your own treatment |\n\n\n\n\n# Annex 8: Cont.\n\n# Section 3: Viral load\n\n- What is viral load\n- Viral load is the amount of HIV in your body\n- When your viral load is high it means you have a lot of HIV in your body; this causes damage to your body\n- Viral load is measured by a blood test\n- How often is viral load measured\n- Viral load is measured after being on treatment for 3 months\n- After 3 months of treatment, we expect the amount of virus in your body to be undetectable; if your VL is detectable then we have to discuss the reasons\n- Having an “undetectable” VL means the test cannot measure the virus in your blood because your ART is working, but it does not mean you are no longer infected with HIV\n- Repeat viral load tests are done depending on how you are doing; if you are doing well on treatment then the viral load is measured again every 6 months (for children/adolescents and pregnant/breastfeeding) or annually\n- For HEI with positive PCR, we also measure viral load at the start of treatment\n- What do viral load measurements mean\n- After being on treatment for 3 or more months, your viral load should be undetectable\n- If your viral load is undetectable, it means your treatment is working well and you should continue taking it the same; the virus is not damaging your body any more\n- If your viral load is detectable, it means your treatment is not working properly, usually because you have been missing some of your pills; the virus is damaging your body and you and the clinic team will need to work together to figure out how to fix the problem\n\n# Section 4: CD4 cells\n\n- What are CD4 cells\n- CD4 cells are the immune cells that protect the body from infections\n- CD4 cells are measured through a blood test, called CD4 count. For adults a normal CD4 count is above 500\n- How are CD4 cells affected by HIV\n- HIV attacks and destroys CD4 cells\n- After years of constant attack from HIV, the CD4 count falls\n- What happens when CD4 cells decrease\n- When the CD4 count falls too low (usually below 200), diseases called “opportunistic infections” are able to infect the body because the body cannot defend itself\n- Common opportunistic infections include: tuberculosis, pneumonia, skin problems, white spots in the mouth, and chronic diarrhoea\n- How often is CD4 count measured\n- CD4 count is measured for all patients at the beginning of treatment, to see if you are likely to get any opportunistic infections\n- Once you start treatment for HIV, we do not need to check CD4 count frequently, but we will use\n\n# Annex 8: Cont.', '## 3.5 Follow-up of PLHIV after ART initiation\n\nFollow-up of patients on ART is determined by the duration the patient has been on treatment, how well they understand the treatment and their response to ART. Follow-up includes scheduled clinical appointments, unscheduled clinical assessments for patients with concerns/complaints, routine and as-needed laboratory monitoring.\n\n\n\n## 3.5.1 First 6 months after ART initiation\n\nAfter ART initiation, patients need to be monitored closely for development of adverse drug events, identify and address barriers to adherence, and development of IRIS. A reasonable follow-up schedule for most patients is 2 weeks and 4 weeks after ART initiation (Table 3.5 and 3.6).\n\nWhen possible, follow-up for a particular patient should be provided by the same care provider or team of care providers (e.g., same clinician and same counsellor) at every visit. This is particularly important during the first 6 months in care.\n\n## 3.5.2 Differentiated Service Delivery for Patients beyond the 1st 6 months of ART\n\nFollow up of patients beyond 6 months of ART is described in table 3.5. It also provides the criteria for determining if a patient is established on ART.\n\nIn summary:\n\n- Patients who are not established on ART require closer follow-up.\n- Patients who are established on ART require less frequent facility follow-up, with up to six months between clinical appointments\n\n### Table 3.5: Differentiated Follow-up of Patients Beyond the First 6 Months of ART\n\n| Patients NOT established on ART                                                                                                                                                                                                                                       | Patients NOT established on ART                                                                                                                                                                                                                                                                                                                                                                                                                                                                                                                       |\n| --------------------------------------------------------------------------------------------------------------------------------------------------------------------------------------------------------------------------------------------------------------------- | ----------------------------------------------------------------------------------------------------------------------------------------------------------------------------------------------------------------------------------------------------------------------------------------------------------------------------------------------------------------------------------------------------------------------------------------------------------------------------------------------------------------------------------------------------- |\n| Patients with any of the following:- On treatment for < 6 months\n- Any active OIs (including TB) in the previous 6 months\n- Poor or questionable adherence to scheduled clinic visits in the previous 6 months.\n- Most recent VL ≥ 200 copies/ml\n- Children < 2 years |                                                                                                                                                                                                                                                                                                                                                                                                                                                                                                                                                       |\n| Package of Care                                                                                                                                                                                                                                                       | * Standard Package of Care\n* Case management to address reason/s for not being established on ART                                                                                                                                                                                                                                                                                                                                                                                                                                                     |\n| Focus of Counselling                                                                                                                                                                                                                                                  | - ART is the most important treatment to maintain good health and an active life\n- ART will reduce the risk of transmitting HIV to others                                                                                                                                                                                                                                                                                                                                                                                                             |\n| Frequency of Follow-up                                                                                                                                                                                                                                                | * Every 1-3 months, based on clinical judgment\n* Additional visits as required to address any medical or psychosocial concerns\n* If VL is detectable at 3 months they will need additional assessments for and management of the reason/s for detectable viral load, with close follow-up until viral suppression is achieved (Chapter 5).\n* Patients with confirmed viral suppression can be followed up every 3-6 months based on patient preference and clinician judgment, with additional unscheduled visits any time the patient has a concern. |\n\n\n\n\n\n# Table 3.5 Cont.\n\nPatients Established on ART\n\nPatients established on ART must have achieved ALL the following:\n\n- On their current ART regimen for ≥ 6 months\n- Currently no active Illness or in the previous 6 months (patients with well controlled chronic conditions should not be excluded)\n- Adherent to scheduled clinic visits for the previous 6 months\n- VL ≤200 copies/ml (LDL) within the last 6 months\n\nNote:\n\n- This definition should be applied to all populations, including those receiving second- and third-line regimens, those with controlled comorbidities, children above 2 years*, adolescents, pregnant and breastfeeding women, and key populations.\n- The client’s category can change at any time so there is a need for a reassessment at each visit. Clients should be categorized at every visit and managed based on their status.\n\nPackage of Care:\n\n- Standard Package of Care\n- Re-assessment of criteria at every clinical visit\n\nLocation of Services:\n\n- Clinical review and ART prescription from any ART service delivery point; all facility levels\n- Distribution of ART between clinical appointments, which can be facility-based or community-based\n\nFocus of Counselling:\n\n- Encourage patient to continue with what is working\n- Reminders that any significant life event or change in daily routine could interfere with adherence\n\nFrequency of Follow-up:\n\n- Clinic appointments to be made at 6 months intervals\n- ART should be offered as refills lasting 3 months, (through fast-track pick-up at facility or through community-based distribution). Patients on injectable contraception should be provided FP through a fast-tracked process between clinic follow-up visits; oral contraceptives and condoms should be distributed with ART\n- Additional visits as required to address any medical or psychosocial concerns\n- Closer follow-up may be arranged based on patient preference\n\n* Children below 2 years are excluded as they require frequent dose adjustment']","Viral load should be monitored every 6 months for children/adolescents and pregnant/breastfeeding individuals, and annually for others.",0.8,0.9598543357837276,6.26,llm,gpt-3.5-turbo-0125
What is the preferred first-line regimen for adults?,"[""# Antiretroviral Therapy in Infants, Children, Adolescents, and Adults\n\n## 6.3 First-Line ART for Infants, Children, Adolescents and Adults (including Pregnant and Breastfeeding Women)\n\nThe recommendations below apply to patients who are starting ART for the first time. Preferred and alternative first line regimens are shown in Tables 6.2 and 6.3. ARVs for infant prophylaxis are presented in the PMTCT chapter in Tables 7.3 to 7.6.\n\n**All patients must have their weight documented at every visit. Children and adolescents less than 15 years must have correct weight-based dosing of ARVs confirmed at every visit.**\n\nInfants and children depend on their caregivers for adherence to medication. Caregivers should be adequately prepared for their role of administering ARVs to infants and children, including addressing anticipated challenges such as drug palatability. It can be helpful for more than one caregiver to be informed about a child's HIV status and receive instruction on administration of ART.\n\n**Caregivers should always be shown and then asked to demonstrate how to measure and administer ARVs. This should be done both at the time of prescribing the ART (by the clinician) and at the time of dispensing the ART. Clinicians should ensure that the caregiver accompanying a child for clinical review is the same caregiver responsible for day-to-day ART administration.**\n\n### Table 6.2: Preferred First-line ART Regimens and Dosing for Children, Adolescents and Adults<sup>1</sup>\n\n| Age                     | Weight  | Preferred Regimen  | Dosing (correct weight-based dosing must be confirmed at every visit) |\n| ----------------------- | ------- | ------------------ | --------------------------------------------------------------------- |\n| Birth to 4 weeks        | Any     | AZT + 3TC + NVP3   | Refer to Annex 10 for weight-based dosing                             |\n| > 4 weeks to < 15 years | < 30 kg | ABC + 3TC + DTG4   | Refer to Annex 10 for weight-based dosing                             |\n|                         | ≥ 30 kg | TDF + 3TC + DTG5,6 | TDF/3TC/DTG (300/300/50mg): 1 tab once daily                          |\n| ≥ 15 years              | Any     | TDF + 3TC + DTG5,6 | TDF/3TC/DTG (300/300/50mg): 1 tab once daily                          |\n\n\n1. Patients currently on first-line regimens that are not included in the indicated preferred (Table 6.2) or alternative (Table 6.3) regimens should be considered for regimen optimization as per Section 6.5.1\n2. See Annex 10 for weight-based dosing of all single-drug and fixed-dose combination formulations\n3. Infants who initiate ART at less than 4 weeks of age should initiate on AZT+3TC+NVP irrespective of previous ART exposure; metabolism of other ARVs is not well known for this age group. As soon as these infants become 4 weeks old, they should switch to ABC/3TC+DTG (dosing included in Annex 10). Consult the Regional or National HIV Clinical TWG (Uliza Hotline 0726 460 000, ulizanascop@gmail.com) in case of pre-term infants\n4. Once adolescents reach 30 kg, if virally suppressed they should be considered for transition as per Figure 6.2\n5. TAF may become the preferred NRTI once fixed-dose combinations are available\n6. DTG/3TC dual therapy may be considered for HBV-negative patients once fixed-dose combinations are available"", '# 1.4 Adherence Preparation, Monitoring and Support\n\n- The adherence preparation, monitoring, and support that a patient requires should be tailored to their level of adherence and the stage of ART initiation and follow-up.\n- All patients with durable viral suppression (2 consecutive viral load results with &#x3C;50 copies) should be offered messaging on Undetectable=Untransmittable (U=U).\n- Whenever possible, follow-up should be provided by the same care provider or team of care providers (e.g., same clinician and counsellor) at every visit. This is particularly important during the first 3 months in care.\n- For all children/adolescents, the level of disclosure should be assessed at the first visit. Ongoing care should include a plan for age-appropriate disclosure.\n- All patients are at risk of new or worsening barriers to adherence, so adherence monitoring, counselling and support should continue despite viral suppression.\n- Every service delivery point that is providing ARVs for patients (whether ART, PEP, or PrEP) must have a functional system for identifying patients who miss appointments and for taking action within 24 hours of a missed appointment.\n- In patients failing ART, do not change regimens until the reason/s for treatment failure have been identified and addressed (which should be done urgently using a case-management approach).\n\n# 1.5 Antiretroviral Therapy for Infants, Children, Adolescents, and Adults\n\n- The goal of ART is to suppress viral replication with the aim of reducing the patient’s VL to undetectable levels (Viral Load &#x3C;50 copies/LDL).\n- All individuals with confirmed HIV infection are eligible for ART, irrespective of CD4 count/%, WHO clinical stage, age, pregnancy or breastfeeding status, co-infection status, risk group, or any other criteria, provided that the individual is willing and ready to start ART.\n- ART should be started in all patients as soon as possible, even on the same day as confirming their HIV diagnosis (and preferably within 2 weeks).\n- Preferred first-line ART for infants, children, adolescents and adults:\n- Birth to 4 weeks: AZT + 3TC + NVP\n- > 4 weeks to &#x3C; 15 years old:\n- &#x3C; 30 kg: ABC + 3TC + DTG\n- ≥ 30 kg: TDF + 3TC + DTG\n- ≥ 15 years old: TDF + 3TC + DTG\n- Children and adolescents who are virally suppressed but are NOT on the preferred first-line ART regimen should be assessed for transition and transitioned to the preferred regimen.\n- Treatment failure is suspected when a patient has a VL ≥ 1000 copies/ml after at least 3 months of using ART. Treatment failure is only confirmed when VL is ≥ 1,000 copies/ml after assessing for and addressing poor adherence or other reasons for high VL, and then.', '# 1. Summary of Key Recommendations\n\n## 1.1 HIV Testing Services (HTS) and Linkage to Treatment and Prevention\n\n- HIV testing should be voluntary and conducted ethically in an environment where Consent, Confidentiality, Counselling, Correct results, Connection (linkage) and Creating an enabling environment can be assured\n\n- To optimize access to testing services, HIV testing can be conducted in 2 different settings:\n  - Facility-based\n  - Community-based\n\n- Targeted HIV testing is recommended which involves index client listing of contacts, HIV self-testing and use of HTS screening tool to identify people at risk of HIV infection as eligible for testing\n\n- Serial testing, using approved rapid HIV antibody testing kits, is used to diagnose HIV infection in children older than 18 months, adolescents, and adults. An HIV-positive diagnosis will be made using three consecutive reactive assays\n\n## 1.2 Initial Evaluation and Follow-up for PLHIV\n\n- Initial clinical evaluation of PLHIV entails CD4 monitoring, which is recommended for:\n  - Baseline investigation for all PLHIV\n  - Any patient with suspected treatment failure\n  - Any patient returning to care after interrupting treatment for >3 months\n  - Any patient on fluconazole maintenance therapy or on dapsone as prophylaxis, to determine when prophylaxis can be discontinued\n\n- Advanced HIV Disease is defined as:\n  - Adults, adolescents, and children five years and older as having a CD4 cell count of less than 200 cells/mm³ or\n  - WHO clinical stage 3 or 4 disease\n  - All children younger than five years\n\n- All PLHIV presenting with Advanced HIV Disease (AHD) should be offered a package of care that includes timely initiation of ART, screening, diagnosis, prophylaxis, and management of opportunistic infections.\n\n- Frequency of routine VL monitoring:\n  - For PCR positive HEIs: at baseline (at the time of ART initiation)\n  - Age 0-24 years old: 3 months after ART initiation, and then every 6 months\n\n\n▪ Pregnant or breastfeeding: at confirmation of pregnancy (if already on ART) or 3 months after ART initiation (if ART initiated during pregnancy/breastfeeding), and then every 6 months until complete cessation of breastfeeding\n\n▪ Before any drug substitution (if no VL result available from the prior 6 months)\n\n▪ Three months after any regimen modification (including single-drug substitution)\n\n● PLHIV should receive differentiated care based on initial evaluation (advanced vs. well) and follow up (established vs not established on ART)\n\n# 1.3 Standard Package of Care for PLHIV\n\nConsists of 8 components:\n\n1. Antiretroviral Therapy\n- All PLHIV are eligible for ART irrespective of CD4 cell count or percentage, WHO clinical stage, age, pregnancy status, or comorbidities\n- ART should be initiated as soon as the patient is ready to start, preferably within two weeks from time of HIV diagnosis (except for patients with cryptococcal meningitis or TB meningitis)\n2. Positive Health, Dignity, and Prevention, GBV/IPV &#x26; HIV Education and Counselling\n- All patients should be counselled and supported for disclosure of HIV status; partner/ family testing and engagement; condom use; family planning; sexually transmitted infections screening; treatment adherence; and pre-exposure prophylaxis for HIV-negative sexual partners\n- All females aged 15-49 years and emancipated minors accessing HIV care services should be screened for Intimate Partner Violence (IPV) as part of the standard package of care\n- All PLHIV should be provided with HIV education and counselling\n3. Screening for and Prevention of Specific Opportunistic Infections\nCotrimoxazole Preventive Therapy (CPT) is no longer recommended as life-long prophylaxis, and is only recommended in the following sub populations, unless they have an allergy to sulfur drugs or develop toxicity from CPT:\n\n- All HIV Exposed Infants\n- HIV infected children &#x3C; 15 years of age\n- All PLHIV > 15 years of age:\n- Living in malaria-endemic zones (Refer to the National Guidelines for the Diagnosis, Treatment and Prevention of Malaria in Kenya for the current Kenya Malaria endemicity map)\n- Presenting with WHO stage 3 or 4 event, or meeting the AHD criteria\n- Suspected treatment failure\n- All Pregnant and Breast-feeding women']",The preferred first-line regimen for adults starting ART for the first time is TDF + 3TC + DTG.,1.0,0.9497378181906878,10.36,llm,gpt-3.5-turbo-0125
Can pregnant women use dolutegravir?,"[""## 7.1 Antiretroviral Therapy for HIV-positive Pregnant and Breastfeeding Women and Infant Prophylaxis\n\nThe goal of ART for HIV positive pregnant women is two-fold: to restore and maintain the mother's immune function and therefore general health, and secondly, to prevent transmission of HIV in utero, at labour and delivery and during breastfeeding. To achieve this goal, the mother must take effective antiretroviral therapy to achieve viral suppression. Table 7.2 summarizes recommendations for use of ART for HIV positive pregnant women.\n\n### Table 7.2: Summary of Use of ART for HIV Positive Pregnant and Breastfeeding Women\n\n| Overall recommendations             | Overall recommendations                                                                                                                                                                                                                                                                                                                                                                                                                                                                                                                                                                                                                                                                                                                                                                                                                                                                                                                                                                                                                                                                                                                                                                                                                                                                                                                                                                                                                              |\n| ----------------------------------- | ---------------------------------------------------------------------------------------------------------------------------------------------------------------------------------------------------------------------------------------------------------------------------------------------------------------------------------------------------------------------------------------------------------------------------------------------------------------------------------------------------------------------------------------------------------------------------------------------------------------------------------------------------------------------------------------------------------------------------------------------------------------------------------------------------------------------------------------------------------------------------------------------------------------------------------------------------------------------------------------------------------------------------------------------------------------------------------------------------------------------------------------------------------------------------------------------------------------------------------------------------------------------------------------------------------------------------------------------------------------------------------------------------------------------------------------------------- |\n| When to start                       | ART should be initiated in all pregnant and breastfeeding women living with HIV, regardless of gestation, WHO clinical stage and at any CD4 cell count and continued lifelong. ART should be started, ideally, on same day as HIV diagnosis after readiness assessment with ongoing enhanced adherence support including community-based case management and support.                                                                                                                                                                                                                                                                                                                                                                                                                                                                                                                                                                                                                                                                                                                                                                                                                                                                                                                                                                                                                                                                                |\n| What to start with (first-line ART) | TDF/3TC/DTG                                                                                                                                                                                                                                                                                                                                                                                                                                                                                                                                                                                                                                                                                                                                                                                                                                                                                                                                                                                                                                                                                                                                                                                                                                                                                                                                                                                                                                          |\n| Infant prophylaxis                  | * AZT+NVP for 6 weeks, NVP should be continued until 6 weeks after complete cessation of breastfeedingFor more comprehensive information Refer to Table 7.3                                                                                                                                                                                                                                                                                                                                                                                                                                                                                                                                                                                                                                                                                                                                                                                                                                                                                                                                                                                                                                                                                                                                                                                                                                                                                          |\n| Monitoring                          | **Viral load monitoring during pregnancy and breast-feeding (Figure 6.6)*** Whenever possible, use same-day point-of-care methods for viral load testing of pregnant and breastfeeding women to expedite the return of results and clinical decision-making. If this is not available, viral load specimens and results for pregnant and breastfeeding women should be given priority across the laboratory referral process (including specimen collection, testing and return of results).\n\n* For pregnant and breastfeeding women newly initiated on ART, obtain VL 3 months after initiation, and then every 6 months until complete cessation of breastfeeding\n\n* For HIV positive women already on ART at the time of confirming pregnancy or breastfeeding, obtain a VL irrespective of when prior VL was done, and then every 6 months until complete cessation of breastfeeding\n\n* For pregnant or breastfeeding women with a VL ≥ 50 copies/ml: assess for and address potential reasons for viremia, including intensifying adherence support, repeat the VL after 3 months of excellent adherence, including daily witnessed ingestion, where feasible and appropriate\n\n  * If the repeat VL is 200 - 999 copies/ml consult the Regional or National HIV Clinical TWG\n  * If the repeat VL is ≥ 1,000 copies/ml, change to an effective regimen. Refer to Table 6.10\n  * If the repeat VL is < 200 copies/ml (LDL) then continue routine |"", '# Table 6.4 Cont.\n\n# Pregnancy Safety of DTG\n\n- DTG is safe during pregnancy and breastfeeding. Pregnancy intention should be discussed with all women initiating ART regardless of regimen. Women who do not wish to become pregnant should be offered appropriate family planning counseling and methods.\n\n# Important Drug Interactions with DTG\n\n- Rifampicin\n- Rifampicin lowers DTG levels: increase DTG to 50 mg twice daily for patients on rifampicin who are > 20 kg in body weight. Children &#x3C;20 kg taking DTG who require rifampicin should increase their weight-appropriate DTG dose to twice daily.\n- There are no significant drug interactions between DTG and other currently used anti-TB medications (including for MDR-TB).\n- Mineral supplements, including: antacids containing calcium, zinc, magnesium or aluminum; iron supplements; prenatal vitamins (which contain iron and calcium)\n- These supplements decrease the absorption of DTG: administer DTG at least 2 hours before or 6 hours after taking any of these supplements.\n- Dose separation is not required for calcium and iron supplements (including prenatal vitamins) if DTG is taken with a meal.\n- It is critical to educate patients about this important drug interaction because many patients get these supplements and antacids over-the-counter without informing their healthcare provider.\n- Carbamazepine, phenobarbital, phenytoin\n- These anticonvulsants decrease DTG levels: use a different anticonvulsant if available.\n- If DTG must be co-administered with these drugs then increase to DTG to twice daily, although there is little data to guide this.\n- If valproic acid is available this can be used with DTG without dose adjustment.\n- Metformin\n- DTG increases levels of metformin; the levels of DTG are not affected: use a lower dose of metformin (often 50% of usual dose) and monitor glycemic control. Use a maximum daily dose of metformin 1 g.\n- Other drug-drug interactions with DTG\n- See Annex 13C.\n\n\n\n# 6.5 Monitoring and Changing ART\n\nThe objectives of clinical and laboratory monitoring during ART are to identify and treat inter-current illnesses, assess for and manage adverse drug reactions, and evaluate response to treatment. Routine laboratory monitoring recommendations are described in Table 3.5; however, additional investigations should be ordered whenever there is clinical suspicion for which a laboratory test result may alter patient management.\n\nIndications for changing ART include optimizing therapy for patients who have undetectable viral load, managing adverse drug reactions or toxicity, drug-drug interactions, co-morbidities and treatment failure.\n\n# 6.5.1 Optimizing Therapy for Patients who have suppressed viral load on First Line ART\n\nPatients who are virally suppressed on first line ART may benefit from regimen optimization even if they are currently tolerating their regimen well and have no drug-drug interactions requiring a change. Regimen modifications may be done for age/weight transitions among children and adolescents &#x3C;15 years and to simplify a regimen, prevent long-term toxicity and improve cost-effectiveness. Dolutegravir has been shown to have superior tolerability and efficacy compared to efavirenz and lopinavir and is now preferred as part of first line ART for children, adolescents and adults. While most adults in Kenya have switched over to a DTG-containing regimen, proactive switching of children is now also recommended with the availability of a pediatric dispersible dolutegravir tablet.\n\nChildren and adolescents with suppressed viral load on first line ART and not on the recommended first line regimen as per Table 6.2 should be considered for optimization as per Figures 6.1 and 6.2, such as when children grow and enter a new weight band. This also includes PLHIV who recently initiated non-standard therapy (less than 3 months ago, before the first VL is due). Decisions on regimen modification should be made following discussion with the patient/caregiver.\n\nAlways discuss the possibility of new side effects when changing to a new ARV, particularly side effects common to all ARVs (headache, nausea, diarrhea) and any side effects specific to the new ARV. Reassure patients that most side effects resolve with continued use after 1-2 weeks.', '# 6.4 Dosing and Administration of Dolutegravir (DTG)\n\nDTG is preferred in first line ART (in combination with other ARVs) for children, adolescents and adults. DTG is well tolerated, highly efficacious, has a high genetic barrier to resistance and fewer drug-drug interactions.\n\nRecommended Dosing of DTG\n● &#x3C; 20 kg body weight: Use weight-based dosing with dispersible 10mg DTG tablets as per Annex 10\n● ≥ 20 kg body weight: DTG 50 mg film-coated tablet once daily, preferably as a morning dose. It is also available as part of FDC. Those unable to swallow the film coated tablets whole refer to Annex 10\n● For patients taking rifampicin: Increase DTG dosing frequency to twice daily for duration of rifampicin-containing TB treatment and for an additional 2 weeks after TB treatment is completed, then revert to once daily. (The additional 2 weeks of higher-dose DTG is to counter the ongoing liver enzyme induction effect of rifampicin, which continues for a short period after TB treatment is completed)\n● For patients with suspected or confirmed INSTI resistance (e.g., patients with prior history of failing a RAL-based regimen): use DTG twice daily\n● DTG can be taken with or without food\n\n# Common Side Effects of DTG\n\n- The most common side effects of DTG are headache, nausea and diarrhea. These side effects usually resolve after continued use for 1-2 weeks. It is critical to inform patients / caregivers about these potential side effects and their temporary nature, and encourage them to continue their ART and consult a HCW if concerned.\n- Some patients on DTG are more likely to develop insomnia. This may be reduced by taking DTG as a morning dose, or by taking DTG with a low-fat meal or on an empty stomach.\n- DTG may cause a small rise in serum creatinine levels but this does NOT represent a true decline in renal function.\n- Integrase inhibitors, including DTG, are associated with increased weight gain. Counsel patients about healthy eating and physical activity and the benefits of maintaining a healthy weight.\n\n1 For other scenarios that are not covered in this table, discuss as an MDT and consult the Regional or National HIV Clinical TWG (Uliza Hotline 0726 460 000; https://nhcsc.nascop.org/clinicalform)\n\n2 ABC hypersensitivity reaction (AHR) is rare in the Kenyan population. Table 6.9 provides the definition and management of AHR\n\n3 The additional 2 weeks of higher-dose DTG is to counter the ongoing liver enzyme induction effect of rifampicin, which continues for a short period after TB treatment is completed\n\n4 TAF may become the preferred NRTI once fixed-dose combinations are available\n\n5 DTG/3TC dual therapy may be considered for HBV-negative patients once fixed-dose combinations are available']","Yes, pregnant women can use dolutegravir (DTG). It is safe to use during pregnancy and is part of the recommended first-line antiretroviral therapy (ART) for pregnant and breastfeeding women.",1.0,0.9705856583289649,9.54,llm,gpt-3.5-turbo-0125
